ffff880087a2e780 3905433488 S Ci:6:005:0 s 80 06 0100 0000 0012 18 <
ffff880087a2e780 3905436648 C Ci:6:005:0 0 18 = 12010002 00000040 6a051903 02010102 0001
ffff880134296600 3905436698 S Ci:6:005:0 s 80 06 0600 0000 000a 10 <
ffff880134296600 3905438667 C Ci:6:005:0 -32 0
ffff880087a2e780 3905438744 S Ci:6:005:0 s 80 06 0600 0000 000a 10 <
ffff880087a2e780 3905440636 C Ci:6:005:0 -32 0
ffff880087a2e780 3905440660 S Ci:6:005:0 s 80 06 0600 0000 000a 10 <
ffff880087a2e780 3905443616 C Ci:6:005:0 -32 0
ffff880087a2e780 3905444373 S Ci:6:005:0 s 80 06 0200 0000 0009 9 <
ffff880087a2e780 3905446655 C Ci:6:005:0 0 9 = 09026d00 04010080 31
ffff880134296900 3905446710 S Ci:6:005:0 s 80 06 0200 0000 006d 109 <
ffff880134296900 3905451825 C Ci:6:005:0 0 109 = 09026d00 04010080 31090400 00010300 00000921 10010001 22630007 05810310
ffff880087a2e780 3905451915 S Ci:6:005:0 s 80 06 0300 0000 00ff 255 <
ffff880087a2e780 3905454648 C Ci:6:005:0 0 4 = 04030904
ffff8801342969c0 3905454698 S Ci:6:005:0 s 80 06 0302 0409 00ff 255 <
ffff8801342969c0 3905457827 C Ci:6:005:0 0 42 = 2a034200 61006d00 62006f00 6f002000 50006100 64002c00 20007700 69007200
ffff880087a2e780 3905457912 S Ci:6:005:0 s 80 06 0301 0409 00ff 255 <
ffff880087a2e780 3905460823 C Ci:6:005:0 0 30 = 1e035700 61006300 6f006d00 20004300 6f002e00 2c004c00 74006400 2e00
ffff880134296900 3905461272 S Co:6:005:0 s 00 09 0001 0000 0000 0
ffff880134296900 3905462647 C Co:6:005:0 0 0
ffff88013680ea80 3905462917 S Ci:6:005:0 s 81 06 2200 0000 0063 99 <
ffff88013680ea80 3905464685 C Ci:6:005:0 0 99 = 050d0901 a1018503 0902a100 15002501 75010942 09440945 093c9504 81029501
ffff88013680e6c0 3905465109 S Co:6:005:0 s 21 09 0302 0000 0002 2 = 0202
ffff88013680e6c0 3905465615 C Co:6:005:0 0 2 >
ffff880134296600 3905465898 S Ii:6:005:1 -115:4 0
ffff880028aa9cc0 3905466009 S Ci:6:005:0 s 81 06 2200 0001 0081 129 <
ffff880028aa9cc0 3905467803 C Ci:6:005:0 0 129 = 05010902 a1018505 0901a100 05091901 29051500 25019505 75018102 95038101
ffff88000bda5cc0 3905468330 S Ci:6:005:0 s 81 06 2200 0002 002b 43 <
ffff88000bda5cc0 3905469634 C Ci:6:005:0 0 43 = 05010906 a1018506 050719e0 29e71500 25017501 95088102 150026ff 0019002a
ffff88000bda5d80 3905469885 S Co:6:005:0 s 21 09 0302 0002 0002 2 = 0202
ffff88000bda5d80 3905470638 C Co:6:005:0 0 2 >
ffff8800356bc000 3905470808 S Ci:6:005:0 s 81 06 2200 0003 0035 53 <
ffff8800356bc000 3905471616 C Ci:6:005:0 0 53 = 060dff09 01a10185 10a10006 00ff0901 150026ff 00750895 1f8102c0 09018511
ffff88000bda5d80 3905471819 S Co:6:005:0 s 21 09 0302 0003 0002 2 = 0202
ffff88000bda5d80 3905472619 C Co:6:005:0 0 2 >
ffff880134296600 3905473609 C Ii:6:005:1 -2:4 0
ffff880134296600 3905497361 S Ii:6:005:1 -115:4 0
ffff880134296600 3905526613 C Ii:6:005:1 -2:4 0
ffff880134296600 3905548241 S Ii:6:005:1 -115:4 0
ffff880134296600 3905558638 C Ii:6:005:1 -2:4 0
ffff8800356bc6c0 3905561993 S Ii:6:005:4 -115:4 0
ffff8800356bc6c0 3905570653 C Ii:6:005:4 -2:4 0
ffff880133df2cc0 3905577184 S Ii:6:005:2 -115:2 64 <
ffff880133df2cc0 3905586832 C Ii:6:005:2 -2:2 0
ffff880133df2cc0 3905593992 S Ii:6:005:2 -115:2 64 <
ffff88000bda5540 3905598521 S Ii:6:005:3 -115:8 0
ffff88000bda5540 3905606637 C Ii:6:005:3 -2:8 0
