ffff88000c893f00 85675196 S Ci:6:004:0 s 80 06 0300 0000 00ff 255 <
ffff88000c893f00 85677729 C Ci:6:004:0 0 4 = 04030904
ffff88000c893f00 85677843 S Ci:6:004:0 s 80 06 0302 0409 00ff 255 <
ffff88000c893f00 85679728 C Ci:6:004:0 0 42 = 2a034200 61006d00 62006f00 6f002000 50006100 64002c00 20007700 69007200
ffff88009c119000 85897991 S Co:6:001:0 s 23 03 0004 0001 0000 0
ffff88009c119000 85898025 C Co:6:001:0 0 0
ffff8801341d8540 85929442 C Ii:6:001:1 0:128 1 = 02
ffff8801341d8540 85929460 S Ii:6:001:1 -115:128 2 <
ffff8801385c5780 85953591 S Ci:6:001:0 s a3 00 0000 0001 0004 4 <
ffff8801385c5780 85953720 C Ci:6:001:0 0 4 = 03010000
ffff88009c119000 86009455 S Co:6:001:0 s 23 01 0014 0001 0000 0
ffff88009c119000 86009485 C Co:6:001:0 0 0
ffff88009c119000 86009521 S Ci:6:000:0 s 80 06 0100 0000 0040 64 <
ffff88009c119000 86012756 C Ci:6:000:0 0 18 = 12010002 00000040 6a051903 02010102 0001
ffff88009c119000 86012803 S Co:6:001:0 s 23 03 0004 0001 0000 0
ffff88009c119000 86012824 C Co:6:001:0 0 0
ffff8801385c5780 86065364 S Ci:6:001:0 s a3 00 0000 0001 0004 4 <
ffff8801385c5780 86065422 C Ci:6:001:0 0 4 = 03010000
ffff8801385c5780 86121375 S Co:6:001:0 s 23 01 0014 0001 0000 0
ffff8801385c5780 86121403 C Co:6:001:0 0 0
ffff8801385c5780 86121416 S Co:6:000:0 s 00 05 0004 0000 0000 0
ffff8801385c5780 86123766 C Co:6:000:0 0 0
ffff8801385c5780 86141572 S Ci:6:004:0 s 80 06 0100 0000 0012 18 <
ffff8801385c5780 86144764 C Ci:6:004:0 0 18 = 12010002 00000040 6a051903 02010102 0001
ffff88009c119000 86144826 S Ci:6:004:0 s 80 06 0200 0000 006d 109 <
ffff88009c119000 86149732 C Ci:6:004:0 0 109 = 09026d00 04010080 31090400 00010300 00000921 10010001 22630007 05810310
ffff88009c119000 86149770 S Co:6:004:0 s 00 09 0001 0000 0000 0
ffff88009c119000 86152753 C Co:6:004:0 0 0
ffff88009c119000 86195037 S Ci:6:004:0 s 80 06 0100 0000 0040 64 <
ffff88009c119000 86196752 C Ci:6:004:0 0 18 = 12010002 00000040 6a051903 02010102 0001
ffff8801385c50c0 86198591 S Co:6:001:0 s 23 03 0004 0001 0000 0
ffff8801385c50c0 86198611 C Co:6:001:0 0 0
ffff8800834876c0 86253586 S Ci:6:001:0 s a3 00 0000 0001 0004 4 <
ffff8800834876c0 86253645 C Ci:6:001:0 0 4 = 03010000
ffff8801385c50c0 86309560 S Co:6:001:0 s 23 01 0014 0001 0000 0
ffff8801385c50c0 86309675 C Co:6:001:0 0 0
ffff8801385c50c0 86309748 S Ci:6:000:0 s 80 06 0100 0000 0040 64 <
ffff8801385c50c0 86313768 C Ci:6:000:0 0 18 = 12010002 00000040 6a051903 02010102 0001
ffff8800834876c0 86313851 S Co:6:001:0 s 23 03 0004 0001 0000 0
ffff8800834876c0 86313906 C Co:6:001:0 0 0
ffff8801385c50c0 86369584 S Ci:6:001:0 s a3 00 0000 0001 0004 4 <
ffff8801385c50c0 86369641 C Ci:6:001:0 0 4 = 03010000
ffff8800834876c0 86425386 S Co:6:001:0 s 23 01 0014 0001 0000 0
ffff8800834876c0 86425425 C Co:6:001:0 0 0
ffff8800834876c0 86425441 S Co:6:000:0 s 00 05 0004 0000 0000 0
ffff8800834876c0 86427771 C Co:6:000:0 0 0
ffff8801385c50c0 86445581 S Ci:6:004:0 s 80 06 0100 0000 0012 18 <
ffff8801385c50c0 86448750 C Ci:6:004:0 0 18 = 12010002 00000040 6a051903 02010102 0001
ffff8800834876c0 86448819 S Ci:6:004:0 s 80 06 0200 0000 006d 109 <
ffff8800834876c0 86453746 C Ci:6:004:0 0 109 = 09026d00 04010080 31090400 00010300 00000921 10010001 22630007 05810310
ffff8800834876c0 86453845 S Co:6:004:0 s 00 09 0001 0000 0000 0
ffff8800834876c0 86456766 C Co:6:004:0 0 0
ffff8801385c5780 86537338 S Ci:6:004:0 s 80 06 0100 0000 0012 18 <
ffff8801385c5780 86538931 C Ci:6:004:0 0 18 = 12010002 00000040 6a051903 02010102 0001
ffff8801385c5780 86541870 S Ci:6:004:0 s 80 06 0200 0000 00ff 255 <
ffff8801385c5780 86544778 C Ci:6:004:0 0 109 = 09026d00 04010080 31090400 00010300 00000921 10010001 22630007 05810310
ffff8800834876c0 86551028 S Ci:6:004:0 s 80 06 0300 0000 00ff 255 <
ffff8800834876c0 86552760 C Ci:6:004:0 0 4 = 04030904
ffff8800834876c0 86555275 S Ci:6:004:0 s 80 06 0302 0409 00ff 255 <
ffff8800834876c0 86557756 C Ci:6:004:0 0 42 = 2a034200 61006d00 62006f00 6f002000 50006100 64002c00 20007700 69007200
ffff8800834876c0 86560536 S Ci:6:004:0 s 80 06 0600 0000 000a 10 <
ffff8800834876c0 86560742 C Ci:6:004:0 -32 0
ffff8800834876c0 86586444 S Ci:6:004:0 s 80 06 0100 0000 0012 18 <
ffff8800834876c0 86587742 C Ci:6:004:0 0 18 = 12010002 00000040 6a051903 02010102 0001
ffff8801385c5780 86594457 S Ci:6:004:0 s 80 06 0200 0000 0009 9 <
ffff8801385c5780 86594743 C Ci:6:004:0 0 9 = 09026d00 04010080 31
ffff8800834876c0 86597692 S Ci:6:004:0 s 80 06 0200 0000 006d 109 <
ffff8800834876c0 86599744 C Ci:6:004:0 0 109 = 09026d00 04010080 31090400 00010300 00000921 10010001 22630007 05810310
ffff8801385c50c0 86603962 S Co:6:004:0 s 00 09 0001 0000 0000 0
ffff8801385c50c0 86604740 C Co:6:004:0 0 0
ffff8800836afb40 86606049 S Ci:6:004:0 s 80 06 0302 0409 0004 4 <
ffff8800836afb40 86606744 C Ci:6:004:0 0 4 = 2a034200
ffff8800836afb40 86609141 S Ci:6:004:0 s 80 06 0302 0409 002a 42 <
ffff8800836afb40 86609744 C Ci:6:004:0 0 42 = 2a034200 61006d00 62006f00 6f002000 50006100 64002c00 20007700 69007200
ffff8800836afb40 86624802 S Ci:6:004:0 s 80 06 0302 0409 0004 4 <
ffff8800836afb40 86626744 C Ci:6:004:0 0 4 = 2a034200
ffff8800836afb40 86629993 S Ci:6:004:0 s 80 06 0302 0409 002a 42 <
ffff8800836afb40 86630763 C Ci:6:004:0 0 42 = 2a034200 61006d00 62006f00 6f002000 50006100 64002c00 20007700 69007200
ffff8800836afb40 86635015 S Ci:6:004:0 s 80 06 0302 0409 0004 4 <
ffff8800836afb40 86635748 C Ci:6:004:0 0 4 = 2a034200
ffff8800836afb40 86638102 S Ci:6:004:0 s 80 06 0302 0409 002a 42 <
ffff8800836afb40 86638740 C Ci:6:004:0 0 42 = 2a034200 61006d00 62006f00 6f002000 50006100 64002c00 20007700 69007200
ffff8800836afb40 86641219 S Ci:6:004:0 s 80 06 0302 0409 0004 4 <
ffff8800836afb40 86641740 C Ci:6:004:0 0 4 = 2a034200
ffff8800836afb40 86644333 S Ci:6:004:0 s 80 06 0302 0409 002a 42 <
ffff8800836afb40 86645743 C Ci:6:004:0 0 42 = 2a034200 61006d00 62006f00 6f002000 50006100 64002c00 20007700 69007200
ffff8800836afb40 86649527 S Co:6:004:0 s 21 0a 0000 0000 0000 0
ffff8800836afb40 86650742 C Co:6:004:0 0 0
ffff8800836afb40 86652650 S Ci:6:004:0 s 81 06 2200 0000 00a3 163 <
ffff8800836afb40 86654739 C Ci:6:004:0 0 99 = 050d0901 a1018503 0902a100 15002501 75010942 09440945 093c9504 81029501
ffff8800836afb40 86658973 S Co:6:004:0 s 21 0a 0000 0001 0000 0
ffff8800836afb40 86659743 C Co:6:004:0 0 0
ffff8800836afb40 86661039 S Ci:6:004:0 s 81 06 2200 0001 00c1 193 <
ffff8800836afb40 86663743 C Ci:6:004:0 0 129 = 05010902 a1018505 0901a100 05091901 29051500 25019505 75018102 95038101
ffff8800836afb40 86676974 S Co:6:004:0 s 21 0a 0000 0002 0000 0
ffff8800836afb40 86678743 C Co:6:004:0 0 0
ffff8800836afb40 86680113 S Ci:6:004:0 s 81 06 2200 0002 006b 107 <
ffff8800836afb40 86681764 C Ci:6:004:0 0 43 = 05010906 a1018506 050719e0 29e71500 25017501 95088102 150026ff 0019002a
ffff8800836afb40 86690580 S Co:6:004:0 s 21 0a 0000 0003 0000 0
ffff8800836afb40 86691761 C Co:6:004:0 0 0
ffff8800836afb40 86693719 S Ci:6:004:0 s 81 06 2200 0003 0075 117 <
ffff8800836afb40 86695749 C Ci:6:004:0 0 53 = 060dff09 01a10185 10a10006 00ff0901 150026ff 00750895 1f8102c0 09018511
ffff8800836afb40 86700075 S Ii:6:004:2 -115:2 6 <
ffff8800836af9c0 86701099 S Ii:6:004:1 -115:4 8 <
ffff8800836af900 86702153 S Ii:6:004:4 -115:4 32 <
ffff8800836af840 86707426 S Ii:6:004:3 -115:8 6 <
ffff8801385c50c0 86730210 S Ci:6:004:0 s a1 01 0309 0001 0002 2 <
ffff8801385c50c0 86731747 C Ci:6:004:0 0 2 = 0900
ffff8801385c50c0 86736522 S Co:6:004:0 s 21 09 0309 0001 0002 2 = 0901
ffff8801385c50c0 86737753 C Co:6:004:0 0 2 >
ffff8800834876c0 86739639 S Ci:6:004:0 s a1 01 0309 0001 0002 2 <
ffff8800834876c0 86740742 C Ci:6:004:0 0 2 = 0901
ffff8800834876c0 86745952 S Co:6:004:0 s 21 09 0309 0001 0002 2 = 0905
ffff8800834876c0 86746750 C Co:6:004:0 0 2 >
ffff8800556e9a80 87226409 S Ci:6:004:0 s 80 06 0302 0409 0102 258 <
ffff8800556e9a80 87228761 C Ci:6:004:0 0 42 = 2a034200 61006d00 62006f00 6f002000 50006100 64002c00 20007700 69007200
ffff8800556e9a80 87231663 S Ci:6:004:0 s 80 06 0302 0409 0102 258 <
ffff8800556e9a80 87233760 C Ci:6:004:0 0 42 = 2a034200 61006d00 62006f00 6f002000 50006100 64002c00 20007700 69007200
