ffff8800280940c0 271395786 C Ii:6:004:2 0:2 6 = 0500032d 0000
ffff880102e23c00 271395960 S Ii:6:004:2 -115:2 6 <
ffff880102e23c00 271417746 C Ii:6:004:2 0:2 6 = 05000439 0000
ffff88000a208840 271417898 S Ii:6:004:2 -115:2 6 <
ffff88000a208840 271437768 C Ii:6:004:2 0:2 6 = 05000237 0000
ffff88000a208840 271437854 S Ii:6:004:2 -115:2 6 <
ffff88000a208840 271449762 C Ii:6:004:2 0:2 6 = 0500011a 0000
ffff880102e23000 271449832 S Ii:6:004:2 -115:2 6 <
ffff880102e23000 271469768 C Ii:6:004:2 0:2 6 = 0500042f 0000
ffff88000a208e40 271469847 S Ii:6:004:2 -115:2 6 <
ffff88000a208e40 271489797 C Ii:6:004:2 0:2 6 = 0500031f 0000
ffff880102e23a80 271489987 S Ii:6:004:2 -115:2 6 <
ffff880102e23a80 271499772 C Ii:6:004:2 0:2 6 = 0500000e 0000
ffff88000a2083c0 271499868 S Ii:6:004:2 -115:2 6 <
ffff88000a2083c0 271521748 C Ii:6:004:2 0:2 6 = 05000217 0000
ffff88000a2083c0 271521807 S Ii:6:004:2 -115:2 6 <
ffff88000a2083c0 271543770 C Ii:6:004:2 0:2 6 = 05000111 0000
ffff880102e23f00 271543920 S Ii:6:004:2 -115:2 6 <
ffff880102e23f00 271553791 C Ii:6:004:2 0:2 6 = 05000105 0000
ffff88000a208d80 271553922 S Ii:6:004:2 -115:2 6 <
ffff88000a208d80 271573756 C Ii:6:004:2 0:2 6 = 0500ff02 0000
ffff880102e23a80 271573924 S Ii:6:004:2 -115:2 6 <
ffff880102e23a80 271593751 C Ii:6:004:2 0:2 6 = 05000001 0000
ffff88000a2083c0 271593806 S Ii:6:004:2 -115:2 6 <
ffff88000a2083c0 271603759 C Ii:6:004:2 0:2 6 = 05000000 0000
ffff88000a2083c0 271603826 S Ii:6:004:2 -115:2 6 <
ffff880028094780 271616774 C Ii:6:004:3 0:8 6 = 06000000 0000
ffff880102e23000 271616850 S Ii:6:004:3 -115:8 6 <
ffff880102e23000 271912787 C Ii:6:004:3 0:8 6 = 06092a00 0000
ffff880102e23000 271912875 S Ii:6:004:3 -115:8 6 <
ffff880102e23000 271920768 C Ii:6:004:3 0:8 6 = 06000000 0000
ffff880102e23c00 271931497 S Ii:6:004:3 -115:8 6 <
ffff88000a2083c0 272115810 C Ii:6:004:2 0:2 6 = 05000000 0000
ffff88000a2083c0 272115964 S Ii:6:004:2 -115:2 6 <
ffff880102e23c00 272128775 C Ii:6:004:3 0:8 6 = 06000000 0000
ffff880102e23c00 272129807 S Ii:6:004:3 -115:8 6 <
ffff88000a2083c0 272449973 C Ii:6:004:2 0:2 6 = 0500f608 0000
ffff88000a2083c0 272450125 S Ii:6:004:2 -115:2 6 <
ffff88000a2083c0 272469973 C Ii:6:004:2 0:2 6 = 0500f811 0000
ffff880102e23240 272470265 S Ii:6:004:2 -115:2 6 <
ffff880102e23240 272489998 C Ii:6:004:2 0:2 6 = 0500fd1f 0000
ffff88000a208e40 272490242 S Ii:6:004:2 -115:2 6 <
ffff88000a208e40 272501791 C Ii:6:004:2 0:2 6 = 05000016 0000
ffff880102e23900 272501950 S Ii:6:004:2 -115:2 6 <
ffff880102e23900 272521806 C Ii:6:004:2 0:2 6 = 05000533 0000
ffff88000a208840 272521875 S Ii:6:004:2 -115:2 6 <
ffff88000a208840 272541785 C Ii:6:004:2 0:2 6 = 05000338 0000
ffff88000a208840 272541852 S Ii:6:004:2 -115:2 6 <
ffff88000a208840 272551809 C Ii:6:004:2 0:2 6 = 0500031e 0000
ffff88000a208840 272551900 S Ii:6:004:2 -115:2 6 <
ffff88000a208840 272573787 C Ii:6:004:2 0:2 6 = 0500042e 0000
ffff880102e23cc0 272573906 S Ii:6:004:2 -115:2 6 <
ffff880102e23cc0 272595805 C Ii:6:004:2 0:2 6 = 05000324 0000
ffff88000a2089c0 272595878 S Ii:6:004:2 -115:2 6 <
ffff88000a2089c0 272603803 C Ii:6:004:2 0:2 6 = 05000210 0000
ffff88000a2089c0 272603898 S Ii:6:004:2 -115:2 6 <
ffff88000a2089c0 272625797 C Ii:6:004:2 0:2 6 = 0500071b 0000
ffff880102e23e40 272625982 S Ii:6:004:2 -115:2 6 <
ffff880102e23e40 272645809 C Ii:6:004:2 0:2 6 = 05000916 0000
ffff88000a208300 272645970 S Ii:6:004:2 -115:2 6 <
ffff88000a208300 272667787 C Ii:6:004:2 0:2 6 = 05000602 0000
ffff880102e23b40 272667865 S Ii:6:004:2 -115:2 6 <
ffff880102e23b40 272711793 C Ii:6:004:2 0:2 6 = 05000000 0000
ffff880102e23b40 272711984 S Ii:6:004:2 -115:2 6 <
ffff880102e23c00 272720790 C Ii:6:004:3 0:8 6 = 06000000 0000
ffff880102e23c00 272720975 S Ii:6:004:3 -115:8 6 <
ffff880102e23b40 272927990 C Ii:6:004:2 0:2 6 = 050013fc 0000
ffff880028094900 272928132 S Ii:6:004:2 -115:2 6 <
ffff880028094900 272949811 C Ii:6:004:2 0:2 6 = 050037f7 0000
ffff880102e23a80 272949928 S Ii:6:004:2 -115:2 6 <
ffff880102e23a80 272959986 C Ii:6:004:2 0:2 6 = 050016fc 0000
ffff880028094240 272960151 S Ii:6:004:2 -115:2 6 <
ffff880028094240 272979988 C Ii:6:004:2 0:2 6 = 050023f9 0000
ffff880028094240 272980124 S Ii:6:004:2 -115:2 6 <
ffff880028094240 272999988 C Ii:6:004:2 0:2 6 = 050024fa 0000
ffff880028094240 273000127 S Ii:6:004:2 -115:2 6 <
ffff880028094240 273009830 C Ii:6:004:2 0:2 6 = 050014fe 0000
ffff880102e23f00 273009951 S Ii:6:004:2 -115:2 6 <
ffff880102e23f00 273031825 C Ii:6:004:2 0:2 6 = 05002b02 0000
ffff880102e23f00 273031920 S Ii:6:004:2 -115:2 6 <
ffff880102e23f00 273053808 C Ii:6:004:2 0:2 6 = 05002009 0000
ffff880102e23f00 273053889 S Ii:6:004:2 -115:2 6 <
ffff880102e23f00 273063817 C Ii:6:004:2 0:2 6 = 05000404 0000
ffff880102e23f00 273063958 S Ii:6:004:2 -115:2 6 <
ffff880102e23f00 273083824 C Ii:6:004:2 0:2 6 = 05000303 0000
ffff880028094540 273083905 S Ii:6:004:2 -115:2 6 <
ffff880028094540 273093818 C Ii:6:004:2 0:2 6 = 05000000 0000
ffff880102e23e40 273093976 S Ii:6:004:2 -115:2 6 <
ffff880102e23c00 273104821 C Ii:6:004:3 0:8 6 = 06000000 0000
ffff880102e23c00 273104908 S Ii:6:004:3 -115:8 6 <
ffff880102e23e40 273261805 C Ii:6:004:2 0:2 6 = 05000dfb 0000
ffff880028094a80 273261923 S Ii:6:004:2 -115:2 6 <
ffff880028094a80 273281845 C Ii:6:004:2 0:2 6 = 050028fa 0000
ffff880134fcd000 273282023 S Ii:6:004:2 -115:2 6 <
ffff880134fcd000 273303817 C Ii:6:004:2 0:2 6 = 050028fe 0000
ffff880134fcd000 273303992 S Ii:6:004:2 -115:2 6 <
ffff880134fcd000 273315825 C Ii:6:004:2 0:2 6 = 05001101 0000
ffff880134fcd000 273316144 S Ii:6:004:2 -115:2 6 <
ffff880134fcd000 273333828 C Ii:6:004:2 0:2 6 = 05001d01 0000
ffff880134fcd000 273333951 S Ii:6:004:2 -115:2 6 <
ffff880134fcd000 273355833 C Ii:6:004:2 0:2 6 = 05000602 0000
ffff880028094600 273355919 S Ii:6:004:2 -115:2 6 <
ffff880028094600 273365832 C Ii:6:004:2 0:2 6 = 05000501 0000
ffff880134fcda80 273365924 S Ii:6:004:2 -115:2 6 <
ffff880134fcda80 273375847 C Ii:6:004:2 0:2 6 = 05000000 0000
ffff880028094840 273376006 S Ii:6:004:2 -115:2 6 <
ffff880102e23c00 273393002 C Ii:6:004:3 0:8 6 = 06000000 0000
ffff880134fcda80 273393278 S Ii:6:004:3 -115:8 6 <
ffff880028094840 273521836 C Ii:6:004:2 0:2 6 = 05000601 0000
ffff880028094840 273521922 S Ii:6:004:2 -115:2 6 <
ffff880028094840 273541813 C Ii:6:004:2 0:2 6 = 05002cfc 0000
ffff880134fcd000 273541864 S Ii:6:004:2 -115:2 6 <
ffff880134fcd000 273563856 C Ii:6:004:2 0:2 6 = 05004900 0000
ffff880134fcd000 273564019 S Ii:6:004:2 -115:2 6 <
ffff880134fcd000 273575816 C Ii:6:004:2 0:2 6 = 05001e02 0000
ffff880028094b40 273575958 S Ii:6:004:2 -115:2 6 <
ffff880028094b40 273595842 C Ii:6:004:2 0:2 6 = 05003d02 0000
ffff880134fcd6c0 273595926 S Ii:6:004:2 -115:2 6 <
ffff880134fcd6c0 273615860 C Ii:6:004:2 0:2 6 = 05003901 0000
ffff880134fcd6c0 273616026 S Ii:6:004:2 -115:2 6 <
ffff880134fcd6c0 273625822 C Ii:6:004:2 0:2 6 = 05000000 0000
ffff880134fcd6c0 273625884 S Ii:6:004:2 -115:2 6 <
ffff880134fcda80 273640835 C Ii:6:004:3 0:8 6 = 06000000 0000
ffff880028094c00 273640901 S Ii:6:004:3 -115:8 6 <
ffff880134fcd6c0 273885864 C Ii:6:004:2 0:2 6 = 0500dbfa 0000
ffff880028094480 273886023 S Ii:6:004:2 -115:2 6 <
ffff880028094480 273905980 C Ii:6:004:2 0:2 6 = 0500d5fe 0000
ffff880134fcd780 273906084 S Ii:6:004:2 -115:2 6 <
ffff880134fcd780 273927851 C Ii:6:004:2 0:2 6 = 0500d802 0000
ffff880028094480 273927957 S Ii:6:004:2 -115:2 6 <
ffff880028094480 273939846 C Ii:6:004:2 0:2 6 = 0500f102 0000
ffff880028094480 273944650 S Ii:6:004:2 -115:2 6 <
ffff880028094480 273959840 C Ii:6:004:2 0:2 6 = 0500e10a 0000
ffff880028094480 273959916 S Ii:6:004:2 -115:2 6 <
ffff880028094480 273979849 C Ii:6:004:2 0:2 6 = 0500f109 0000
ffff880134fcd600 273979936 S Ii:6:004:2 -115:2 6 <
ffff880134fcd600 273989841 C Ii:6:004:2 0:2 6 = 0500e21e 0000
ffff880028094000 273990073 S Ii:6:004:2 -115:2 6 <
ffff880028094000 274011852 C Ii:6:004:2 0:2 6 = 0500e627 0000
ffff880134fcd900 274011919 S Ii:6:004:2 -115:2 6 <
ffff880134fcd900 274033842 C Ii:6:004:2 0:2 6 = 0500f720 0000
ffff880134fcd900 274033946 S Ii:6:004:2 -115:2 6 <
ffff880134fcd900 274042027 C Ii:6:004:2 0:2 6 = 0500000c 0000
ffff880134fcd900 274042132 S Ii:6:004:2 -115:2 6 <
ffff880134fcd900 274063877 C Ii:6:004:2 0:2 6 = 05000a1c 0000
ffff880028094cc0 274064123 S Ii:6:004:2 -115:2 6 <
ffff880028094cc0 274083955 C Ii:6:004:2 0:2 6 = 05002a1e 0000
ffff880134fcd0c0 274084129 S Ii:6:004:2 -115:2 6 <
ffff880134fcd0c0 274105875 C Ii:6:004:2 0:2 6 = 05003d15 0000
ffff880134fcd0c0 274106036 S Ii:6:004:2 -115:2 6 <
ffff880134fcd0c0 274115874 C Ii:6:004:2 0:2 6 = 05002c0a 0000
ffff880134fcd0c0 274116018 S Ii:6:004:2 -115:2 6 <
ffff880134fcd0c0 274136029 C Ii:6:004:2 0:2 6 = 05003f19 0000
ffff880134fcd0c0 274136165 S Ii:6:004:2 -115:2 6 <
ffff880134fcd0c0 274157845 C Ii:6:004:2 0:2 6 = 05002522 0000
ffff880028094180 274158112 S Ii:6:004:2 -115:2 6 <
ffff880028094180 274167862 C Ii:6:004:2 0:2 6 = 05000910 0000
ffff880028094180 274167958 S Ii:6:004:2 -115:2 6 <
ffff880028094180 274189860 C Ii:6:004:2 0:2 6 = 0500082d 0000
ffff880028094180 274189977 S Ii:6:004:2 -115:2 6 <
ffff880028094180 274209838 C Ii:6:004:2 0:2 6 = 0500ef3a 0000
ffff880134fcd300 274209894 S Ii:6:004:2 -115:2 6 <
ffff880134fcd300 274221857 C Ii:6:004:2 0:2 6 = 0500ed1c 0000
ffff880134fcd300 274221925 S Ii:6:004:2 -115:2 6 <
ffff880134fcd300 274239871 C Ii:6:004:2 0:2 6 = 0500de22 0000
ffff880134fcd300 274240137 S Ii:6:004:2 -115:2 6 <
ffff880134fcd300 274261861 C Ii:6:004:2 0:2 6 = 0500d113 0000
ffff880134fcd300 274261944 S Ii:6:004:2 -115:2 6 <
ffff880134fcd300 274281836 C Ii:6:004:2 0:2 6 = 0500db00 0000
ffff880028094300 274283180 S Ii:6:004:2 -115:2 6 <
ffff880028094300 274291858 C Ii:6:004:2 0:2 6 = 0500f4f8 0000
ffff880134fcdc00 274291933 S Ii:6:004:2 -115:2 6 <
ffff880134fcdc00 274315847 C Ii:6:004:2 0:2 6 = 0500f5f2 0000
ffff8800280940c0 274316083 S Ii:6:004:2 -115:2 6 <
ffff8800280940c0 274334032 C Ii:6:004:2 0:2 6 = 0500f6f3 0000
ffff8800280940c0 274334166 S Ii:6:004:2 -115:2 6 <
ffff8800280940c0 274345842 C Ii:6:004:2 0:2 6 = 05000000 0000
ffff8800280940c0 274345936 S Ii:6:004:2 -115:2 6 <
ffff880028094c00 274360850 C Ii:6:004:3 0:8 6 = 06000000 0000
ffff880028094c00 274361018 S Ii:6:004:3 -115:8 6 <
ffff8800280940c0 274699865 C Ii:6:004:2 0:2 6 = 0500ff1a 0000
ffff8800280940c0 274700276 S Ii:6:004:2 -115:2 6 <
ffff8800280940c0 274711856 C Ii:6:004:2 0:2 6 = 05000018 0000
ffff880134fcd840 274712068 S Ii:6:004:2 -115:2 6 <
ffff880134fcd840 274729863 C Ii:6:004:2 0:2 6 = 0500fe3a 0000
ffff880028094780 274729971 S Ii:6:004:2 -115:2 6 <
ffff880028094780 274751895 C Ii:6:004:2 0:2 6 = 0500fd38 0000
ffff880134fcd9c0 274752022 S Ii:6:004:2 -115:2 6 <
ffff880134fcd9c0 274761855 C Ii:6:004:2 0:2 6 = 0500ff1d 0000
ffff880134fcd9c0 274762506 S Ii:6:004:2 -115:2 6 <
ffff880134fcd9c0 274782050 C Ii:6:004:2 0:2 6 = 0500fe3c 0000
ffff880028094540 274782149 S Ii:6:004:2 -115:2 6 <
ffff880028094540 274805882 C Ii:6:004:2 0:2 6 = 05000333 0000
ffff880134fcdf00 274805958 S Ii:6:004:2 -115:2 6 <
ffff880134fcdf00 274813882 C Ii:6:004:2 0:2 6 = 05000615 0000
ffff880134fcdf00 274813979 S Ii:6:004:2 -115:2 6 <
ffff880134fcdf00 274833882 C Ii:6:004:2 0:2 6 = 05000a1c 0000
ffff880134fcdf00 274833966 S Ii:6:004:2 -115:2 6 <
ffff880134fcdf00 274855881 C Ii:6:004:2 0:2 6 = 05000405 0000
ffff880028094d80 274855966 S Ii:6:004:2 -115:2 6 <
ffff880028094d80 274875868 C Ii:6:004:2 0:2 6 = 05000304 0000
ffff880028094d80 274876173 S Ii:6:004:2 -115:2 6 <
ffff880028094d80 274887883 C Ii:6:004:2 0:2 6 = 05000000 0000
ffff880028094d80 274887977 S Ii:6:004:2 -115:2 6 <
ffff880028094c00 274904900 C Ii:6:004:3 0:8 6 = 06000000 0000
ffff880134fcd3c0 274905060 S Ii:6:004:3 -115:8 6 <
ffff880028094d80 275125908 C Ii:6:004:2 0:2 6 = 05000bfe 0000
ffff880134fcdf00 275126054 S Ii:6:004:2 -115:2 6 <
ffff880134fcdf00 275147888 C Ii:6:004:2 0:2 6 = 050033fd 0000
ffff880134fcdf00 275147959 S Ii:6:004:2 -115:2 6 <
ffff880134fcdf00 275167903 C Ii:6:004:2 0:2 6 = 05004ffd 0000
ffff880028094b40 275168039 S Ii:6:004:2 -115:2 6 <
ffff880028094b40 275179878 C Ii:6:004:2 0:2 6 = 05001cff 0000
ffff880028094b40 275180047 S Ii:6:004:2 -115:2 6 <
ffff880028094b40 275199894 C Ii:6:004:2 0:2 6 = 05004104 0000
ffff880028094b40 275199986 S Ii:6:004:2 -115:2 6 <
ffff880028094b40 275219893 C Ii:6:004:2 0:2 6 = 05003c03 0000
ffff880028094b40 275219978 S Ii:6:004:2 -115:2 6 <
ffff880028094b40 275229885 C Ii:6:004:2 0:2 6 = 05000000 0000
ffff880028094b40 275229941 S Ii:6:004:2 -115:2 6 <
ffff880134fcd3c0 275240884 C Ii:6:004:3 0:8 6 = 06000000 0000
ffff880028094840 275240950 S Ii:6:004:3 -115:8 6 <
