ffff8800836afb40 215049952 C Ii:6:004:2 0:2 6 = 05000000 0000
ffff8800280940c0 215050492 S Ii:6:004:2 -115:2 6 <
ffff8800836af840 215062925 C Ii:6:004:3 0:8 6 = 06000000 0000
ffff880028094780 215063143 S Ii:6:004:3 -115:8 6 <
ffff8800280940c0 215071956 C Ii:6:004:2 0:2 6 = 05000000 0000
ffff8800280940c0 215072095 S Ii:6:004:2 -115:2 6 <
ffff880028094780 215086917 C Ii:6:004:3 0:8 6 = 06000000 0000
ffff880028094780 215087051 S Ii:6:004:3 -115:8 6 <
ffff8800836af9c0 218161051 C Ii:6:004:1 0:4 8 = 03201a10 00000000
ffff880100c306c0 218161194 S Ii:6:004:1 -115:4 8 <
ffff880100c306c0 218165019 C Ii:6:004:1 0:4 8 = 03200610 00000000
ffff880100c306c0 218169473 S Ii:6:004:1 -115:4 8 <
ffff880100c306c0 218173018 C Ii:6:004:1 0:4 8 = 0320d70f 00000000
ffff880100c303c0 218177647 S Ii:6:004:1 -115:4 8 <
ffff880100c303c0 218181032 C Ii:6:004:1 0:4 8 = 0320850f 00000000
ffff880100c303c0 218181168 S Ii:6:004:1 -115:4 8 <
ffff880100c303c0 218189016 C Ii:6:004:1 0:4 8 = 03200e0f 00000000
ffff880028094300 218189700 S Ii:6:004:1 -115:4 8 <
ffff880028094300 218201021 C Ii:6:004:1 0:4 8 = 0320870e 00000000
ffff880028094300 218201128 S Ii:6:004:1 -115:4 8 <
ffff880028094300 218213034 C Ii:6:004:1 0:4 8 = 0320f50d 00000000
ffff880100c309c0 218213185 S Ii:6:004:1 -115:4 8 <
ffff880100c309c0 218221044 C Ii:6:004:1 0:4 8 = 0320690d 00000000
ffff880028094240 218221129 S Ii:6:004:1 -115:4 8 <
ffff880028094240 218233058 C Ii:6:004:1 0:4 8 = 0320e30c 00000000
ffff880100c30900 218233193 S Ii:6:004:1 -115:4 8 <
ffff880100c30900 218245029 C Ii:6:004:1 0:4 8 = 0320580c 0e000000
ffff880100c30900 218245133 S Ii:6:004:1 -115:4 8 <
ffff880100c30900 218253023 C Ii:6:004:1 0:4 8 = 0320cf0b 38000000
ffff880100c30900 218253149 S Ii:6:004:1 -115:4 8 <
ffff880100c30900 218261044 C Ii:6:004:1 0:4 8 = 0320440b 76000000
ffff880028094b40 218261152 S Ii:6:004:1 -115:4 8 <
ffff880028094b40 218285029 C Ii:6:004:1 0:4 8 = 0320a60a e1000000
ffff880028094b40 218285520 S Ii:6:004:1 -115:4 8 <
ffff880028094b40 218293146 C Ii:6:004:1 0:4 8 = 03200c0a 6b010000
ffff880028094b40 218293314 S Ii:6:004:1 -115:4 8 <
ffff880028094b40 218305044 C Ii:6:004:1 0:4 8 = 03207809 02020000
ffff880100c30840 218305171 S Ii:6:004:1 -115:4 8 <
ffff880100c30840 218313028 C Ii:6:004:1 0:4 8 = 0320ec08 a4020000
ffff880100c30840 218313376 S Ii:6:004:1 -115:4 8 <
ffff880100c30840 218325216 C Ii:6:004:1 0:4 8 = 03207708 2b030000
ffff880028094840 218325605 S Ii:6:004:1 -115:4 8 <
ffff880028094840 218337033 C Ii:6:004:1 0:4 8 = 03200f08 98030000
ffff880028094840 218337197 S Ii:6:004:1 -115:4 8 <
ffff880028094840 218345043 C Ii:6:004:1 0:4 8 = 0320b207 f8030000
ffff880100c30600 218345615 S Ii:6:004:1 -115:4 8 <
ffff880100c30600 218357025 C Ii:6:004:1 0:4 8 = 03205907 51040000
ffff880028094e40 218357177 S Ii:6:004:1 -115:4 8 <
ffff880028094e40 218365027 C Ii:6:004:1 0:4 8 = 03200c07 ac040000
ffff880028094e40 218365204 S Ii:6:004:1 -115:4 8 <
ffff880028094e40 218369031 C Ii:6:004:1 0:4 8 = 03200c07 ac040000
ffff880100c30cc0 218373756 S Ii:6:004:1 -115:4 8 <
ffff880100c30cc0 218377028 C Ii:6:004:1 0:4 8 = 0320c906 0a050000
ffff880100c30cc0 218379126 S Ii:6:004:1 -115:4 8 <
ffff880100c30cc0 218389042 C Ii:6:004:1 0:4 8 = 03208b06 6d050000
ffff880100c30cc0 218389114 S Ii:6:004:1 -115:4 8 <
ffff880100c30cc0 218397041 C Ii:6:004:1 0:4 8 = 03205606 d0050000
ffff880028094e40 218397183 S Ii:6:004:1 -115:4 8 <
ffff880028094e40 218409036 C Ii:6:004:1 0:4 8 = 03202606 36060000
ffff880028094e40 218409153 S Ii:6:004:1 -115:4 8 <
ffff880028094e40 218417068 C Ii:6:004:1 0:4 8 = 0320fb05 9f060000
ffff880100c30cc0 218417256 S Ii:6:004:1 -115:4 8 <
ffff880100c30cc0 218429057 C Ii:6:004:1 0:4 8 = 0320d405 06070000
ffff8800280946c0 218429174 S Ii:6:004:1 -115:4 8 <
ffff8800280946c0 218441046 C Ii:6:004:1 0:4 8 = 0320b105 70070000
ffff880100c30600 218441120 S Ii:6:004:1 -115:4 8 <
ffff880100c30600 218449026 C Ii:6:004:1 0:4 8 = 03209305 d9070000
ffff880100c30600 218449070 S Ii:6:004:1 -115:4 8 <
ffff880100c30600 218461040 C Ii:6:004:1 0:4 8 = 03207805 3f080000
ffff880028094600 218461580 S Ii:6:004:1 -115:4 8 <
ffff880028094600 218469024 C Ii:6:004:1 0:4 8 = 03206305 a4080000
ffff880028094600 218469117 S Ii:6:004:1 -115:4 8 <
ffff880028094600 218481219 C Ii:6:004:1 0:4 8 = 03205305 06090000
ffff880028094600 218481405 S Ii:6:004:1 -115:4 8 <
ffff880028094600 218493047 C Ii:6:004:1 0:4 8 = 03204b05 68090000
ffff880100c30840 218493132 S Ii:6:004:1 -115:4 8 <
ffff880100c30840 218501048 C Ii:6:004:1 0:4 8 = 03205105 cc090000
ffff880028094480 218501109 S Ii:6:004:1 -115:4 8 <
ffff880028094480 218513057 C Ii:6:004:1 0:4 8 = 03206305 350a0000
ffff880100c309c0 218513198 S Ii:6:004:1 -115:4 8 <
ffff880100c309c0 218525034 C Ii:6:004:1 0:4 8 = 03208705 a70a0000
ffff880100c309c0 218525168 S Ii:6:004:1 -115:4 8 <
ffff880100c309c0 218533052 C Ii:6:004:1 0:4 8 = 0320bd05 200b0000
ffff880028094900 218533299 S Ii:6:004:1 -115:4 8 <
ffff880028094900 218541032 C Ii:6:004:1 0:4 8 = 0320fe05 9c0b0000
ffff880028094900 218541163 S Ii:6:004:1 -115:4 8 <
ffff880028094900 218553067 C Ii:6:004:1 0:4 8 = 03205006 160c0000
ffff880100c303c0 218553231 S Ii:6:004:1 -115:4 8 <
ffff880100c303c0 218565051 C Ii:6:004:1 0:4 8 = 0320ab06 880c0000
ffff880100c303c0 218565182 S Ii:6:004:1 -115:4 8 <
ffff880100c303c0 218573044 C Ii:6:004:1 0:4 8 = 03201e07 f40c0000
ffff880100c303c0 218573577 S Ii:6:004:1 -115:4 8 <
ffff880100c303c0 218585053 C Ii:6:004:1 0:4 8 = 0320a207 530d0000
ffff880100c303c0 218585175 S Ii:6:004:1 -115:4 8 <
ffff880100c303c0 218597053 C Ii:6:004:1 0:4 8 = 03203908 a00d0000
ffff880100c303c0 218597137 S Ii:6:004:1 -115:4 8 <
ffff880100c303c0 218605026 C Ii:6:004:1 0:4 8 = 0320e408 db0d0000
ffff880028094f00 218605121 S Ii:6:004:1 -115:4 8 <
ffff880028094f00 218609031 C Ii:6:004:1 0:4 8 = 0320e408 db0d0000
ffff880028094f00 218613637 S Ii:6:004:1 -115:4 8 <
ffff880028094f00 218617074 C Ii:6:004:1 0:4 8 = 03208b09 0c0e0000
ffff880028094f00 218617188 S Ii:6:004:1 -115:4 8 <
ffff880028094f00 218625051 C Ii:6:004:1 0:4 8 = 0320360a 3a0e0000
ffff880028094f00 218625112 S Ii:6:004:1 -115:4 8 <
ffff880028094f00 218637221 C Ii:6:004:1 0:4 8 = 0320e80a 6a0e0000
ffff880100c30b40 218637442 S Ii:6:004:1 -115:4 8 <
ffff880100c30b40 218645070 C Ii:6:004:1 0:4 8 = 03209f0b 970e0000
ffff880028094d80 218645480 S Ii:6:004:1 -115:4 8 <
ffff880028094d80 218657035 C Ii:6:004:1 0:4 8 = 0320590c b90e0000
ffff880028094d80 218657090 S Ii:6:004:1 -115:4 8 <
ffff880028094d80 218669040 C Ii:6:004:1 0:4 8 = 0320150d c20e0000
ffff880100c30180 218669297 S Ii:6:004:1 -115:4 8 <
ffff880100c30180 218677051 C Ii:6:004:1 0:4 8 = 0320d30d ae0e0000
ffff880028094000 218684341 S Ii:6:004:1 -115:4 8 <
ffff880028094000 218689052 C Ii:6:004:1 0:4 8 = 0320970e 7e0e0000
ffff880028094000 218689515 S Ii:6:004:1 -115:4 8 <
ffff880028094000 218701057 C Ii:6:004:1 0:4 8 = 03205c0f 370e0000
ffff880028094000 218701126 S Ii:6:004:1 -115:4 8 <
ffff880028094000 218713057 C Ii:6:004:1 0:4 8 = 03201c10 df0d0000
ffff880028094000 218713133 S Ii:6:004:1 -115:4 8 <
ffff880028094000 218721065 C Ii:6:004:1 0:4 8 = 0320da10 7a0d0000
ffff880100c30e40 218721269 S Ii:6:004:1 -115:4 8 <
ffff880100c30e40 218729135 C Ii:6:004:1 0:4 8 = 03209111 0a0d0000
ffff880100c30e40 218729479 S Ii:6:004:1 -115:4 8 <
ffff880100c30e40 218741045 C Ii:6:004:1 0:4 8 = 03204012 8d0c0000
ffff880100c30780 218743881 S Ii:6:004:1 -115:4 8 <
ffff880100c30780 218749226 C Ii:6:004:1 0:4 8 = 0320ec12 050c0000
ffff880100c30780 218749374 S Ii:6:004:1 -115:4 8 <
ffff880100c30780 218761062 C Ii:6:004:1 0:4 8 = 03209d13 780b0000
ffff880100c30780 218761218 S Ii:6:004:1 -115:4 8 <
ffff880100c30780 218773067 C Ii:6:004:1 0:4 8 = 03204f14 e60a0000
ffff8800280949c0 218773505 S Ii:6:004:1 -115:4 8 <
ffff8800280949c0 218781231 C Ii:6:004:1 0:4 8 = 0320f814 4e0a0000
ffff8800280949c0 218781427 S Ii:6:004:1 -115:4 8 <
ffff8800280949c0 218793074 C Ii:6:004:1 0:4 8 = 03209d15 b9090000
ffff8800280949c0 218793214 S Ii:6:004:1 -115:4 8 <
ffff8800280949c0 218805063 C Ii:6:004:1 0:4 8 = 03204016 24090000
ffff8800280949c0 218805261 S Ii:6:004:1 -115:4 8 <
ffff8800280949c0 218813045 C Ii:6:004:1 0:4 8 = 0320c816 9c080000
ffff8800280949c0 218813651 S Ii:6:004:1 -115:4 8 <
ffff8800280949c0 218825050 C Ii:6:004:1 0:4 8 = 03203917 15080000
ffff8800280949c0 218825621 S Ii:6:004:1 -115:4 8 <
ffff8800280949c0 218833052 C Ii:6:004:1 0:4 8 = 03209817 8e070000
ffff880100c30f00 218833514 S Ii:6:004:1 -115:4 8 <
ffff880100c30f00 218845084 C Ii:6:004:1 0:4 8 = 0320ef17 08070000
ffff8800280943c0 218845250 S Ii:6:004:1 -115:4 8 <
ffff8800280943c0 218849047 C Ii:6:004:1 0:4 8 = 0320ef17 08070000
ffff8800280943c0 218849808 S Ii:6:004:1 -115:4 8 <
ffff8800280943c0 218853036 C Ii:6:004:1 0:4 8 = 03204618 6a060000
ffff8800280943c0 218853323 S Ii:6:004:1 -115:4 8 <
ffff8800280943c0 218865047 C Ii:6:004:1 0:4 8 = 03209718 c9050000
ffff880100c30300 218866639 S Ii:6:004:1 -115:4 8 <
ffff880100c30300 218877233 C Ii:6:004:1 0:4 8 = 0320e018 31050000
ffff880100c30300 218877522 S Ii:6:004:1 -115:4 8 <
ffff880100c30300 218885060 C Ii:6:004:1 0:4 8 = 03201b19 99040000
ffff880100c30300 218885120 S Ii:6:004:1 -115:4 8 <
ffff880100c30300 218941085 C Ii:6:004:1 0:4 8 = 03001b19 99040000
ffff880100c30300 218941320 S Ii:6:004:1 -115:4 8 <
ffff880100c30300 219057257 C Ii:6:004:1 0:4 8 = 03202a12 00000000
ffff880100c30300 219057482 S Ii:6:004:1 -115:4 8 <
ffff880100c30300 219061078 C Ii:6:004:1 0:4 8 = 03200e12 00000000
ffff880100c30300 219061652 S Ii:6:004:1 -115:4 8 <
ffff880100c30300 219073067 C Ii:6:004:1 0:4 8 = 0320c711 00000000
ffff880100c30300 219073150 S Ii:6:004:1 -115:4 8 <
ffff880100c30300 219085049 C Ii:6:004:1 0:4 8 = 03204f11 00000000
ffff880100c30300 219086021 S Ii:6:004:1 -115:4 8 <
ffff880100c30300 219093063 C Ii:6:004:1 0:4 8 = 0320a210 00000000
ffff880100c30300 219093144 S Ii:6:004:1 -115:4 8 <
ffff880100c30300 219105157 C Ii:6:004:1 0:4 8 = 0320dc0f 00000000
ffff880100c30300 219105277 S Ii:6:004:1 -115:4 8 <
ffff880100c30300 219113262 C Ii:6:004:1 0:4 8 = 0320120f 00000000
ffff880100c30300 219113463 S Ii:6:004:1 -115:4 8 <
ffff880100c30300 219125240 C Ii:6:004:1 0:4 8 = 0320470e 00000000
ffff880100c30300 219125398 S Ii:6:004:1 -115:4 8 <
ffff880100c30300 219137057 C Ii:6:004:1 0:4 8 = 0320820d 25000000
ffff880100c30300 219137141 S Ii:6:004:1 -115:4 8 <
ffff880100c30300 219149057 C Ii:6:004:1 0:4 8 = 0320be0c 72000000
ffff8800280949c0 219150262 S Ii:6:004:1 -115:4 8 <
ffff8800280949c0 219157052 C Ii:6:004:1 0:4 8 = 0320f90b 0c010000
ffff8800280949c0 219157180 S Ii:6:004:1 -115:4 8 <
ffff8800280949c0 219165061 C Ii:6:004:1 0:4 8 = 03202f0b d5010000
ffff8800280949c0 219165570 S Ii:6:004:1 -115:4 8 <
ffff8800280949c0 219177058 C Ii:6:004:1 0:4 8 = 0320660a b6020000
ffff8800280949c0 219177167 S Ii:6:004:1 -115:4 8 <
ffff8800280949c0 219189060 C Ii:6:004:1 0:4 8 = 0320a909 a3030000
ffff880100c30240 219191167 S Ii:6:004:1 -115:4 8 <
ffff880100c30240 219197066 C Ii:6:004:1 0:4 8 = 0320f808 6f040000
ffff880100c30240 219197489 S Ii:6:004:1 -115:4 8 <
ffff880100c30240 219209067 C Ii:6:004:1 0:4 8 = 03205f08 31050000
ffff880100c30240 219209141 S Ii:6:004:1 -115:4 8 <
ffff880100c30240 219217079 C Ii:6:004:1 0:4 8 = 0320d907 e9050000
ffff8800280943c0 219217206 S Ii:6:004:1 -115:4 8 <
ffff8800280943c0 219229087 C Ii:6:004:1 0:4 8 = 03206707 98060000
ffff880100c30540 219229330 S Ii:6:004:1 -115:4 8 <
ffff880100c30540 219233061 C Ii:6:004:1 0:4 8 = 03206707 98060000
ffff880100c30540 219233651 S Ii:6:004:1 -115:4 8 <
ffff880100c30540 219241074 C Ii:6:004:1 0:4 8 = 03200d07 51070000
ffff880100c30540 219241158 S Ii:6:004:1 -115:4 8 <
ffff880100c30540 219249075 C Ii:6:004:1 0:4 8 = 0320cb06 0d080000
ffff880028094000 219249178 S Ii:6:004:1 -115:4 8 <
ffff880028094000 219261088 C Ii:6:004:1 0:4 8 = 0320a106 da080000
ffff880100c306c0 219261237 S Ii:6:004:1 -115:4 8 <
ffff880100c306c0 219269064 C Ii:6:004:1 0:4 8 = 03209206 b9090000
ffff880100c306c0 219269391 S Ii:6:004:1 -115:4 8 <
ffff880100c306c0 219281057 C Ii:6:004:1 0:4 8 = 03209a06 a30a0000
ffff880028094d80 219281173 S Ii:6:004:1 -115:4 8 <
ffff880028094d80 219293058 C Ii:6:004:1 0:4 8 = 0320b706 980b0000
ffff880028094d80 219293151 S Ii:6:004:1 -115:4 8 <
ffff880028094d80 219301075 C Ii:6:004:1 0:4 8 = 0320eb06 870c0000
ffff880100c30480 219301341 S Ii:6:004:1 -115:4 8 <
ffff880100c30480 219313089 C Ii:6:004:1 0:4 8 = 03203e07 830d0000
ffff880028094f00 219313214 S Ii:6:004:1 -115:4 8 <
ffff880028094f00 219321075 C Ii:6:004:1 0:4 8 = 0320ae07 6f0e0000
ffff880028094f00 219321160 S Ii:6:004:1 -115:4 8 <
ffff880028094f00 219333077 C Ii:6:004:1 0:4 8 = 03203808 400f0000
ffff880100c30c00 219333162 S Ii:6:004:1 -115:4 8 <
ffff880100c30c00 219341066 C Ii:6:004:1 0:4 8 = 0320d008 fa0f0000
ffff880028094900 219341559 S Ii:6:004:1 -115:4 8 <
ffff880028094900 219353093 C Ii:6:004:1 0:4 8 = 03206509 9e100000
ffff880100c30c00 219353402 S Ii:6:004:1 -115:4 8 <
ffff880100c30c00 219365060 C Ii:6:004:1 0:4 8 = 0320020a 38110000
ffff880028094480 219365142 S Ii:6:004:1 -115:4 8 <
ffff880028094480 219373097 C Ii:6:004:1 0:4 8 = 0320940a b5110000
ffff880028094480 219373269 S Ii:6:004:1 -115:4 8 <
ffff880028094480 219385096 C Ii:6:004:1 0:4 8 = 0320280b 20120000
ffff880100c30480 219385268 S Ii:6:004:1 -115:4 8 <
ffff880100c30480 219397076 C Ii:6:004:1 0:4 8 = 0320bd0b 7c120000
ffff880028094600 219397143 S Ii:6:004:1 -115:4 8 <
ffff880028094600 219405079 C Ii:6:004:1 0:4 8 = 0320560c d0120000
ffff880028094600 219405178 S Ii:6:004:1 -115:4 8 <
ffff880028094600 219417272 C Ii:6:004:1 0:4 8 = 03200e0d 23130000
ffff880028094600 219417458 S Ii:6:004:1 -115:4 8 <
ffff880028094600 219429078 C Ii:6:004:1 0:4 8 = 0320d80d 6e130000
ffff880028094600 219429148 S Ii:6:004:1 -115:4 8 <
ffff880028094600 219437176 C Ii:6:004:1 0:4 8 = 0320ae0e b1130000
ffff880028094600 219437275 S Ii:6:004:1 -115:4 8 <
ffff880028094600 219445087 C Ii:6:004:1 0:4 8 = 03208b0f eb130000
ffff880028094600 219447972 S Ii:6:004:1 -115:4 8 <
ffff880028094600 219457060 C Ii:6:004:1 0:4 8 = 03206b10 23140000
ffff880028094600 219457130 S Ii:6:004:1 -115:4 8 <
ffff880028094600 219469101 C Ii:6:004:1 0:4 8 = 03205311 52140000
ffff880100c306c0 219469316 S Ii:6:004:1 -115:4 8 <
ffff880100c306c0 219473064 C Ii:6:004:1 0:4 8 = 03205311 52140000
ffff880100c306c0 219473789 S Ii:6:004:1 -115:4 8 <
ffff880100c306c0 219477061 C Ii:6:004:1 0:4 8 = 03203b12 77140000
ffff880100c306c0 219481478 S Ii:6:004:1 -115:4 8 <
ffff880100c306c0 219489064 C Ii:6:004:1 0:4 8 = 03202b13 8e140000
ffff8800280946c0 219489134 S Ii:6:004:1 -115:4 8 <
ffff8800280946c0 219501080 C Ii:6:004:1 0:4 8 = 03201b14 91140000
ffff880100c30540 219501165 S Ii:6:004:1 -115:4 8 <
ffff880100c30540 219509063 C Ii:6:004:1 0:4 8 = 03200615 82140000
ffff880100c30540 219509128 S Ii:6:004:1 -115:4 8 <
ffff880100c30540 219521093 C Ii:6:004:1 0:4 8 = 0320f215 5e140000
ffff880100c30540 219521211 S Ii:6:004:1 -115:4 8 <
ffff880100c30540 219529084 C Ii:6:004:1 0:4 8 = 0320d316 1f140000
ffff880100c30540 219529175 S Ii:6:004:1 -115:4 8 <
ffff880100c30540 219541068 C Ii:6:004:1 0:4 8 = 0320b217 c4130000
ffff880028094e40 219541147 S Ii:6:004:1 -115:4 8 <
ffff880028094e40 219549087 C Ii:6:004:1 0:4 8 = 0320a018 34130000
ffff880028094e40 219549177 S Ii:6:004:1 -115:4 8 <
ffff880028094e40 219561251 C Ii:6:004:1 0:4 8 = 03208c19 70120000
ffff880100c30240 219561699 S Ii:6:004:1 -115:4 8 <
ffff880100c30240 219573066 C Ii:6:004:1 0:4 8 = 0320791a 6d110000
ffff880100c30240 219573138 S Ii:6:004:1 -115:4 8 <
ffff880100c30240 219581062 C Ii:6:004:1 0:4 8 = 0320591b 34100000
ffff880100c30240 219581110 S Ii:6:004:1 -115:4 8 <
ffff880100c30240 219701066 C Ii:6:004:1 0:4 8 = 0300591b 34100000
ffff880100c30240 219701477 S Ii:6:004:1 -115:4 8 <
