ffff880100c30240 310836050 C Ii:6:004:1 0:4 8 = 03205910 00000000
ffff880104de6900 310836123 S Ii:6:004:1 -115:4 8 <
ffff880104de6900 310844046 C Ii:6:004:1 0:4 8 = 03203d10 00000000
ffff880104de6900 310844120 S Ii:6:004:1 -115:4 8 <
ffff8800278783c0 310853083 C Ii:6:004:2 0:2 6 = 05000000 0000
ffff880104de6840 310853239 S Ii:6:004:2 -115:2 6 <
ffff8800281d0e40 310865331 C Ii:6:004:3 0:8 6 = 06000000 0000
ffff8800281d0e40 310866047 S Ii:6:004:3 -115:8 6 <
ffff880104de6900 310876029 C Ii:6:004:1 0:4 8 = 0320c10e 00000000
ffff880104de6900 310876116 S Ii:6:004:1 -115:4 8 <
ffff880104de6900 310888063 C Ii:6:004:1 0:4 8 = 0320f60d 00000000
ffff88000e7b9840 310888206 S Ii:6:004:1 -115:4 8 <
ffff88000e7b9840 310892058 C Ii:6:004:1 0:4 8 = 0320f60d 00000000
ffff880104de6900 310896981 S Ii:6:004:1 -115:4 8 <
ffff880104de6900 310900031 C Ii:6:004:1 0:4 8 = 0320280d 00000000
ffff880104de6900 310900279 S Ii:6:004:1 -115:4 8 <
ffff880104de6900 310908028 C Ii:6:004:1 0:4 8 = 03205f0c 00000000
ffff880104de6900 310908254 S Ii:6:004:1 -115:4 8 <
ffff880104de6900 310916037 C Ii:6:004:1 0:4 8 = 0320a10b 00000000
ffff880104de6900 310916124 S Ii:6:004:1 -115:4 8 <
ffff880104de6900 310928050 C Ii:6:004:1 0:4 8 = 0320ee0a 09000000
ffff88000e7b9780 310928128 S Ii:6:004:1 -115:4 8 <
ffff88000e7b9780 310940248 C Ii:6:004:1 0:4 8 = 03204b0a 22000000
ffff88000e7b9780 310940457 S Ii:6:004:1 -115:4 8 <
ffff88000e7b9780 310948062 C Ii:6:004:1 0:4 8 = 0320b809 46000000
ffff88000e7b9780 310948175 S Ii:6:004:1 -115:4 8 <
ffff88000e7b9780 310960053 C Ii:6:004:1 0:4 8 = 03203409 72000000
ffff88000e7b9780 310960124 S Ii:6:004:1 -115:4 8 <
ffff88000e7b9780 310972048 C Ii:6:004:1 0:4 8 = 0320bd08 a2000000
ffff88000e7b9780 310972113 S Ii:6:004:1 -115:4 8 <
ffff88000e7b9780 310980221 C Ii:6:004:1 0:4 8 = 03204f08 d6000000
ffff88000e7b9780 310980352 S Ii:6:004:1 -115:4 8 <
ffff88000e7b9780 310992067 C Ii:6:004:1 0:4 8 = 0320ea07 10010000
ffff880104de6900 310992174 S Ii:6:004:1 -115:4 8 <
ffff880104de6900 311000245 C Ii:6:004:1 0:4 8 = 03208f07 4d010000
ffff88000e7b96c0 311000463 S Ii:6:004:1 -115:4 8 <
ffff88000e7b96c0 311012034 C Ii:6:004:1 0:4 8 = 03204007 8a010000
ffff88000e7b96c0 311012103 S Ii:6:004:1 -115:4 8 <
ffff88000e7b96c0 311024069 C Ii:6:004:1 0:4 8 = 0320fc06 c4010000
ffff88000e7b96c0 311024198 S Ii:6:004:1 -115:4 8 <
ffff88000e7b96c0 311032250 C Ii:6:004:1 0:4 8 = 0320c106 f7010000
ffff88000e7b96c0 311032510 S Ii:6:004:1 -115:4 8 <
ffff88000e7b96c0 311044073 C Ii:6:004:1 0:4 8 = 03208d06 23020000
ffff88000e7b96c0 311044234 S Ii:6:004:1 -115:4 8 <
ffff88000e7b96c0 311052037 C Ii:6:004:1 0:4 8 = 03205f06 4a020000
ffff88000e7b96c0 311052184 S Ii:6:004:1 -115:4 8 <
ffff88000e7b96c0 311064061 C Ii:6:004:1 0:4 8 = 03203706 6d020000
ffff88000e7b96c0 311064169 S Ii:6:004:1 -115:4 8 <
ffff88000e7b96c0 311072071 C Ii:6:004:1 0:4 8 = 03201506 90020000
ffff88000e7b96c0 311072253 S Ii:6:004:1 -115:4 8 <
ffff88000e7b96c0 311084059 C Ii:6:004:1 0:4 8 = 0320fb05 b5020000
ffff88000e7b96c0 311084160 S Ii:6:004:1 -115:4 8 <
ffff88000e7b96c0 311092226 C Ii:6:004:1 0:4 8 = 0320e805 dc020000
ffff88000e7b96c0 311092358 S Ii:6:004:1 -115:4 8 <
ffff88000e7b96c0 311104224 C Ii:6:004:1 0:4 8 = 0320dd05 06030000
ffff88000e7b96c0 311104363 S Ii:6:004:1 -115:4 8 <
ffff88000e7b96c0 311116053 C Ii:6:004:1 0:4 8 = 0320d905 2f030000
ffff880104de6900 311116152 S Ii:6:004:1 -115:4 8 <
ffff880104de6900 311128037 C Ii:6:004:1 0:4 8 = 0320dc05 56030000
ffff880104de6900 311128125 S Ii:6:004:1 -115:4 8 <
ffff880104de6900 311132057 C Ii:6:004:1 0:4 8 = 0320dc05 56030000
ffff880104de6900 311136896 S Ii:6:004:1 -115:4 8 <
ffff880104de6900 311140248 C Ii:6:004:1 0:4 8 = 0320e505 78030000
ffff880104de6900 311140404 S Ii:6:004:1 -115:4 8 <
ffff880104de6900 311148230 C Ii:6:004:1 0:4 8 = 0320f405 95030000
ffff880104de6900 311148494 S Ii:6:004:1 -115:4 8 <
ffff880104de6900 311156230 C Ii:6:004:1 0:4 8 = 03200706 ae030000
ffff880104de6900 311156482 S Ii:6:004:1 -115:4 8 <
ffff880104de6900 311168046 C Ii:6:004:1 0:4 8 = 03201e06 c4030000
ffff880104de6900 311168128 S Ii:6:004:1 -115:4 8 <
ffff880104de6900 311176078 C Ii:6:004:1 0:4 8 = 03203706 d7030000
ffff880104de6900 311176222 S Ii:6:004:1 -115:4 8 <
ffff880104de6900 311188057 C Ii:6:004:1 0:4 8 = 03205206 e9030000
ffff880104de6900 311188130 S Ii:6:004:1 -115:4 8 <
ffff880104de6900 311200077 C Ii:6:004:1 0:4 8 = 03206d06 fb030000
ffff880104de6900 311200221 S Ii:6:004:1 -115:4 8 <
ffff880104de6900 311212060 C Ii:6:004:1 0:4 8 = 03208906 0f040000
ffff880104de6900 311212131 S Ii:6:004:1 -115:4 8 <
ffff880104de6900 311220063 C Ii:6:004:1 0:4 8 = 0320a406 26040000
ffff880104de6900 311220156 S Ii:6:004:1 -115:4 8 <
ffff880104de6900 311232078 C Ii:6:004:1 0:4 8 = 0320bc06 3d040000
ffff880104de6900 311232218 S Ii:6:004:1 -115:4 8 <
ffff880104de6900 311240076 C Ii:6:004:1 0:4 8 = 0320ce06 4f040000
ffff880104de6900 311240205 S Ii:6:004:1 -115:4 8 <
ffff880104de6900 311252061 C Ii:6:004:1 0:4 8 = 0320db06 5d040000
ffff880104de6900 311252246 S Ii:6:004:1 -115:4 8 <
ffff880104de6900 311260060 C Ii:6:004:1 0:4 8 = 0321db06 5d04bf00
ffff880104de6900 311260136 S Ii:6:004:1 -115:4 8 <
ffff880104de6900 311272048 C Ii:6:004:1 0:4 8 = 0321db06 5d04bc00
ffff88000e7b9480 311272206 S Ii:6:004:1 -115:4 8 <
ffff88000e7b9480 311280103 C Ii:6:004:1 0:4 8 = 0321e206 6404a700
ffff88000e7b9480 311280202 S Ii:6:004:1 -115:4 8 <
ffff88000e7b9480 311292233 C Ii:6:004:1 0:4 8 = 0321e206 64049200
ffff88000e7b9480 311292349 S Ii:6:004:1 -115:4 8 <
ffff88000e7b9480 311304068 C Ii:6:004:1 0:4 8 = 0321ef06 72048100
ffff88000e7b9480 311304157 S Ii:6:004:1 -115:4 8 <
ffff88000e7b9480 311312089 C Ii:6:004:1 0:4 8 = 03210207 84047500
ffff88000e7b9480 311312273 S Ii:6:004:1 -115:4 8 <
ffff88000e7b9480 311324082 C Ii:6:004:1 0:4 8 = 03211c07 9d047100
ffff88000e7b9480 311324224 S Ii:6:004:1 -115:4 8 <
ffff88000e7b9480 311332055 C Ii:6:004:1 0:4 8 = 03213c07 bb046b00
ffff88000e7b9480 311332164 S Ii:6:004:1 -115:4 8 <
ffff88000e7b9480 311344065 C Ii:6:004:1 0:4 8 = 03215d07 da046600
ffff88000e7b9480 311344135 S Ii:6:004:1 -115:4 8 <
ffff88000e7b9480 311356044 C Ii:6:004:1 0:4 8 = 03217c07 f7046500
ffff88000e7b9480 311356098 S Ii:6:004:1 -115:4 8 <
ffff88000e7b9480 311364053 C Ii:6:004:1 0:4 8 = 03219707 12056d00
ffff8800835b2000 311364219 S Ii:6:004:1 -115:4 8 <
ffff8800835b2000 311368059 C Ii:6:004:1 0:4 8 = 03219707 12056d00
ffff8800835b2000 311373492 S Ii:6:004:1 -115:4 8 <
ffff8800835b2000 311376066 C Ii:6:004:1 0:4 8 = 0321ad07 2a057b00
ffff8800835b2000 311376151 S Ii:6:004:1 -115:4 8 <
ffff8800835b2000 311384068 C Ii:6:004:1 0:4 8 = 0321c007 41058c00
ffff8800835b2000 311384163 S Ii:6:004:1 -115:4 8 <
ffff8800835b2000 311400131 C Ii:6:004:1 0:4 8 = 0321d307 58059b00
ffff8800835b2000 311400356 S Ii:6:004:1 -115:4 8 <
ffff8800835b2000 311408260 C Ii:6:004:1 0:4 8 = 0321e807 7005a500
ffff8800835b2000 311408444 S Ii:6:004:1 -115:4 8 <
ffff8800835b2000 311416047 C Ii:6:004:1 0:4 8 = 03210108 8805a900
ffff8800835b2000 311416254 S Ii:6:004:1 -115:4 8 <
ffff8800835b2000 311428059 C Ii:6:004:1 0:4 8 = 03211f08 a105ae00
ffff8800835b2000 311428121 S Ii:6:004:1 -115:4 8 <
ffff8800835b2000 311436053 C Ii:6:004:1 0:4 8 = 03214208 bc05b300
ffff8800835b2000 311436140 S Ii:6:004:1 -115:4 8 <
ffff8800835b2000 311448048 C Ii:6:004:1 0:4 8 = 03216808 d805b800
ffff8800835b2000 311448771 S Ii:6:004:1 -115:4 8 <
ffff8800835b2000 311460241 C Ii:6:004:1 0:4 8 = 03219108 f505bc00
ffff8800835b2000 311460372 S Ii:6:004:1 -115:4 8 <
ffff8800835b2000 311468237 C Ii:6:004:1 0:4 8 = 0321bd08 1406be00
ffff8800835b2000 311468331 S Ii:6:004:1 -115:4 8 <
ffff8800835b2000 311480068 C Ii:6:004:1 0:4 8 = 0321eb08 3206be00
ffff88000e7b93c0 311480265 S Ii:6:004:1 -115:4 8 <
ffff88000e7b93c0 311492083 C Ii:6:004:1 0:4 8 = 03211b09 4e06bf00
ffff88000e7b93c0 311492201 S Ii:6:004:1 -115:4 8 <
ffff88000e7b93c0 311500095 C Ii:6:004:1 0:4 8 = 03214d09 6606c400
ffff88000e7b93c0 311500288 S Ii:6:004:1 -115:4 8 <
ffff88000e7b93c0 311512240 C Ii:6:004:1 0:4 8 = 03217e09 7b06d300
ffff88000e7b93c0 311512365 S Ii:6:004:1 -115:4 8 <
ffff88000e7b93c0 311520051 C Ii:6:004:1 0:4 8 = 0321ae09 8d06e600
ffff88000e7b93c0 311520317 S Ii:6:004:1 -115:4 8 <
ffff88000e7b93c0 311532266 C Ii:6:004:1 0:4 8 = 0321de09 9e06fa00
ffff8800835b2180 311532483 S Ii:6:004:1 -115:4 8 <
ffff8800835b2180 311540073 C Ii:6:004:1 0:4 8 = 0321100a b0060b01
ffff8800835b2180 311540149 S Ii:6:004:1 -115:4 8 <
ffff8800835b2180 311552054 C Ii:6:004:1 0:4 8 = 0321470a c3061301
ffff8800835b2180 311552115 S Ii:6:004:1 -115:4 8 <
ffff8800835b2180 311564239 C Ii:6:004:1 0:4 8 = 0321820a d5061701
ffff8800835b2180 311564368 S Ii:6:004:1 -115:4 8 <
ffff8800835b2180 311572065 C Ii:6:004:1 0:4 8 = 0321c00a e6061801
ffff8800835b2180 311573574 S Ii:6:004:1 -115:4 8 <
ffff8800835b2180 311584075 C Ii:6:004:1 0:4 8 = 0321ff0a f4061c01
ffff88000e7b9300 311584193 S Ii:6:004:1 -115:4 8 <
ffff88000e7b9300 311596073 C Ii:6:004:1 0:4 8 = 03213e0b 02072101
ffff8800835b2180 311596145 S Ii:6:004:1 -115:4 8 <
ffff8800835b2180 311604048 C Ii:6:004:1 0:4 8 = 03217d0b 10072501
ffff8800835b2180 311604118 S Ii:6:004:1 -115:4 8 <
ffff8800835b2180 311608070 C Ii:6:004:1 0:4 8 = 03217d0b 10072501
ffff88000e7b9240 311613217 S Ii:6:004:1 -115:4 8 <
ffff88000e7b9240 311616053 C Ii:6:004:1 0:4 8 = 0321bc0b 21072801
ffff88000e7b9240 311616106 S Ii:6:004:1 -115:4 8 <
ffff88000e7b9240 311624055 C Ii:6:004:1 0:4 8 = 0321fd0b 33072901
ffff8800835b2180 311624186 S Ii:6:004:1 -115:4 8 <
ffff8800835b2180 311636087 C Ii:6:004:1 0:4 8 = 03213f0c 44072801
ffff8800835b2180 311636207 S Ii:6:004:1 -115:4 8 <
ffff8800835b2180 311644057 C Ii:6:004:1 0:4 8 = 0321850c 54072801
ffff8800835b2180 311644118 S Ii:6:004:1 -115:4 8 <
ffff8800835b2180 311656074 C Ii:6:004:1 0:4 8 = 0321cb0c 61072d01
ffff8800835b2180 311656138 S Ii:6:004:1 -115:4 8 <
ffff8800835b2180 311668071 C Ii:6:004:1 0:4 8 = 0321100d 6c073601
ffff8800835b2180 311668122 S Ii:6:004:1 -115:4 8 <
ffff8800835b2180 311680071 C Ii:6:004:1 0:4 8 = 0321560d 75073f01
ffff8800835b2180 311680123 S Ii:6:004:1 -115:4 8 <
ffff8800835b2180 311688061 C Ii:6:004:1 0:4 8 = 03219b0d 7c074501
ffff8800835b2180 311688161 S Ii:6:004:1 -115:4 8 <
ffff8800835b2180 311696069 C Ii:6:004:1 0:4 8 = 0321e10d 82074901
ffff8800835b2180 311696932 S Ii:6:004:1 -115:4 8 <
ffff8800835b2180 311708065 C Ii:6:004:1 0:4 8 = 03212a0e 87074a01
ffff88000e7b9180 311708151 S Ii:6:004:1 -115:4 8 <
ffff88000e7b9180 311720076 C Ii:6:004:1 0:4 8 = 0321740e 8b074b01
ffff88000e7b9180 311720173 S Ii:6:004:1 -115:4 8 <
ffff88000e7b9180 311728246 C Ii:6:004:1 0:4 8 = 0321c20e 8e074e01
ffff88000e7b9180 311728377 S Ii:6:004:1 -115:4 8 <
ffff88000e7b9180 311740250 C Ii:6:004:1 0:4 8 = 0321130f 8e075101
ffff88000e7b9180 311740386 S Ii:6:004:1 -115:4 8 <
ffff88000e7b9180 311748091 C Ii:6:004:1 0:4 8 = 0321680f 8a075401
ffff88000e7b9180 311748234 S Ii:6:004:1 -115:4 8 <
ffff88000e7b9180 311760062 C Ii:6:004:1 0:4 8 = 0321c20f 82075401
ffff88000e7b9180 311760136 S Ii:6:004:1 -115:4 8 <
ffff88000e7b9180 311772063 C Ii:6:004:1 0:4 8 = 03212010 77075301
ffff88000e7b9180 311772124 S Ii:6:004:1 -115:4 8 <
ffff88000e7b9180 311780074 C Ii:6:004:1 0:4 8 = 03218010 6d075101
ffff88000e7b9180 311780127 S Ii:6:004:1 -115:4 8 <
ffff88000e7b9180 311792065 C Ii:6:004:1 0:4 8 = 0321de10 65074f01
ffff88000e7b9180 311792175 S Ii:6:004:1 -115:4 8 <
ffff88000e7b9180 311800067 C Ii:6:004:1 0:4 8 = 03213b11 61074f01
ffff88000e7b9180 311800144 S Ii:6:004:1 -115:4 8 <
ffff88000e7b9180 311812086 C Ii:6:004:1 0:4 8 = 03219911 63075001
ffff88000e7b9180 311812155 S Ii:6:004:1 -115:4 8 <
ffff88000e7b9180 311824059 C Ii:6:004:1 0:4 8 = 0321f811 6b075301
ffff8800835b2000 311824816 S Ii:6:004:1 -115:4 8 <
ffff8800835b2000 311832059 C Ii:6:004:1 0:4 8 = 03215b12 78075701
ffff88000e7b90c0 311832271 S Ii:6:004:1 -115:4 8 <
ffff88000e7b90c0 311844079 C Ii:6:004:1 0:4 8 = 0321bf12 8b075c01
ffff88000e7b90c0 311844150 S Ii:6:004:1 -115:4 8 <
ffff88000e7b90c0 311848058 C Ii:6:004:1 0:4 8 = 0321bf12 8b075c01
ffff8800835b2000 311852924 S Ii:6:004:1 -115:4 8 <
ffff8800835b2000 311856083 C Ii:6:004:1 0:4 8 = 03212f13 a7076101
ffff8800835b2000 311856161 S Ii:6:004:1 -115:4 8 <
ffff8800835b2000 311868251 C Ii:6:004:1 0:4 8 = 0321a613 cb076401
ffff88000e7b9000 311868517 S Ii:6:004:1 -115:4 8 <
ffff88000e7b9000 311876254 C Ii:6:004:1 0:4 8 = 03211714 f2076a01
ffff8800835b2180 311876394 S Ii:6:004:1 -115:4 8 <
ffff8800835b2180 311884063 C Ii:6:004:1 0:4 8 = 03218314 1c086e01
ffff8800835b2180 311884250 S Ii:6:004:1 -115:4 8 <
ffff8800835b2180 311896083 C Ii:6:004:1 0:4 8 = 0321e214 47087301
ffff88000e7b9000 311896173 S Ii:6:004:1 -115:4 8 <
ffff88000e7b9000 311908080 C Ii:6:004:1 0:4 8 = 03213b15 73087701
ffff88000543c780 311908150 S Ii:6:004:1 -115:4 8 <
ffff88000543c780 311916062 C Ii:6:004:1 0:4 8 = 03219115 a4087c01
ffff88000e7b90c0 311916314 S Ii:6:004:1 -115:4 8 <
ffff88000e7b90c0 311928254 C Ii:6:004:1 0:4 8 = 0321e915 e0088101
ffff88000e7b90c0 311928350 S Ii:6:004:1 -115:4 8 <
ffff88000e7b90c0 311936062 C Ii:6:004:1 0:4 8 = 03214616 2a098601
ffff88000e7b90c0 311936159 S Ii:6:004:1 -115:4 8 <
ffff88000e7b90c0 311948086 C Ii:6:004:1 0:4 8 = 0321a116 79098901
ffff88000e7b90c0 311948168 S Ii:6:004:1 -115:4 8 <
ffff88000e7b90c0 311960257 C Ii:6:004:1 0:4 8 = 0321f416 c5098b01
ffff88000543cb40 311960392 S Ii:6:004:1 -115:4 8 <
ffff88000543cb40 311968067 C Ii:6:004:1 0:4 8 = 03213e17 100a8a01
ffff88000e7b9180 311968220 S Ii:6:004:1 -115:4 8 <
ffff88000e7b9180 311980069 C Ii:6:004:1 0:4 8 = 03217f17 5b0a8601
ffff88000e7b9180 311980171 S Ii:6:004:1 -115:4 8 <
ffff88000e7b9180 311988063 C Ii:6:004:1 0:4 8 = 0321b717 a60a8401
ffff88000e7b9180 311988343 S Ii:6:004:1 -115:4 8 <
ffff88000e7b9180 312000080 C Ii:6:004:1 0:4 8 = 0321e717 f20a8101
ffff88000543ce40 312000152 S Ii:6:004:1 -115:4 8 <
ffff88000543ce40 312012073 C Ii:6:004:1 0:4 8 = 03210e18 400b7c01
ffff88000543ce40 312012143 S Ii:6:004:1 -115:4 8 <
ffff88000543ce40 312020070 C Ii:6:004:1 0:4 8 = 03212f18 920b7a01
ffff88000543ce40 312020140 S Ii:6:004:1 -115:4 8 <
ffff88000543ce40 312032073 C Ii:6:004:1 0:4 8 = 03214a18 e60b7901
ffff88000543ce40 312032141 S Ii:6:004:1 -115:4 8 <
ffff88000543ce40 312040075 C Ii:6:004:1 0:4 8 = 03215d18 3d0c7801
ffff88000e7b9240 312040147 S Ii:6:004:1 -115:4 8 <
ffff88000e7b9240 312052088 C Ii:6:004:1 0:4 8 = 03216718 9b0c7901
ffff88000e7b9240 312052170 S Ii:6:004:1 -115:4 8 <
ffff88000e7b9240 312064069 C Ii:6:004:1 0:4 8 = 03216718 050d7a01
ffff88000e7b9240 312064140 S Ii:6:004:1 -115:4 8 <
ffff88000e7b9240 312072076 C Ii:6:004:1 0:4 8 = 03215e18 7e0d7901
ffff88000543c0c0 312072165 S Ii:6:004:1 -115:4 8 <
ffff88000543c0c0 312084075 C Ii:6:004:1 0:4 8 = 03214b18 fc0d7901
ffff88000543c0c0 312084204 S Ii:6:004:1 -115:4 8 <
ffff88000543c0c0 312088084 C Ii:6:004:1 0:4 8 = 03214b18 fc0d7901
ffff88000543c0c0 312093511 S Ii:6:004:1 -115:4 8 <
ffff88000543c0c0 312096071 C Ii:6:004:1 0:4 8 = 03213318 730e7801
ffff88000543c0c0 312096126 S Ii:6:004:1 -115:4 8 <
ffff88000543c0c0 312104090 C Ii:6:004:1 0:4 8 = 03211718 e00e7801
ffff88000543c0c0 312104295 S Ii:6:004:1 -115:4 8 <
ffff88000543c0c0 312116083 C Ii:6:004:1 0:4 8 = 0321f417 440f7901
ffff88000543c0c0 312116278 S Ii:6:004:1 -115:4 8 <
ffff88000543c0c0 312124067 C Ii:6:004:1 0:4 8 = 0321c917 9f0f7a01
ffff88000543c0c0 312124266 S Ii:6:004:1 -115:4 8 <
ffff88000543c0c0 312136092 C Ii:6:004:1 0:4 8 = 03219217 f80f7c01
ffff88000543c0c0 312136264 S Ii:6:004:1 -115:4 8 <
ffff88000543c0c0 312148068 C Ii:6:004:1 0:4 8 = 03214f17 54107a01
ffff88000543c0c0 312148616 S Ii:6:004:1 -115:4 8 <
ffff88000543c0c0 312156068 C Ii:6:004:1 0:4 8 = 03210617 ad107601
ffff88000543c0c0 312156269 S Ii:6:004:1 -115:4 8 <
ffff88000543c0c0 312168097 C Ii:6:004:1 0:4 8 = 0321b516 02116f01
ffff88000543c0c0 312168298 S Ii:6:004:1 -115:4 8 <
ffff88000543c0c0 312176067 C Ii:6:004:1 0:4 8 = 03215b16 50116801
ffff88000543c0c0 312176110 S Ii:6:004:1 -115:4 8 <
ffff88000543c0c0 312188095 C Ii:6:004:1 0:4 8 = 0321f715 93115e01
ffff88000543c0c0 312188308 S Ii:6:004:1 -115:4 8 <
ffff88000543c0c0 312196070 C Ii:6:004:1 0:4 8 = 03218d15 cf115501
ffff88000543c0c0 312196244 S Ii:6:004:1 -115:4 8 <
ffff88000543c0c0 312208071 C Ii:6:004:1 0:4 8 = 03212e15 00125001
ffff88000543c0c0 312208279 S Ii:6:004:1 -115:4 8 <
ffff88000543c0c0 312220093 C Ii:6:004:1 0:4 8 = 0321cd14 2b124901
ffff88000e7b9300 312220172 S Ii:6:004:1 -115:4 8 <
ffff88000e7b9300 312228071 C Ii:6:004:1 0:4 8 = 03216a14 52124301
ffff88000e7b9300 312228112 S Ii:6:004:1 -115:4 8 <
ffff88000e7b9300 312240097 C Ii:6:004:1 0:4 8 = 03210614 76123e01
ffff88000e7b9300 312240307 S Ii:6:004:1 -115:4 8 <
ffff88000e7b9300 312252093 C Ii:6:004:1 0:4 8 = 03218a13 9c123901
ffff88000e7b9300 312252171 S Ii:6:004:1 -115:4 8 <
ffff88000e7b9300 312260095 C Ii:6:004:1 0:4 8 = 03210113 bf123801
ffff88000e7b9300 312260212 S Ii:6:004:1 -115:4 8 <
ffff88000e7b9300 312272072 C Ii:6:004:1 0:4 8 = 03216e12 dd123801
ffff88000e7b9300 312272216 S Ii:6:004:1 -115:4 8 <
ffff88000e7b9300 312280071 C Ii:6:004:1 0:4 8 = 0321d211 f3123a01
ffff88000e7b9300 312280204 S Ii:6:004:1 -115:4 8 <
ffff88000e7b9300 312292083 C Ii:6:004:1 0:4 8 = 03213211 fe123901
ffff88000e7b9300 312292149 S Ii:6:004:1 -115:4 8 <
ffff88000e7b9300 312304094 C Ii:6:004:1 0:4 8 = 03218f10 fe123801
ffff88000e7b9300 312304161 S Ii:6:004:1 -115:4 8 <
ffff88000e7b9300 312312071 C Ii:6:004:1 0:4 8 = 0321ef0f f4123601
ffff88000e7b9300 312312141 S Ii:6:004:1 -115:4 8 <
ffff88000e7b9300 312324081 C Ii:6:004:1 0:4 8 = 0321570f e3123401
ffff88000e7b9300 312324165 S Ii:6:004:1 -115:4 8 <
ffff88000e7b9300 312328070 C Ii:6:004:1 0:4 8 = 0321570f e3123401
ffff88000e7b9300 312333731 S Ii:6:004:1 -115:4 8 <
ffff88000e7b9300 312336077 C Ii:6:004:1 0:4 8 = 0321c70e c8123101
ffff88000543c6c0 312336134 S Ii:6:004:1 -115:4 8 <
ffff88000543c6c0 312344072 C Ii:6:004:1 0:4 8 = 03212d0e 99122e01
ffff88000543c6c0 312344248 S Ii:6:004:1 -115:4 8 <
ffff88000543c6c0 312356094 C Ii:6:004:1 0:4 8 = 03218c0d 4b122b01
ffff88000e7b93c0 312356167 S Ii:6:004:1 -115:4 8 <
ffff88000e7b93c0 312364081 C Ii:6:004:1 0:4 8 = 0321e80c d8112701
ffff88000e7b93c0 312364148 S Ii:6:004:1 -115:4 8 <
ffff88000e7b93c0 312376081 C Ii:6:004:1 0:4 8 = 03214a0c 50112401
ffff88000e7b93c0 312376150 S Ii:6:004:1 -115:4 8 <
ffff88000e7b93c0 312384084 C Ii:6:004:1 0:4 8 = 0321c70b d2102301
ffff88000e7b93c0 312384145 S Ii:6:004:1 -115:4 8 <
ffff88000e7b93c0 312396097 C Ii:6:004:1 0:4 8 = 03215d0b 5a102501
ffff88000e7b93c0 312396164 S Ii:6:004:1 -115:4 8 <
ffff88000e7b93c0 312408102 C Ii:6:004:1 0:4 8 = 03210b0b e30f2701
ffff88000e7b93c0 312408174 S Ii:6:004:1 -115:4 8 <
ffff88000e7b93c0 312416086 C Ii:6:004:1 0:4 8 = 0321c90a 670f2c01
ffff88000e7b93c0 312416143 S Ii:6:004:1 -115:4 8 <
ffff88000e7b93c0 312428112 C Ii:6:004:1 0:4 8 = 0321960a e80e3201
ffff88000e7b93c0 312428192 S Ii:6:004:1 -115:4 8 <
ffff88000e7b93c0 312436107 C Ii:6:004:1 0:4 8 = 0321750a 690e3a01
ffff88000e7b93c0 312436356 S Ii:6:004:1 -115:4 8 <
ffff88000e7b93c0 312448087 C Ii:6:004:1 0:4 8 = 0321640a ec0d4201
ffff88000543c000 312448172 S Ii:6:004:1 -115:4 8 <
ffff88000543c000 312456086 C Ii:6:004:1 0:4 8 = 0321620a 700d4901
ffff88000543c000 312456231 S Ii:6:004:1 -115:4 8 <
ffff88000543c000 312468099 C Ii:6:004:1 0:4 8 = 03216e0a ef0c5001
ffff88000e7b9480 312468309 S Ii:6:004:1 -115:4 8 <
ffff88000e7b9480 312480104 C Ii:6:004:1 0:4 8 = 03218b0a 670c5701
ffff88000e7b9480 312480188 S Ii:6:004:1 -115:4 8 <
ffff88000e7b9480 312488093 C Ii:6:004:1 0:4 8 = 0321bb0a dd0b5e01
ffff88000e7b9480 312488179 S Ii:6:004:1 -115:4 8 <
ffff88000e7b9480 312500272 C Ii:6:004:1 0:4 8 = 0321f90a 5e0b6201
ffff88000e7b9480 312500392 S Ii:6:004:1 -115:4 8 <
ffff88000e7b9480 312512117 C Ii:6:004:1 0:4 8 = 0321420b f20a6301
ffff88000e7b9480 312512269 S Ii:6:004:1 -115:4 8 <
ffff88000e7b9480 312524087 C Ii:6:004:1 0:4 8 = 0321960b 990a6301
ffff88000e7b9480 312524290 S Ii:6:004:1 -115:4 8 <
ffff88000e7b9480 312532084 C Ii:6:004:1 0:4 8 = 0321f30b 520a6101
ffff88000543c000 312532900 S Ii:6:004:1 -115:4 8 <
ffff88000543c000 312540086 C Ii:6:004:1 0:4 8 = 03215b0c 1b0a5e01
ffff88000e7b96c0 312540155 S Ii:6:004:1 -115:4 8 <
ffff88000e7b96c0 312552085 C Ii:6:004:1 0:4 8 = 0321cf0c f0095c01
ffff88000543c6c0 312552193 S Ii:6:004:1 -115:4 8 <
ffff88000543c6c0 312564108 C Ii:6:004:1 0:4 8 = 03214a0d cf095e01
ffff88000543c6c0 312564323 S Ii:6:004:1 -115:4 8 <
ffff88000543c6c0 312568086 C Ii:6:004:1 0:4 8 = 03214a0d cf095e01
ffff88000e7b9780 312573867 S Ii:6:004:1 -115:4 8 <
ffff88000e7b9780 312576080 C Ii:6:004:1 0:4 8 = 0321c90d b7096201
ffff88000e7b9780 312576163 S Ii:6:004:1 -115:4 8 <
ffff88000e7b9780 312584103 C Ii:6:004:1 0:4 8 = 0321520e a8096901
ffff88000e7b9780 312584352 S Ii:6:004:1 -115:4 8 <
ffff88000e7b9780 312592107 C Ii:6:004:1 0:4 8 = 0321e30e a1097101
ffff88000543c0c0 312592163 S Ii:6:004:1 -115:4 8 <
ffff88000543c0c0 312604107 C Ii:6:004:1 0:4 8 = 03217d0f a0097701
ffff88000543c0c0 312604192 S Ii:6:004:1 -115:4 8 <
ffff88000543c0c0 312616108 C Ii:6:004:1 0:4 8 = 03212110 a1097901
ffff88000543c0c0 312616181 S Ii:6:004:1 -115:4 8 <
ffff88000543c0c0 312624084 C Ii:6:004:1 0:4 8 = 0321c710 a0097901
ffff88000543c0c0 312624706 S Ii:6:004:1 -115:4 8 <
ffff88000543c0c0 312636107 C Ii:6:004:1 0:4 8 = 03216f11 9b097901
ffff88000543c0c0 312636202 S Ii:6:004:1 -115:4 8 <
ffff88000543c0c0 312648104 C Ii:6:004:1 0:4 8 = 03211812 8f097601
ffff88000543c0c0 312648169 S Ii:6:004:1 -115:4 8 <
ffff88000543c0c0 312656106 C Ii:6:004:1 0:4 8 = 0321bb12 7a097601
ffff88000543c0c0 312656174 S Ii:6:004:1 -115:4 8 <
ffff88000543c0c0 312668106 C Ii:6:004:1 0:4 8 = 03216113 57097201
ffff88000543c0c0 312668186 S Ii:6:004:1 -115:4 8 <
ffff88000543c0c0 312676102 C Ii:6:004:1 0:4 8 = 03210714 21096e01
ffff88000543c0c0 312676158 S Ii:6:004:1 -115:4 8 <
ffff88000543c0c0 312688111 C Ii:6:004:1 0:4 8 = 0321a814 d8086a01
ffff88000543c0c0 312688207 S Ii:6:004:1 -115:4 8 <
ffff88000543c0c0 312696107 C Ii:6:004:1 0:4 8 = 03214815 84086601
ffff88000543c0c0 312696178 S Ii:6:004:1 -115:4 8 <
ffff88000543c0c0 312712280 C Ii:6:004:1 0:4 8 = 0321cd15 39086801
ffff88000543c0c0 312712420 S Ii:6:004:1 -115:4 8 <
ffff88000543c0c0 312720243 C Ii:6:004:1 0:4 8 = 03214716 f4076d01
ffff88000543c0c0 312720382 S Ii:6:004:1 -115:4 8 <
ffff88000543c0c0 312728087 C Ii:6:004:1 0:4 8 = 0321bd16 af077201
ffff88000e7b9840 312728181 S Ii:6:004:1 -115:4 8 <
ffff88000e7b9840 312740111 C Ii:6:004:1 0:4 8 = 03212d17 6b077401
ffff88000e7b9840 312740177 S Ii:6:004:1 -115:4 8 <
ffff88000e7b9840 312752123 C Ii:6:004:1 0:4 8 = 0321ad17 1b077001
ffff88000e7b9840 312752243 S Ii:6:004:1 -115:4 8 <
ffff88000e7b9840 312760099 C Ii:6:004:1 0:4 8 = 03213118 bf066401
ffff88000e7b9840 312760213 S Ii:6:004:1 -115:4 8 <
ffff88000e7b9840 312772115 C Ii:6:004:1 0:4 8 = 0321b318 57065901
ffff88000e7b9840 312772202 S Ii:6:004:1 -115:4 8 <
ffff88000e7b9840 312780097 C Ii:6:004:1 0:4 8 = 03212f19 e2054f01
ffff88000e7b9840 312780179 S Ii:6:004:1 -115:4 8 <
ffff88000e7b9840 312792113 C Ii:6:004:1 0:4 8 = 0321a319 63054901
ffff88000e7b9840 312792191 S Ii:6:004:1 -115:4 8 <
ffff88000e7b9840 312804281 C Ii:6:004:1 0:4 8 = 0321091a de044901
ffff88000e7b9840 312804376 S Ii:6:004:1 -115:4 8 <
ffff88000e7b9840 312808093 C Ii:6:004:1 0:4 8 = 0321091a de044901
ffff88000e7b9840 312813072 S Ii:6:004:1 -115:4 8 <
ffff88000e7b9840 312816096 C Ii:6:004:1 0:4 8 = 03215f1a 5c044b01
ffff88000e7b9840 312816148 S Ii:6:004:1 -115:4 8 <
ffff88000e7b9840 312824105 C Ii:6:004:1 0:4 8 = 0321a31a e2034f01
ffff88000e7b9840 312824179 S Ii:6:004:1 -115:4 8 <
ffff88000e7b9840 312832122 C Ii:6:004:1 0:4 8 = 0321d21a 6c035001
ffff88000e7b9840 312832249 S Ii:6:004:1 -115:4 8 <
ffff88000e7b9840 312844113 C Ii:6:004:1 0:4 8 = 0321ec1a f4025301
ffff88000e7b9840 312844177 S Ii:6:004:1 -115:4 8 <
ffff88000e7b9840 312856117 C Ii:6:004:1 0:4 8 = 0321f01a 74025401
ffff88000e7b9840 312856216 S Ii:6:004:1 -115:4 8 <
ffff88000e7b9840 312864091 C Ii:6:004:1 0:4 8 = 0321e11a ea015401
ffff88000e7b9840 312864334 S Ii:6:004:1 -115:4 8 <
ffff88000e7b9840 312876120 C Ii:6:004:1 0:4 8 = 0321c31a 60015901
ffff88000e7b9840 312876182 S Ii:6:004:1 -115:4 8 <
ffff88000e7b9840 312884108 C Ii:6:004:1 0:4 8 = 03219b1a e5006001
ffff88000543ce40 312884175 S Ii:6:004:1 -115:4 8 <
ffff88000543ce40 312896097 C Ii:6:004:1 0:4 8 = 0321681a 84006601
ffff88000543ce40 312896149 S Ii:6:004:1 -115:4 8 <
ffff88000543ce40 312908117 C Ii:6:004:1 0:4 8 = 0321271a 43006d01
ffff88000543ce40 312908173 S Ii:6:004:1 -115:4 8 <
ffff88000543ce40 312916098 C Ii:6:004:1 0:4 8 = 0321d819 1c006701
ffff88000543ce40 312916164 S Ii:6:004:1 -115:4 8 <
ffff88000543ce40 312928116 C Ii:6:004:1 0:4 8 = 03217719 09006301
ffff88000543ce40 312928183 S Ii:6:004:1 -115:4 8 <
ffff88000543ce40 312936094 C Ii:6:004:1 0:4 8 = 03210819 00005f01
ffff88000543ce40 312936141 S Ii:6:004:1 -115:4 8 <
ffff88000543ce40 312948100 C Ii:6:004:1 0:4 8 = 03218e18 00005d01
ffff88000e7b99c0 312948172 S Ii:6:004:1 -115:4 8 <
ffff88000e7b99c0 312956100 C Ii:6:004:1 0:4 8 = 03210818 00006501
ffff88000e7b99c0 312956160 S Ii:6:004:1 -115:4 8 <
ffff88000e7b99c0 312968105 C Ii:6:004:1 0:4 8 = 03217517 00006801
ffff88000e7b99c0 312968192 S Ii:6:004:1 -115:4 8 <
ffff88000e7b99c0 312980102 C Ii:6:004:1 0:4 8 = 0321d416 00006701
ffff88000e7b99c0 312980173 S Ii:6:004:1 -115:4 8 <
ffff88000e7b99c0 312992100 C Ii:6:004:1 0:4 8 = 03212616 00006301
ffff88000e7b99c0 312992164 S Ii:6:004:1 -115:4 8 <
ffff88000e7b99c0 313000113 C Ii:6:004:1 0:4 8 = 03216e15 00006001
ffff88000e7b99c0 313000330 S Ii:6:004:1 -115:4 8 <
ffff88000e7b99c0 313008104 C Ii:6:004:1 0:4 8 = 0321b214 00006101
ffff88000e7b99c0 313008163 S Ii:6:004:1 -115:4 8 <
ffff88000e7b99c0 313020118 C Ii:6:004:1 0:4 8 = 0321f813 00006201
ffff88000543cb40 313020196 S Ii:6:004:1 -115:4 8 <
ffff88000543cb40 313032117 C Ii:6:004:1 0:4 8 = 03214613 00006001
ffff88000e7b9900 313032186 S Ii:6:004:1 -115:4 8 <
ffff88000e7b9900 313040116 C Ii:6:004:1 0:4 8 = 03219a12 12005a01
ffff88000543c780 313040183 S Ii:6:004:1 -115:4 8 <
ffff88000543c780 313044101 C Ii:6:004:1 0:4 8 = 03219a12 12005a01
ffff88000543c780 313044850 S Ii:6:004:1 -115:4 8 <
ffff88000543c780 313052102 C Ii:6:004:1 0:4 8 = 0321f511 40005101
ffff88000543c780 313052166 S Ii:6:004:1 -115:4 8 <
ffff88000543c780 313060120 C Ii:6:004:1 0:4 8 = 03215711 8b004a01
ffff88000e7b9b40 313060191 S Ii:6:004:1 -115:4 8 <
ffff88000e7b9b40 313072120 C Ii:6:004:1 0:4 8 = 0321c110 ee004701
ffff88000543ccc0 313072198 S Ii:6:004:1 -115:4 8 <
ffff88000543ccc0 313084105 C Ii:6:004:1 0:4 8 = 03213510 5b014601
ffff88000543ccc0 313084251 S Ii:6:004:1 -115:4 8 <
ffff88000543ccc0 313092290 C Ii:6:004:1 0:4 8 = 0321ba0f cc014701
ffff88000e7b9a80 313092554 S Ii:6:004:1 -115:4 8 <
ffff88000e7b9a80 313104122 C Ii:6:004:1 0:4 8 = 0321550f 3a024a01
ffff88000e7b9a80 313104191 S Ii:6:004:1 -115:4 8 <
ffff88000e7b9a80 313116102 C Ii:6:004:1 0:4 8 = 0321050f a8024d01
ffff88000e7b9a80 313116907 S Ii:6:004:1 -115:4 8 <
ffff88000e7b9a80 313124125 C Ii:6:004:1 0:4 8 = 0321cc0e 16035001
ffff88000e7b9a80 313124293 S Ii:6:004:1 -115:4 8 <
ffff88000e7b9a80 313136293 C Ii:6:004:1 0:4 8 = 0321aa0e 83035301
ffff88000e7b9a80 313136421 S Ii:6:004:1 -115:4 8 <
ffff88000e7b9a80 313144122 C Ii:6:004:1 0:4 8 = 03219f0e f4035301
ffff88000543c540 313144195 S Ii:6:004:1 -115:4 8 <
ffff88000543c540 313156109 C Ii:6:004:1 0:4 8 = 0321b10e 69045201
ffff88000e7b9a80 313156201 S Ii:6:004:1 -115:4 8 <
ffff88000e7b9a80 313164127 C Ii:6:004:1 0:4 8 = 0321e30e e1045201
ffff88000e7b9a80 313164221 S Ii:6:004:1 -115:4 8 <
ffff88000e7b9a80 313180114 C Ii:6:004:1 0:4 8 = 0321330f 5c055001
ffff88000543c9c0 313180436 S Ii:6:004:1 -115:4 8 <
ffff88000543c9c0 313188121 C Ii:6:004:1 0:4 8 = 03219e0f d5054f01
ffff88000e7b9b40 313188196 S Ii:6:004:1 -115:4 8 <
ffff88000e7b9b40 313196120 C Ii:6:004:1 0:4 8 = 03211c10 48064e01
ffff88000e7b9b40 313196178 S Ii:6:004:1 -115:4 8 <
ffff88000e7b9b40 313208106 C Ii:6:004:1 0:4 8 = 0321c010 ca064c01
ffff88000e7b9b40 313208343 S Ii:6:004:1 -115:4 8 <
ffff88000e7b9b40 313220129 C Ii:6:004:1 0:4 8 = 03218111 5a074a01
ffff88000543c240 313220225 S Ii:6:004:1 -115:4 8 <
ffff88000543c240 313228126 C Ii:6:004:1 0:4 8 = 03215c12 fb074601
ffff88000e7b9900 313228213 S Ii:6:004:1 -115:4 8 <
ffff88000e7b9900 313240127 C Ii:6:004:1 0:4 8 = 03214a13 a6084101
ffff88000543cc00 313240354 S Ii:6:004:1 -115:4 8 <
ffff88000543cc00 313248107 C Ii:6:004:1 0:4 8 = 03212414 45093c01
ffff88000543cc00 313248313 S Ii:6:004:1 -115:4 8 <
ffff88000543cc00 313260124 C Ii:6:004:1 0:4 8 = 0321f014 e4093901
ffff88000e7b99c0 313260204 S Ii:6:004:1 -115:4 8 <
ffff88000e7b99c0 313272130 C Ii:6:004:1 0:4 8 = 0321ac15 7f0a3b01
ffff88000543cc00 313272232 S Ii:6:004:1 -115:4 8 <
ffff88000543cc00 313280122 C Ii:6:004:1 0:4 8 = 03215616 160b4001
ffff88000543cc00 313280274 S Ii:6:004:1 -115:4 8 <
ffff88000543cc00 313284123 C Ii:6:004:1 0:4 8 = 03215616 160b4001
ffff88000543cc00 313284899 S Ii:6:004:1 -115:4 8 <
ffff88000543cc00 313292113 C Ii:6:004:1 0:4 8 = 0321f516 b30b4501
ffff88000e7b9840 313292175 S Ii:6:004:1 -115:4 8 <
ffff88000e7b9840 313300105 C Ii:6:004:1 0:4 8 = 03218917 570c4a01
ffff88000e7b9840 313301790 S Ii:6:004:1 -115:4 8 <
ffff88000e7b9840 313312114 C Ii:6:004:1 0:4 8 = 03210918 fd0c4e01
ffff88000e7b9840 313312210 S Ii:6:004:1 -115:4 8 <
ffff88000e7b9840 313324112 C Ii:6:004:1 0:4 8 = 03217618 9d0d5001
ffff88000e7b9840 313324178 S Ii:6:004:1 -115:4 8 <
ffff88000e7b9840 313332109 C Ii:6:004:1 0:4 8 = 0321ce18 350e5301
ffff88000e7b9840 313333705 S Ii:6:004:1 -115:4 8 <
ffff88000e7b9840 313344106 C Ii:6:004:1 0:4 8 = 03211019 cd0e5501
ffff88000e7b9840 313344348 S Ii:6:004:1 -115:4 8 <
ffff88000e7b9840 313352106 C Ii:6:004:1 0:4 8 = 03213619 640f5601
ffff88000e7b9840 313352307 S Ii:6:004:1 -115:4 8 <
ffff88000e7b9840 313364137 C Ii:6:004:1 0:4 8 = 03213f19 f90f5401
ffff88000543c240 313364191 S Ii:6:004:1 -115:4 8 <
ffff88000543c240 313376116 C Ii:6:004:1 0:4 8 = 03212a19 97105401
ffff88000e7b9780 313376185 S Ii:6:004:1 -115:4 8 <
ffff88000e7b9780 313384123 C Ii:6:004:1 0:4 8 = 0321fc18 38115001
ffff88000e7b9780 313384327 S Ii:6:004:1 -115:4 8 <
ffff88000e7b9780 313396130 C Ii:6:004:1 0:4 8 = 0321c318 be115001
ffff88000543c9c0 313396206 S Ii:6:004:1 -115:4 8 <
ffff88000543c9c0 313404123 C Ii:6:004:1 0:4 8 = 03217c18 3b125001
ffff88000543c9c0 313404239 S Ii:6:004:1 -115:4 8 <
ffff88000543c9c0 313416129 C Ii:6:004:1 0:4 8 = 03212518 b0125001
ffff88000e7b96c0 313416206 S Ii:6:004:1 -115:4 8 <
ffff88000e7b96c0 313428120 C Ii:6:004:1 0:4 8 = 0321c017 1f135101
ffff88000e7b96c0 313428193 S Ii:6:004:1 -115:4 8 <
ffff88000e7b96c0 313436109 C Ii:6:004:1 0:4 8 = 03213517 9a135301
ffff88000e7b96c0 313436327 S Ii:6:004:1 -115:4 8 <
ffff88000e7b96c0 313448133 C Ii:6:004:1 0:4 8 = 03218f16 14145501
ffff88000e7b96c0 313448325 S Ii:6:004:1 -115:4 8 <
ffff88000e7b96c0 313460111 C Ii:6:004:1 0:4 8 = 0321d515 82145501
ffff88000e7b96c0 313460337 S Ii:6:004:1 -115:4 8 <
ffff88000e7b96c0 313468135 C Ii:6:004:1 0:4 8 = 03210915 dd145501
ffff88000e7b96c0 313468319 S Ii:6:004:1 -115:4 8 <
ffff88000e7b96c0 313480111 C Ii:6:004:1 0:4 8 = 03212c14 1b155201
ffff88000e7b96c0 313480320 S Ii:6:004:1 -115:4 8 <
ffff88000e7b96c0 313488111 C Ii:6:004:1 0:4 8 = 03213c13 3a154f01
ffff88000e7b96c0 313488292 S Ii:6:004:1 -115:4 8 <
ffff88000e7b96c0 313500112 C Ii:6:004:1 0:4 8 = 03213b12 3b154f01
ffff88000e7b96c0 313500306 S Ii:6:004:1 -115:4 8 <
ffff88000e7b96c0 313508131 C Ii:6:004:1 0:4 8 = 03212911 21154f01
ffff88000e7b96c0 313508311 S Ii:6:004:1 -115:4 8 <
ffff88000e7b96c0 313520138 C Ii:6:004:1 0:4 8 = 03210e10 ee145101
ffff88000543c540 313520272 S Ii:6:004:1 -115:4 8 <
ffff88000543c540 313524114 C Ii:6:004:1 0:4 8 = 03210e10 ee145101
ffff88000543c540 313528904 S Ii:6:004:1 -115:4 8 <
ffff88000543c540 313532117 C Ii:6:004:1 0:4 8 = 0321fb0e aa145301
ffff88000543c540 313532171 S Ii:6:004:1 -115:4 8 <
ffff88000543c540 313540132 C Ii:6:004:1 0:4 8 = 0321f80d 56145601
ffff88000e7b9480 313540204 S Ii:6:004:1 -115:4 8 <
ffff88000e7b9480 313552124 C Ii:6:004:1 0:4 8 = 03210a0d eb135801
ffff88000e7b9480 313552191 S Ii:6:004:1 -115:4 8 <
ffff88000e7b9480 313564119 C Ii:6:004:1 0:4 8 = 03211f0c 55135801
ffff88000e7b9480 313564197 S Ii:6:004:1 -115:4 8 <
ffff88000e7b9480 313572116 C Ii:6:004:1 0:4 8 = 0321440b 96125701
ffff88000e7b9480 313573401 S Ii:6:004:1 -115:4 8 <
ffff88000e7b9480 313584120 C Ii:6:004:1 0:4 8 = 0321850a c0115501
ffff88000e7b9480 313584177 S Ii:6:004:1 -115:4 8 <
ffff88000e7b9480 313592117 C Ii:6:004:1 0:4 8 = 0321ee09 de105401
ffff88000e7b9480 313592181 S Ii:6:004:1 -115:4 8 <
ffff88000e7b9480 313604126 C Ii:6:004:1 0:4 8 = 03218d09 07105401
ffff88000543ccc0 313604197 S Ii:6:004:1 -115:4 8 <
ffff88000543ccc0 313612125 C Ii:6:004:1 0:4 8 = 03215809 470f5801
ffff88000543ccc0 313612202 S Ii:6:004:1 -115:4 8 <
ffff88000543ccc0 313624121 C Ii:6:004:1 0:4 8 = 03214a09 a10e5e01
ffff88000543ccc0 313624184 S Ii:6:004:1 -115:4 8 <
ffff88000543ccc0 313636139 C Ii:6:004:1 0:4 8 = 03216309 0d0e6801
ffff88000543ccc0 313636226 S Ii:6:004:1 -115:4 8 <
ffff88000543ccc0 313648125 C Ii:6:004:1 0:4 8 = 0321a909 8e0d7101
ffff88000543ccc0 313648205 S Ii:6:004:1 -115:4 8 <
ffff88000543ccc0 313656137 C Ii:6:004:1 0:4 8 = 0321180a 250d7701
ffff88000e7b93c0 313656217 S Ii:6:004:1 -115:4 8 <
ffff88000e7b93c0 313668137 C Ii:6:004:1 0:4 8 = 0321b50a db0c7a01
ffff88000e7b93c0 313668209 S Ii:6:004:1 -115:4 8 <
ffff88000e7b93c0 313676125 C Ii:6:004:1 0:4 8 = 03217d0b b90c7a01
ffff88000e7b93c0 313676203 S Ii:6:004:1 -115:4 8 <
ffff88000e7b93c0 313688116 C Ii:6:004:1 0:4 8 = 0321720c bb0c7701
ffff88000e7b93c0 313688192 S Ii:6:004:1 -115:4 8 <
ffff88000e7b93c0 313696134 C Ii:6:004:1 0:4 8 = 03218e0d d30c7201
ffff88000e7b93c0 313696334 S Ii:6:004:1 -115:4 8 <
ffff88000e7b93c0 313708143 C Ii:6:004:1 0:4 8 = 0321b80e f10c6e01
ffff88000543c780 313708227 S Ii:6:004:1 -115:4 8 <
ffff88000543c780 313716124 C Ii:6:004:1 0:4 8 = 0321e00f 0b0d6801
ffff88000543c780 313716184 S Ii:6:004:1 -115:4 8 <
ffff88000543c780 313728141 C Ii:6:004:1 0:4 8 = 0321f810 150d6301
ffff88000543c780 313728210 S Ii:6:004:1 -115:4 8 <
ffff88000543c780 313740142 C Ii:6:004:1 0:4 8 = 0321fc11 080d6101
ffff88000e7b9300 313740225 S Ii:6:004:1 -115:4 8 <
ffff88000e7b9300 313748125 C Ii:6:004:1 0:4 8 = 0321f112 e10c6201
ffff88000543cb40 313748191 S Ii:6:004:1 -115:4 8 <
ffff88000543cb40 313760125 C Ii:6:004:1 0:4 8 = 0321d513 9f0c6601
ffff88000543cb40 313760193 S Ii:6:004:1 -115:4 8 <
ffff88000543cb40 313764118 C Ii:6:004:1 0:4 8 = 0321d513 9f0c6601
ffff88000543cb40 313769196 S Ii:6:004:1 -115:4 8 <
ffff88000543cb40 313772138 C Ii:6:004:1 0:4 8 = 0321a614 400c6b01
ffff88000e7b9240 313772194 S Ii:6:004:1 -115:4 8 <
ffff88000e7b9240 313780140 C Ii:6:004:1 0:4 8 = 03216615 ca0b6e01
ffff88000e7b9240 313780282 S Ii:6:004:1 -115:4 8 <
ffff88000e7b9240 313792131 C Ii:6:004:1 0:4 8 = 03210e16 3e0b7001
ffff88000e7b9240 313792214 S Ii:6:004:1 -115:4 8 <
ffff88000e7b9240 313800122 C Ii:6:004:1 0:4 8 = 03219f16 980a7401
ffff88000e7b9240 313800330 S Ii:6:004:1 -115:4 8 <
ffff88000e7b9240 313812127 C Ii:6:004:1 0:4 8 = 03211c17 d5097901
ffff88000e7b9240 313812195 S Ii:6:004:1 -115:4 8 <
ffff88000e7b9240 313824150 C Ii:6:004:1 0:4 8 = 03217717 07097e01
ffff88000543ce40 313824254 S Ii:6:004:1 -115:4 8 <
ffff88000543ce40 313836133 C Ii:6:004:1 0:4 8 = 0321b917 2e087b01
ffff88000e7b9180 313836215 S Ii:6:004:1 -115:4 8 <
ffff88000e7b9180 313844130 C Ii:6:004:1 0:4 8 = 0321e917 51076d01
ffff88000e7b9180 313844206 S Ii:6:004:1 -115:4 8 <
ffff88000e7b9180 313852141 C Ii:6:004:1 0:4 8 = 03210b18 76065901
ffff88000543c0c0 313852206 S Ii:6:004:1 -115:4 8 <
ffff88000543c0c0 313864149 C Ii:6:004:1 0:4 8 = 03212018 81054701
ffff88000543c0c0 313864231 S Ii:6:004:1 -115:4 8 <
ffff88000543c0c0 313876129 C Ii:6:004:1 0:4 8 = 03212818 95044101
ffff88000e7b90c0 313876202 S Ii:6:004:1 -115:4 8 <
ffff88000e7b90c0 313884142 C Ii:6:004:1 0:4 8 = 03212118 c6034601
ffff88000e7b90c0 313884210 S Ii:6:004:1 -115:4 8 <
ffff88000e7b90c0 313896148 C Ii:6:004:1 0:4 8 = 03210818 14035101
ffff88000543c6c0 313896224 S Ii:6:004:1 -115:4 8 <
ffff88000543c6c0 313904139 C Ii:6:004:1 0:4 8 = 0321dc17 7e025c01
ffff88000543c6c0 313904193 S Ii:6:004:1 -115:4 8 <
ffff88000543c6c0 313916141 C Ii:6:004:1 0:4 8 = 03219a17 f5015a01
ffff88000e7b9000 313916202 S Ii:6:004:1 -115:4 8 <
ffff88000e7b9000 313928318 C Ii:6:004:1 0:4 8 = 03214617 73015d01
ffff88000e7b9000 313928451 S Ii:6:004:1 -115:4 8 <
ffff88000e7b9000 313936132 C Ii:6:004:1 0:4 8 = 0321df16 fc005e01
ffff88000e7b9000 313936205 S Ii:6:004:1 -115:4 8 <
ffff88000e7b9000 313948320 C Ii:6:004:1 0:4 8 = 03216716 99005e01
ffff88000543c000 313948463 S Ii:6:004:1 -115:4 8 <
ffff88000543c000 313960148 C Ii:6:004:1 0:4 8 = 0321e315 4f005c01
ffff88000e7b9000 313960218 S Ii:6:004:1 -115:4 8 <
ffff88000e7b9000 313968131 C Ii:6:004:1 0:4 8 = 03214c15 22005a01
ffff88000e7b9000 313968329 S Ii:6:004:1 -115:4 8 <
ffff88000e7b9000 313980129 C Ii:6:004:1 0:4 8 = 0321a014 0c005601
ffff88000e7b9000 313981743 S Ii:6:004:1 -115:4 8 <
ffff88000e7b9000 313988139 C Ii:6:004:1 0:4 8 = 0321de13 01005201
ffff88000e7b9000 313988179 S Ii:6:004:1 -115:4 8 <
ffff88000e7b9000 314000146 C Ii:6:004:1 0:4 8 = 0321ff12 00005801
ffff88000543c000 314000207 S Ii:6:004:1 -115:4 8 <
ffff88000543c000 314004140 C Ii:6:004:1 0:4 8 = 0321ff12 00005801
ffff88000543c000 314004973 S Ii:6:004:1 -115:4 8 <
ffff88000543c000 314008133 C Ii:6:004:1 0:4 8 = 03210e12 00005d01
ffff88000543c000 314009185 S Ii:6:004:1 -115:4 8 <
ffff88000543c000 314024136 C Ii:6:004:1 0:4 8 = 03211911 00006201
ffff88000543c000 314024204 S Ii:6:004:1 -115:4 8 <
ffff88000543c000 314032136 C Ii:6:004:1 0:4 8 = 03212b10 00006301
ffff88000e7b90c0 314032209 S Ii:6:004:1 -115:4 8 <
ffff88000e7b90c0 314040147 C Ii:6:004:1 0:4 8 = 03214e0f 1f006301
ffff88000543c6c0 314040207 S Ii:6:004:1 -115:4 8 <
ffff88000543c6c0 314052152 C Ii:6:004:1 0:4 8 = 0321800e 5c005f01
ffff88000543c6c0 314052222 S Ii:6:004:1 -115:4 8 <
ffff88000543c6c0 314060134 C Ii:6:004:1 0:4 8 = 0321bf0d c5005e01
ffff88000543c6c0 314060203 S Ii:6:004:1 -115:4 8 <
ffff88000543c6c0 314072135 C Ii:6:004:1 0:4 8 = 03210e0d 50016001
ffff88000543c6c0 314072195 S Ii:6:004:1 -115:4 8 <
ffff88000543c6c0 314084322 C Ii:6:004:1 0:4 8 = 0321740c fb016301
ffff88000e7b9180 314084458 S Ii:6:004:1 -115:4 8 <
ffff88000e7b9180 314092133 C Ii:6:004:1 0:4 8 = 0321fb0b b8026401
ffff88000543c0c0 314092189 S Ii:6:004:1 -115:4 8 <
ffff88000543c0c0 314104135 C Ii:6:004:1 0:4 8 = 0321a70b 7d036401
ffff88000543c0c0 314104504 S Ii:6:004:1 -115:4 8 <
ffff88000543c0c0 314116154 C Ii:6:004:1 0:4 8 = 0321770b 45046001
ffff88000e7b9240 314116244 S Ii:6:004:1 -115:4 8 <
ffff88000e7b9240 314124154 C Ii:6:004:1 0:4 8 = 0321680b 0d055f01
ffff88000e7b9240 314124248 S Ii:6:004:1 -115:4 8 <
ffff88000e7b9240 314136142 C Ii:6:004:1 0:4 8 = 0321780b d6055f01
ffff88000543ce40 314138229 S Ii:6:004:1 -115:4 8 <
ffff88000543ce40 314144138 C Ii:6:004:1 0:4 8 = 0321b40b b9066201
ffff88000543ce40 314144202 S Ii:6:004:1 -115:4 8 <
ffff88000543ce40 314156151 C Ii:6:004:1 0:4 8 = 0321260c ac076301
ffff88000543ce40 314156209 S Ii:6:004:1 -115:4 8 <
ffff88000543ce40 314164149 C Ii:6:004:1 0:4 8 = 0321d10c ab086301
ffff88000e7b9300 314164213 S Ii:6:004:1 -115:4 8 <
ffff88000e7b9300 314176154 C Ii:6:004:1 0:4 8 = 0321af0d b3095f01
ffff88000e7b9300 314176223 S Ii:6:004:1 -115:4 8 <
ffff88000e7b9300 314188138 C Ii:6:004:1 0:4 8 = 0321900e 980a5901
ffff88000e7b9300 314188192 S Ii:6:004:1 -115:4 8 <
ffff88000e7b9300 314196134 C Ii:6:004:1 0:4 8 = 03216e0f 630b4f01
ffff88000e7b9300 314196657 S Ii:6:004:1 -115:4 8 <
ffff88000e7b9300 314208155 C Ii:6:004:1 0:4 8 = 03214710 180c4501
ffff88000e7b9300 314208220 S Ii:6:004:1 -115:4 8 <
ffff88000e7b9300 314220142 C Ii:6:004:1 0:4 8 = 03211811 ba0c3d01
ffff88000e7b9300 314220210 S Ii:6:004:1 -115:4 8 <
ffff88000e7b9300 314228140 C Ii:6:004:1 0:4 8 = 0321ea11 5a0d3501
ffff88000e7b9300 314230414 S Ii:6:004:1 -115:4 8 <
ffff88000e7b9300 314240136 C Ii:6:004:1 0:4 8 = 0321b412 f80d2d01
ffff88000e7b9300 314240330 S Ii:6:004:1 -115:4 8 <
ffff88000e7b9300 314248137 C Ii:6:004:1 0:4 8 = 03216e13 9b0e2a01
ffff88000e7b9300 314248302 S Ii:6:004:1 -115:4 8 <
ffff88000e7b9300 314260158 C Ii:6:004:1 0:4 8 = 03211214 490f2901
ffff88000e7b9300 314260236 S Ii:6:004:1 -115:4 8 <
ffff88000e7b9300 314272142 C Ii:6:004:1 0:4 8 = 03219414 f80f3201
ffff88000e7b9300 314272210 S Ii:6:004:1 -115:4 8 <
ffff88000e7b9300 314280137 C Ii:6:004:1 0:4 8 = 0321f814 a7104001
ffff88000e7b9300 314280379 S Ii:6:004:1 -115:4 8 <
ffff88000e7b9300 314292161 C Ii:6:004:1 0:4 8 = 03213d15 4c114a01
ffff88000543cb40 314292234 S Ii:6:004:1 -115:4 8 <
ffff88000543cb40 314304158 C Ii:6:004:1 0:4 8 = 03216115 d1115001
ffff88000e7b93c0 314304228 S Ii:6:004:1 -115:4 8 <
ffff88000e7b93c0 314312139 C Ii:6:004:1 0:4 8 = 03216b15 4b124a01
ffff88000e7b93c0 314312390 S Ii:6:004:1 -115:4 8 <
ffff88000e7b93c0 314320163 C Ii:6:004:1 0:4 8 = 03215c15 ba123e01
ffff88000e7b93c0 314320379 S Ii:6:004:1 -115:4 8 <
ffff88000e7b93c0 314332164 C Ii:6:004:1 0:4 8 = 03213115 23132901
ffff88000e7b93c0 314332366 S Ii:6:004:1 -115:4 8 <
ffff88000e7b93c0 314344146 C Ii:6:004:1 0:4 8 = 0321d214 97130c01
ffff88000e7b93c0 314344312 S Ii:6:004:1 -115:4 8 <
ffff88000e7b93c0 314352140 C Ii:6:004:1 0:4 8 = 03213d14 0914f200
ffff88000e7b93c0 314352322 S Ii:6:004:1 -115:4 8 <
ffff88000e7b93c0 314364161 C Ii:6:004:1 0:4 8 = 03217913 7014e100
ffff88000543c780 314364233 S Ii:6:004:1 -115:4 8 <
ffff88000543c780 314376150 C Ii:6:004:1 0:4 8 = 03219412 c114de00
ffff88000543c780 314376231 S Ii:6:004:1 -115:4 8 <
ffff88000543c780 314384139 C Ii:6:004:1 0:4 8 = 0321a411 f414e600
ffff88000543c780 314384184 S Ii:6:004:1 -115:4 8 <
ffff88000543c780 314396150 C Ii:6:004:1 0:4 8 = 0321af10 0015f000
ffff88000543c780 314396231 S Ii:6:004:1 -115:4 8 <
ffff88000543c780 314404141 C Ii:6:004:1 0:4 8 = 0321bc0f e514f500
ffff88000543c780 314404346 S Ii:6:004:1 -115:4 8 <
ffff88000543c780 314416149 C Ii:6:004:1 0:4 8 = 0321d30e ae14f900
ffff88000543c780 314416235 S Ii:6:004:1 -115:4 8 <
ffff88000543c780 314424142 C Ii:6:004:1 0:4 8 = 0321fe0d 6514ff00
ffff88000543c780 314424405 S Ii:6:004:1 -115:4 8 <
ffff88000543c780 314436161 C Ii:6:004:1 0:4 8 = 0321450d 0f140301
ffff88000e7b9d80 314436237 S Ii:6:004:1 -115:4 8 <
ffff88000e7b9d80 314448164 C Ii:6:004:1 0:4 8 = 0321990c 93130401
ffff88000e7b9d80 314448236 S Ii:6:004:1 -115:4 8 <
ffff88000e7b9d80 314456141 C Ii:6:004:1 0:4 8 = 0321050c e3120201
ffff88000e7b9d80 314456204 S Ii:6:004:1 -115:4 8 <
ffff88000e7b9d80 314468152 C Ii:6:004:1 0:4 8 = 0321920b f811ff00
ffff88000e7b9d80 314468228 S Ii:6:004:1 -115:4 8 <
ffff88000e7b9d80 314476152 C Ii:6:004:1 0:4 8 = 03214d0b e5100301
ffff88000e7b9d80 314476233 S Ii:6:004:1 -115:4 8 <
ffff88000e7b9d80 314480141 C Ii:6:004:1 0:4 8 = 03214d0b e5100301
ffff88000e7b9d80 314482236 S Ii:6:004:1 -115:4 8 <
ffff88000e7b9d80 314492166 C Ii:6:004:1 0:4 8 = 03213c0b ee0f1001
ffff88000543ccc0 314492237 S Ii:6:004:1 -115:4 8 <
ffff88000543ccc0 314500150 C Ii:6:004:1 0:4 8 = 0321590b 0f0f1f01
ffff88000543ccc0 314500198 S Ii:6:004:1 -115:4 8 <
ffff88000543ccc0 314508146 C Ii:6:004:1 0:4 8 = 0321a00b 3e0e2d01
ffff88000543ccc0 314508353 S Ii:6:004:1 -115:4 8 <
ffff88000543ccc0 314520144 C Ii:6:004:1 0:4 8 = 0321110c 7e0d3801
ffff88000543ccc0 314520202 S Ii:6:004:1 -115:4 8 <
ffff88000543ccc0 314528150 C Ii:6:004:1 0:4 8 = 0321b40c d00c3901
ffff88000543ccc0 314528216 S Ii:6:004:1 -115:4 8 <
ffff88000543ccc0 314540154 C Ii:6:004:1 0:4 8 = 0321840d 320c3301
ffff88000e7b9cc0 314540223 S Ii:6:004:1 -115:4 8 <
ffff88000e7b9cc0 314552145 C Ii:6:004:1 0:4 8 = 03216c0e 9c0b2a01
ffff88000e7b9cc0 314552239 S Ii:6:004:1 -115:4 8 <
ffff88000e7b9cc0 314560144 C Ii:6:004:1 0:4 8 = 03215e0f fe0a1d01
ffff88000e7b9cc0 314560363 S Ii:6:004:1 -115:4 8 <
ffff88000e7b9cc0 314572151 C Ii:6:004:1 0:4 8 = 03214910 560a1301
ffff88000e7b9cc0 314572292 S Ii:6:004:1 -115:4 8 <
ffff88000e7b9cc0 314584154 C Ii:6:004:1 0:4 8 = 03212611 a4090901
ffff88000543c540 314584265 S Ii:6:004:1 -115:4 8 <
ffff88000543c540 314592155 C Ii:6:004:1 0:4 8 = 0321d911 ff080201
ffff88000e7b9c00 314592222 S Ii:6:004:1 -115:4 8 <
ffff88000e7b9c00 314604166 C Ii:6:004:1 0:4 8 = 03217212 6308ff00
ffff88000543c9c0 314604231 S Ii:6:004:1 -115:4 8 <
ffff88000543c9c0 314612152 C Ii:6:004:1 0:4 8 = 0321fa12 ca07ff00
ffff88000543c9c0 314612219 S Ii:6:004:1 -115:4 8 <
ffff88000543c9c0 314624174 C Ii:6:004:1 0:4 8 = 03217313 33070101
ffff88000e7b9480 314624285 S Ii:6:004:1 -115:4 8 <
ffff88000e7b9480 314636156 C Ii:6:004:1 0:4 8 = 0321ee13 7e060401
ffff88000e7b9480 314636235 S Ii:6:004:1 -115:4 8 <
ffff88000e7b9480 314644166 C Ii:6:004:1 0:4 8 = 03215b14 b6050901
ffff88000e7b9480 314644348 S Ii:6:004:1 -115:4 8 <
ffff88000e7b9480 314656169 C Ii:6:004:1 0:4 8 = 0321b314 de040d01
ffff88000e7b9480 314656378 S Ii:6:004:1 -115:4 8 <
ffff88000e7b9480 314664158 C Ii:6:004:1 0:4 8 = 0321ef14 fd031101
ffff88000543c240 314664222 S Ii:6:004:1 -115:4 8 <
ffff88000543c240 314676168 C Ii:6:004:1 0:4 8 = 03210e15 1d031201
ffff88000543c240 314676221 S Ii:6:004:1 -115:4 8 <
ffff88000543c240 314688160 C Ii:6:004:1 0:4 8 = 03210e15 48021801
ffff88000543c240 314688213 S Ii:6:004:1 -115:4 8 <
ffff88000543c240 314696170 C Ii:6:004:1 0:4 8 = 0321f314 89012301
ffff88000543c240 314696362 S Ii:6:004:1 -115:4 8 <
ffff88000543c240 314708158 C Ii:6:004:1 0:4 8 = 0321c114 ef003301
ffff88000543c240 314708202 S Ii:6:004:1 -115:4 8 <
ffff88000543c240 314716158 C Ii:6:004:1 0:4 8 = 03217b14 81004401
ffff88000543c240 314716224 S Ii:6:004:1 -115:4 8 <
ffff88000543c240 314720147 C Ii:6:004:1 0:4 8 = 03217b14 81004401
ffff88000543c240 314724866 S Ii:6:004:1 -115:4 8 <
ffff88000543c240 314728172 C Ii:6:004:1 0:4 8 = 03212214 3b004b01
ffff88000e7b96c0 314728316 S Ii:6:004:1 -115:4 8 <
ffff88000e7b96c0 314740182 C Ii:6:004:1 0:4 8 = 0321b213 18004501
ffff88000e7b96c0 314740245 S Ii:6:004:1 -115:4 8 <
ffff88000e7b96c0 314748157 C Ii:6:004:1 0:4 8 = 03212913 0a003901
ffff88000e7b96c0 314748221 S Ii:6:004:1 -115:4 8 <
ffff88000e7b96c0 314760161 C Ii:6:004:1 0:4 8 = 03218812 0d002b01
ffff88000e7b96c0 314760239 S Ii:6:004:1 -115:4 8 <
ffff88000e7b96c0 314772171 C Ii:6:004:1 0:4 8 = 0321d111 25002001
ffff88000e7b96c0 314772228 S Ii:6:004:1 -115:4 8 <
ffff88000e7b96c0 314780151 C Ii:6:004:1 0:4 8 = 03210a11 53001d01
ffff88000e7b96c0 314780391 S Ii:6:004:1 -115:4 8 <
ffff88000e7b96c0 314792175 C Ii:6:004:1 0:4 8 = 03213810 9b001d01
ffff88000543cc00 314792241 S Ii:6:004:1 -115:4 8 <
ffff88000543cc00 314800153 C Ii:6:004:1 0:4 8 = 0321610f f8002101
ffff88000543cc00 314800213 S Ii:6:004:1 -115:4 8 <
ffff88000543cc00 314812172 C Ii:6:004:1 0:4 8 = 03218a0e 66012701
ffff88000543cc00 314812226 S Ii:6:004:1 -115:4 8 <
ffff88000543cc00 314820155 C Ii:6:004:1 0:4 8 = 0321bf0d e2012f01
ffff88000543cc00 314820220 S Ii:6:004:1 -115:4 8 <
ffff88000543cc00 314832165 C Ii:6:004:1 0:4 8 = 0321050d 66023701
ffff88000543cc00 314832260 S Ii:6:004:1 -115:4 8 <
ffff88000543cc00 314844174 C Ii:6:004:1 0:4 8 = 0321650c ee024001
ffff88000543cc00 314844231 S Ii:6:004:1 -115:4 8 <
ffff88000543cc00 314852177 C Ii:6:004:1 0:4 8 = 0321e40b 7c034601
ffff88000543cc00 314852236 S Ii:6:004:1 -115:4 8 <
ffff88000543cc00 314864175 C Ii:6:004:1 0:4 8 = 0321850b 11044901
ffff88000543cc00 314864224 S Ii:6:004:1 -115:4 8 <
ffff88000543cc00 314872168 C Ii:6:004:1 0:4 8 = 0321490b a9044a01
ffff88000543cc00 314872251 S Ii:6:004:1 -115:4 8 <
ffff88000543cc00 314884175 C Ii:6:004:1 0:4 8 = 0321310b 40054801
ffff88000e7b9780 314884249 S Ii:6:004:1 -115:4 8 <
ffff88000e7b9780 314896176 C Ii:6:004:1 0:4 8 = 03213f0b d1054601
ffff88000543cc00 314896222 S Ii:6:004:1 -115:4 8 <
ffff88000543cc00 314904195 C Ii:6:004:1 0:4 8 = 0321700b 55064501
ffff88000e7b9840 314904352 S Ii:6:004:1 -115:4 8 <
ffff88000e7b9840 314916179 C Ii:6:004:1 0:4 8 = 0321da0b de064301
ffff88000543c240 314916242 S Ii:6:004:1 -115:4 8 <
ffff88000543c240 314928192 C Ii:6:004:1 0:4 8 = 03217b0c 6c074301
ffff88000e7b99c0 314928322 S Ii:6:004:1 -115:4 8 <
ffff88000e7b99c0 314936351 C Ii:6:004:1 0:4 8 = 03214d0d 06084101
ffff88000543c9c0 314936475 S Ii:6:004:1 -115:4 8 <
ffff88000543c9c0 314948184 C Ii:6:004:1 0:4 8 = 0321470e b5084001
ffff88000e7b9900 314948272 S Ii:6:004:1 -115:4 8 <
ffff88000e7b9900 314960180 C Ii:6:004:1 0:4 8 = 0321450f 76093901
ffff88000543c540 314960257 S Ii:6:004:1 -115:4 8 <
ffff88000543c540 314964154 C Ii:6:004:1 0:4 8 = 0321450f 76093901
ffff88000543c540 314965175 S Ii:6:004:1 -115:4 8 <
ffff88000543c540 314968164 C Ii:6:004:1 0:4 8 = 03214610 4c0a2c01
ffff88000543c540 314973765 S Ii:6:004:1 -115:4 8 <
ffff88000543c540 314980180 C Ii:6:004:1 0:4 8 = 03214611 2e0b1b01
ffff88000e7b9b40 314980268 S Ii:6:004:1 -115:4 8 <
ffff88000e7b9b40 314988163 C Ii:6:004:1 0:4 8 = 03213612 0c0c0a01
ffff88000e7b9b40 314988262 S Ii:6:004:1 -115:4 8 <
ffff88000e7b9b40 315000163 C Ii:6:004:1 0:4 8 = 03210f13 dd0c0401
ffff88000e7b9b40 315000391 S Ii:6:004:1 -115:4 8 <
ffff88000e7b9b40 315008161 C Ii:6:004:1 0:4 8 = 0321d713 a60d0a01
ffff88000e7b9b40 315008273 S Ii:6:004:1 -115:4 8 <
ffff88000e7b9b40 315020166 C Ii:6:004:1 0:4 8 = 03218914 620e1701
ffff88000543ccc0 315020238 S Ii:6:004:1 -115:4 8 <
ffff88000543ccc0 315028179 C Ii:6:004:1 0:4 8 = 03212615 140f2201
ffff88000543ccc0 315028403 S Ii:6:004:1 -115:4 8 <
ffff88000543ccc0 315040190 C Ii:6:004:1 0:4 8 = 0321aa15 bd0f2301
ffff88000543ccc0 315040241 S Ii:6:004:1 -115:4 8 <
ffff88000543ccc0 315052163 C Ii:6:004:1 0:4 8 = 03210a16 5c101e01
ffff88000543ccc0 315052418 S Ii:6:004:1 -115:4 8 <
ffff88000543ccc0 315060163 C Ii:6:004:1 0:4 8 = 03214316 ec101701
ffff88000543ccc0 315060353 S Ii:6:004:1 -115:4 8 <
ffff88000543ccc0 315072171 C Ii:6:004:1 0:4 8 = 03215716 6b111301
ffff88000543ccc0 315072233 S Ii:6:004:1 -115:4 8 <
ffff88000543ccc0 315084184 C Ii:6:004:1 0:4 8 = 03214c16 d2111701
ffff88000543ccc0 315084264 S Ii:6:004:1 -115:4 8 <
ffff88000543ccc0 315092162 C Ii:6:004:1 0:4 8 = 03212516 30122001
ffff88000543ccc0 315094559 S Ii:6:004:1 -115:4 8 <
ffff88000543ccc0 315104175 C Ii:6:004:1 0:4 8 = 0321e215 8b122a01
ffff88000543ccc0 315104245 S Ii:6:004:1 -115:4 8 <
ffff88000543ccc0 315112186 C Ii:6:004:1 0:4 8 = 03218515 e4123401
ffff88000543ccc0 315112299 S Ii:6:004:1 -115:4 8 <
ffff88000543ccc0 315124173 C Ii:6:004:1 0:4 8 = 0321f314 48133a01
ffff88000543ccc0 315124235 S Ii:6:004:1 -115:4 8 <
ffff88000543ccc0 315132162 C Ii:6:004:1 0:4 8 = 03213314 ad134301
ffff88000543ccc0 315132357 S Ii:6:004:1 -115:4 8 <
ffff88000543ccc0 315148185 C Ii:6:004:1 0:4 8 = 03215913 06144f01
ffff88000e7b9a80 315148260 S Ii:6:004:1 -115:4 8 <
ffff88000e7b9a80 315156167 C Ii:6:004:1 0:4 8 = 03217612 4c145a01
ffff88000e7b9a80 315156772 S Ii:6:004:1 -115:4 8 <
ffff88000e7b9a80 315168187 C Ii:6:004:1 0:4 8 = 03219411 73145b01
ffff88000543c780 315168260 S Ii:6:004:1 -115:4 8 <
ffff88000543c780 315176188 C Ii:6:004:1 0:4 8 = 0321b410 6d144a01
ffff88000543c780 315176303 S Ii:6:004:1 -115:4 8 <
ffff88000543c780 315188177 C Ii:6:004:1 0:4 8 = 0321dd0f 3c142901
ffff88000e7b9a80 315188249 S Ii:6:004:1 -115:4 8 <
ffff88000e7b9a80 315196185 C Ii:6:004:1 0:4 8 = 0321150f e813e700
ffff88000e7b9a80 315196313 S Ii:6:004:1 -115:4 8 <
ffff88000e7b9a80 315200171 C Ii:6:004:1 0:4 8 = 0321150f e813e700
ffff88000e7b9a80 315201102 S Ii:6:004:1 -115:4 8 <
ffff88000e7b9a80 315208186 C Ii:6:004:1 0:4 8 = 03215f0e 7d134e00
ffff88000543cb40 315208253 S Ii:6:004:1 -115:4 8 <
ffff88000543cb40 315216167 C Ii:6:004:1 0:4 8 = 0320be0d 06130000
ffff88000543cb40 315217957 S Ii:6:004:1 -115:4 8 <
ffff88000543cb40 315228177 C Ii:6:004:1 0:4 8 = 0320390d 97120000
ffff88000543cb40 315228257 S Ii:6:004:1 -115:4 8 <
ffff88000543cb40 315240184 C Ii:6:004:1 0:4 8 = 0320d10c 3b120000
ffff88000543cb40 315240259 S Ii:6:004:1 -115:4 8 <
ffff88000543cb40 315248170 C Ii:6:004:1 0:4 8 = 03207e0c e3110000
ffff88000e7b9b40 315248447 S Ii:6:004:1 -115:4 8 <
ffff88000e7b9b40 315260193 C Ii:6:004:1 0:4 8 = 03203f0c 92110000
ffff88000e7b9b40 315260301 S Ii:6:004:1 -115:4 8 <
ffff88000e7b9b40 315268192 C Ii:6:004:1 0:4 8 = 0320050c 4b110000
ffff88000543ce40 315268275 S Ii:6:004:1 -115:4 8 <
ffff88000543ce40 315280213 C Ii:6:004:1 0:4 8 = 0320ca0b 14110000
ffff88000543ce40 315280358 S Ii:6:004:1 -115:4 8 <
ffff88000543ce40 315292341 C Ii:6:004:1 0:4 8 = 0320880b ea100000
ffff88000e7b9900 315292558 S Ii:6:004:1 -115:4 8 <
ffff88000e7b9900 315300186 C Ii:6:004:1 0:4 8 = 0320420b c7100000
ffff88000e7b9900 315300292 S Ii:6:004:1 -115:4 8 <
ffff88000e7b9900 315312362 C Ii:6:004:1 0:4 8 = 0320000b a3100000
ffff88000543c0c0 315312503 S Ii:6:004:1 -115:4 8 <
ffff88000543c0c0 315320193 C Ii:6:004:1 0:4 8 = 0320c20a 7b100000
ffff88000543c0c0 315320266 S Ii:6:004:1 -115:4 8 <
ffff88000543c0c0 315332385 C Ii:6:004:1 0:4 8 = 0320840a 4c100000
ffff88000543c0c0 315332573 S Ii:6:004:1 -115:4 8 <
ffff88000543c0c0 315344213 C Ii:6:004:1 0:4 8 = 0320400a 13100000
ffff88000e7b99c0 315344397 S Ii:6:004:1 -115:4 8 <
ffff88000e7b99c0 315352174 C Ii:6:004:1 0:4 8 = 0320f709 d00f0000
ffff88000e7b99c0 315352226 S Ii:6:004:1 -115:4 8 <
ffff88000e7b99c0 315364367 C Ii:6:004:1 0:4 8 = 0320b109 8a0f0000
ffff88000e7b99c0 315364500 S Ii:6:004:1 -115:4 8 <
ffff88000e7b99c0 315372193 C Ii:6:004:1 0:4 8 = 03206e09 520f0000
ffff88000e7b99c0 315372275 S Ii:6:004:1 -115:4 8 <
ffff88000e7b99c0 315384367 C Ii:6:004:1 0:4 8 = 03202909 280f0000
ffff88000e7b99c0 315384492 S Ii:6:004:1 -115:4 8 <
ffff88000e7b99c0 315396247 C Ii:6:004:1 0:4 8 = 0320e508 ee0e0000
ffff88000543c6c0 315396384 S Ii:6:004:1 -115:4 8 <
ffff88000543c6c0 315404370 C Ii:6:004:1 0:4 8 = 03209f08 a80e0000
ffff88000e7b9840 315404483 S Ii:6:004:1 -115:4 8 <
ffff88000e7b9840 315416220 C Ii:6:004:1 0:4 8 = 03205508 670e0000
ffff88000543c000 315416398 S Ii:6:004:1 -115:4 8 <
ffff88000543c000 315532371 C Ii:6:004:1 0:4 8 = 03005508 670e0000
ffff88000e7b9780 315532467 S Ii:6:004:1 -115:4 8 <
ffff88000e7b9780 315536179 C Ii:6:004:1 0:4 8 = 03005508 670e0000
ffff88000e7b9780 315536974 S Ii:6:004:1 -115:4 8 <
ffff88000e7b9780 319536525 C Ii:6:004:1 0:4 8 = 0320070e fa0f0000
ffff88000e7b9780 319536744 S Ii:6:004:1 -115:4 8 <
ffff88000e7b9780 319544522 C Ii:6:004:1 0:4 8 = 0320070e fa0f0000
ffff88000e7b9780 319544700 S Ii:6:004:1 -115:4 8 <
ffff88000e7b9780 319560336 C Ii:6:004:1 0:4 8 = 03200a0e e60f0000
ffff88000e7b9780 319560425 S Ii:6:004:1 -115:4 8 <
ffff88000e7b9780 319568335 C Ii:6:004:1 0:4 8 = 03201a0e d60f0000
ffff88000543c000 319568499 S Ii:6:004:1 -115:4 8 <
ffff88000543c000 319576315 C Ii:6:004:1 0:4 8 = 03202f0e c50f0000
ffff88000543c000 319577769 S Ii:6:004:1 -115:4 8 <
ffff88000543c000 319588309 C Ii:6:004:1 0:4 8 = 03204a0e b90f0000
ffff88000543c000 319593337 S Ii:6:004:1 -115:4 8 <
ffff88000543c000 319596312 C Ii:6:004:1 0:4 8 = 0320660e ab0f0000
ffff88000543c780 319601190 S Ii:6:004:1 -115:4 8 <
ffff88000543c780 319608330 C Ii:6:004:1 0:4 8 = 0320800e 990f0000
ffff88000543c780 319608394 S Ii:6:004:1 -115:4 8 <
ffff88000543c780 319620313 C Ii:6:004:1 0:4 8 = 03209c0e 8f0f0000
ffff88000e7b9480 319620369 S Ii:6:004:1 -115:4 8 <
ffff88000e7b9480 319628315 C Ii:6:004:1 0:4 8 = 0320bb0e 830f0000
ffff88000e7b9480 319628379 S Ii:6:004:1 -115:4 8 <
ffff88000e7b9480 319640314 C Ii:6:004:1 0:4 8 = 0320d90e 730f0000
ffff88000543cb40 319640374 S Ii:6:004:1 -115:4 8 <
ffff88000543cb40 319652318 C Ii:6:004:1 0:4 8 = 0320f30e 610f0000
ffff88000543cb40 319652582 S Ii:6:004:1 -115:4 8 <
ffff88000543cb40 319660329 C Ii:6:004:1 0:4 8 = 03200c0f 4c0f0000
ffff88000e7b9cc0 319660468 S Ii:6:004:1 -115:4 8 <
ffff88000e7b9cc0 319672529 C Ii:6:004:1 0:4 8 = 0320240f 380f0000
ffff88000e7b9cc0 319672728 S Ii:6:004:1 -115:4 8 <
ffff88000e7b9cc0 319680322 C Ii:6:004:1 0:4 8 = 03203b0f 250f0000
ffff88000e7b9cc0 319680403 S Ii:6:004:1 -115:4 8 <
ffff88000e7b9cc0 319692336 C Ii:6:004:1 0:4 8 = 0320510f 170f0000
ffff88000543cc00 319692432 S Ii:6:004:1 -115:4 8 <
ffff88000543cc00 319704378 C Ii:6:004:1 0:4 8 = 0320610f 0f0f0000
ffff88000543cc00 319704531 S Ii:6:004:1 -115:4 8 <
ffff88000543cc00 319712351 C Ii:6:004:1 0:4 8 = 03206b0f 070f0000
ffff88000543cc00 319712478 S Ii:6:004:1 -115:4 8 <
ffff88000543cc00 319724339 C Ii:6:004:1 0:4 8 = 03206b0f 070f0000
ffff88000e7b9300 319724447 S Ii:6:004:1 -115:4 8 <
ffff88000e7b9300 319732529 C Ii:6:004:1 0:4 8 = 0320700f fc0e0000
ffff88000543c6c0 319732758 S Ii:6:004:1 -115:4 8 <
ffff88000543c6c0 319744339 C Ii:6:004:1 0:4 8 = 0320750f eb0e0000
ffff88000e7b96c0 319744426 S Ii:6:004:1 -115:4 8 <
ffff88000e7b96c0 319752529 C Ii:6:004:1 0:4 8 = 03207a0f da0e0000
ffff88000e7b96c0 319752685 S Ii:6:004:1 -115:4 8 <
ffff88000e7b96c0 319756345 C Ii:6:004:1 0:4 8 = 03207a0f da0e0000
ffff88000543c6c0 319757100 S Ii:6:004:1 -115:4 8 <
ffff88000543c6c0 319764321 C Ii:6:004:1 0:4 8 = 03207b0f cc0e0000
ffff88000e7b90c0 319764414 S Ii:6:004:1 -115:4 8 <
ffff88000e7b90c0 319776340 C Ii:6:004:1 0:4 8 = 03207b0f cc0e0000
ffff88000e7b90c0 319776432 S Ii:6:004:1 -115:4 8 <
ffff88000e7b90c0 319784330 C Ii:6:004:1 0:4 8 = 0320840f bc0e0000
ffff88000e7b90c0 319784456 S Ii:6:004:1 -115:4 8 <
ffff88000e7b90c0 319796334 C Ii:6:004:1 0:4 8 = 03208e0f ad0e0000
ffff88000e7b90c0 319796399 S Ii:6:004:1 -115:4 8 <
ffff88000e7b90c0 319804358 C Ii:6:004:1 0:4 8 = 0320980f a10e0000
ffff88000e7b90c0 319804517 S Ii:6:004:1 -115:4 8 <
ffff88000e7b90c0 319816343 C Ii:6:004:1 0:4 8 = 0320a00f 970e0000
ffff88000e7b90c0 319816416 S Ii:6:004:1 -115:4 8 <
ffff88000e7b90c0 319828336 C Ii:6:004:1 0:4 8 = 0320a80f 8c0e0000
ffff88000543cc00 319828483 S Ii:6:004:1 -115:4 8 <
ffff88000543cc00 319840322 C Ii:6:004:1 0:4 8 = 0320b10f 7e0e0000
ffff88000543cc00 319840909 S Ii:6:004:1 -115:4 8 <
ffff88000543cc00 319848330 C Ii:6:004:1 0:4 8 = 0320ba0f 700e0000
ffff88000543cc00 319848382 S Ii:6:004:1 -115:4 8 <
ffff88000543cc00 319856320 C Ii:6:004:1 0:4 8 = 0320c30f 620e0000
ffff88000543cc00 319856369 S Ii:6:004:1 -115:4 8 <
ffff88000543cc00 319868339 C Ii:6:004:1 0:4 8 = 0320cc0f 560e0000
ffff88000543cc00 319868452 S Ii:6:004:1 -115:4 8 <
ffff88000543cc00 319880511 C Ii:6:004:1 0:4 8 = 0320d30f 4c0e0000
ffff88000543cc00 319880645 S Ii:6:004:1 -115:4 8 <
ffff88000543cc00 319888508 C Ii:6:004:1 0:4 8 = 0320d30f 4c0e0000
ffff88000543cc00 319888600 S Ii:6:004:1 -115:4 8 <
ffff88000543cc00 319900323 C Ii:6:004:1 0:4 8 = 0320dd0f 430e0000
ffff88000543cc00 319900639 S Ii:6:004:1 -115:4 8 <
ffff88000543cc00 319912340 C Ii:6:004:1 0:4 8 = 0320e40f 3b0e0000
ffff88000543cc00 319912510 S Ii:6:004:1 -115:4 8 <
ffff88000543cc00 319920362 C Ii:6:004:1 0:4 8 = 0320ea0f 320e0000
ffff88000543cc00 319920513 S Ii:6:004:1 -115:4 8 <
ffff88000543cc00 319932332 C Ii:6:004:1 0:4 8 = 0320f20f 280e0000
ffff88000543cc00 319932833 S Ii:6:004:1 -115:4 8 <
ffff88000543cc00 319940330 C Ii:6:004:1 0:4 8 = 0320fc0f 190e0000
ffff88000e7b9000 319940402 S Ii:6:004:1 -115:4 8 <
ffff88000e7b9000 319952356 C Ii:6:004:1 0:4 8 = 03200810 080e0000
ffff88000e7b9000 319952474 S Ii:6:004:1 -115:4 8 <
ffff88000e7b9000 319964332 C Ii:6:004:1 0:4 8 = 03201510 f90d0000
ffff88000543cb40 319964581 S Ii:6:004:1 -115:4 8 <
ffff88000543cb40 319972345 C Ii:6:004:1 0:4 8 = 03202210 ea0d0000
ffff88000e7b9d80 319972413 S Ii:6:004:1 -115:4 8 <
ffff88000e7b9d80 319984423 C Ii:6:004:1 0:4 8 = 03202f10 dd0d0000
ffff88000543c780 319984516 S Ii:6:004:1 -115:4 8 <
ffff88000543c780 319996345 C Ii:6:004:1 0:4 8 = 03203e10 d30d0000
ffff88000543c780 319996411 S Ii:6:004:1 -115:4 8 <
ffff88000543c780 320004350 C Ii:6:004:1 0:4 8 = 03204e10 cb0d0000
ffff88000543c780 320004454 S Ii:6:004:1 -115:4 8 <
ffff88000543c780 320016515 C Ii:6:004:1 0:4 8 = 03205f10 c40d0000
ffff88000543c780 320016639 S Ii:6:004:1 -115:4 8 <
ffff88000543c780 320028368 C Ii:6:004:1 0:4 8 = 03206e10 bd0d0000
ffff88000543c780 320028515 S Ii:6:004:1 -115:4 8 <
ffff88000543c780 320036540 C Ii:6:004:1 0:4 8 = 03207d10 b70d0000
ffff88000543c780 320036968 S Ii:6:004:1 -115:4 8 <
ffff88000543c780 320044344 C Ii:6:004:1 0:4 8 = 03208a10 b20d0000
ffff88000543c780 320044406 S Ii:6:004:1 -115:4 8 <
ffff88000543c780 320056329 C Ii:6:004:1 0:4 8 = 03209810 ae0d0000
ffff88000543c780 320056572 S Ii:6:004:1 -115:4 8 <
ffff88000543c780 320068347 C Ii:6:004:1 0:4 8 = 0320a510 ac0d0000
ffff88000e7b9180 320068424 S Ii:6:004:1 -115:4 8 <
ffff88000e7b9180 320076518 C Ii:6:004:1 0:4 8 = 0320a510 ac0d0000
ffff88000e7b9180 320076630 S Ii:6:004:1 -115:4 8 <
ffff88000e7b9180 320088351 C Ii:6:004:1 0:4 8 = 0320b810 af0d0000
ffff88000543c000 320088610 S Ii:6:004:1 -115:4 8 <
ffff88000543c000 320096327 C Ii:6:004:1 0:4 8 = 0320c810 b40d0000
ffff88000543c000 320097324 S Ii:6:004:1 -115:4 8 <
ffff88000543c000 320108346 C Ii:6:004:1 0:4 8 = 0320d510 b90d0000
ffff88000543c000 320108408 S Ii:6:004:1 -115:4 8 <
ffff88000543c000 320120348 C Ii:6:004:1 0:4 8 = 0320e010 bf0d0000
ffff88000543c000 320120405 S Ii:6:004:1 -115:4 8 <
ffff88000543c000 320128540 C Ii:6:004:1 0:4 8 = 0320eb10 c40d0000
ffff88000543c000 320128692 S Ii:6:004:1 -115:4 8 <
ffff88000543c000 320140408 C Ii:6:004:1 0:4 8 = 0320f710 c80d0000
ffff88000543c000 320140640 S Ii:6:004:1 -115:4 8 <
ffff88000543c000 320152349 C Ii:6:004:1 0:4 8 = 03200311 cb0d0000
ffff88000543c000 320152413 S Ii:6:004:1 -115:4 8 <
ffff88000543c000 320160544 C Ii:6:004:1 0:4 8 = 03200f11 ce0d0000
ffff88000543c000 320160693 S Ii:6:004:1 -115:4 8 <
ffff88000543c000 320172522 C Ii:6:004:1 0:4 8 = 03201b11 d10d0000
ffff88000543c000 320172638 S Ii:6:004:1 -115:4 8 <
ffff88000543c000 320180365 C Ii:6:004:1 0:4 8 = 03202911 d50d0000
ffff88000543c000 320180491 S Ii:6:004:1 -115:4 8 <
ffff88000543c000 320192356 C Ii:6:004:1 0:4 8 = 03203811 dc0d0000
ffff88000543c000 320192472 S Ii:6:004:1 -115:4 8 <
ffff88000543c000 320200544 C Ii:6:004:1 0:4 8 = 03204811 e80d0000
ffff88000543c000 320200737 S Ii:6:004:1 -115:4 8 <
ffff88000543c000 320212351 C Ii:6:004:1 0:4 8 = 03205611 fb0d0000
ffff88000543c000 320212424 S Ii:6:004:1 -115:4 8 <
ffff88000543c000 320224356 C Ii:6:004:1 0:4 8 = 03206311 120e0000
ffff88000543c000 320224439 S Ii:6:004:1 -115:4 8 <
ffff88000543c000 320232371 C Ii:6:004:1 0:4 8 = 03207011 290e0000
ffff88000543c000 320232518 S Ii:6:004:1 -115:4 8 <
ffff88000543c000 320235359 C Ii:6:004:1 0:4 8 = 03207011 290e0000
ffff88000543c000 320241824 S Ii:6:004:1 -115:4 8 <
ffff88000543c000 320244351 C Ii:6:004:1 0:4 8 = 03207c11 3f0e0000
ffff88000e7b9180 320244496 S Ii:6:004:1 -115:4 8 <
ffff88000e7b9180 320256361 C Ii:6:004:1 0:4 8 = 03208311 4b0e0000
ffff88000e7b9180 320256729 S Ii:6:004:1 -115:4 8 <
ffff88000e7b9180 320264342 C Ii:6:004:1 0:4 8 = 03208311 4b0e0000
ffff88000543cc00 320264415 S Ii:6:004:1 -115:4 8 <
ffff88000543cc00 320276527 C Ii:6:004:1 0:4 8 = 03208311 4b0e0000
ffff88000543cc00 320276647 S Ii:6:004:1 -115:4 8 <
ffff88000543cc00 320284350 C Ii:6:004:1 0:4 8 = 03208311 4b0e0000
ffff88000543cc00 320284450 S Ii:6:004:1 -115:4 8 <
ffff88000543cc00 320296369 C Ii:6:004:1 0:4 8 = 03218311 4b0ead00
ffff88000543cc00 320296490 S Ii:6:004:1 -115:4 8 <
ffff88000543cc00 320308523 C Ii:6:004:1 0:4 8 = 03218411 4c0ebb00
ffff88000e7b9d80 320308619 S Ii:6:004:1 -115:4 8 <
ffff88000e7b9d80 320316358 C Ii:6:004:1 0:4 8 = 03218511 4d0ec100
ffff88000e7b9d80 320316427 S Ii:6:004:1 -115:4 8 <
ffff88000e7b9d80 320328528 C Ii:6:004:1 0:4 8 = 03218611 4e0ec300
ffff88000e7b9d80 320328650 S Ii:6:004:1 -115:4 8 <
ffff88000e7b9d80 320336359 C Ii:6:004:1 0:4 8 = 03218711 4f0ec300
ffff88000e7b9d80 320336439 S Ii:6:004:1 -115:4 8 <
ffff88000e7b9d80 320348370 C Ii:6:004:1 0:4 8 = 03218711 500ec300
ffff88000e7b9d80 320348477 S Ii:6:004:1 -115:4 8 <
ffff88000e7b9d80 320360376 C Ii:6:004:1 0:4 8 = 03218811 510ec300
ffff88000e7b9d80 320360503 S Ii:6:004:1 -115:4 8 <
ffff88000e7b9d80 320368340 C Ii:6:004:1 0:4 8 = 03218811 510ec300
ffff88000e7b9d80 320368396 S Ii:6:004:1 -115:4 8 <
ffff88000e7b9d80 320380374 C Ii:6:004:1 0:4 8 = 03218911 520ec300
ffff88000e7b9d80 320380518 S Ii:6:004:1 -115:4 8 <
ffff88000e7b9d80 320388551 C Ii:6:004:1 0:4 8 = 03218911 520ec800
ffff88000e7b9d80 320388735 S Ii:6:004:1 -115:4 8 <
ffff88000e7b9d80 320400352 C Ii:6:004:1 0:4 8 = 03218a11 530ecd00
ffff88000e7b9d80 320400438 S Ii:6:004:1 -115:4 8 <
ffff88000e7b9d80 320412345 C Ii:6:004:1 0:4 8 = 03218a11 530ed300
ffff88000e7b9d80 320412425 S Ii:6:004:1 -115:4 8 <
ffff88000e7b9d80 320420511 C Ii:6:004:1 0:4 8 = 03218b11 540eda00
ffff88000e7b9d80 320420603 S Ii:6:004:1 -115:4 8 <
ffff88000e7b9d80 320432553 C Ii:6:004:1 0:4 8 = 03218b11 540edf00
ffff88000e7b9d80 320432814 S Ii:6:004:1 -115:4 8 <
ffff88000e7b9d80 320440552 C Ii:6:004:1 0:4 8 = 03218c11 550ee300
ffff88000e7b9d80 320440745 S Ii:6:004:1 -115:4 8 <
ffff88000e7b9d80 320452351 C Ii:6:004:1 0:4 8 = 03218c11 550ee800
ffff88000e7b9d80 320452639 S Ii:6:004:1 -115:4 8 <
ffff88000e7b9d80 320460530 C Ii:6:004:1 0:4 8 = 03218d11 550eee00
ffff88000543c6c0 320460660 S Ii:6:004:1 -115:4 8 <
ffff88000543c6c0 320472340 C Ii:6:004:1 0:4 8 = 03218d11 550ef400
ffff88000543c6c0 320472413 S Ii:6:004:1 -115:4 8 <
ffff88000543c6c0 320475361 C Ii:6:004:1 0:4 8 = 03218d11 550ef400
ffff88000543c6c0 320482047 S Ii:6:004:1 -115:4 8 <
ffff88000543c6c0 320484344 C Ii:6:004:1 0:4 8 = 03218e11 540efa00
ffff88000e7b9000 320484967 S Ii:6:004:1 -115:4 8 <
ffff88000e7b9000 320496358 C Ii:6:004:1 0:4 8 = 03218e11 530e0101
ffff88000e7b9000 320496450 S Ii:6:004:1 -115:4 8 <
ffff88000e7b9000 320504428 C Ii:6:004:1 0:4 8 = 03218f11 520e0901
ffff88000e7b9000 320504612 S Ii:6:004:1 -115:4 8 <
ffff88000e7b9000 320512504 C Ii:6:004:1 0:4 8 = 03218f11 510e1301
ffff88000e7b9000 320512650 S Ii:6:004:1 -115:4 8 <
ffff88000e7b9000 320524557 C Ii:6:004:1 0:4 8 = 03219011 500e1a01
ffff88000e7b9000 320524760 S Ii:6:004:1 -115:4 8 <
ffff88000e7b9000 320536557 C Ii:6:004:1 0:4 8 = 03219011 4f0e2201
ffff88000e7b9000 320536727 S Ii:6:004:1 -115:4 8 <
ffff88000e7b9000 320544351 C Ii:6:004:1 0:4 8 = 03219011 4e0e2a01
ffff88000e7b9000 320547805 S Ii:6:004:1 -115:4 8 <
ffff88000e7b9000 320556366 C Ii:6:004:1 0:4 8 = 03219111 4e0e3201
ffff88000543c000 320556453 S Ii:6:004:1 -115:4 8 <
ffff88000543c000 320564363 C Ii:6:004:1 0:4 8 = 03219111 4d0e3b01
ffff88000e7b90c0 320564451 S Ii:6:004:1 -115:4 8 <
ffff88000e7b90c0 320576343 C Ii:6:004:1 0:4 8 = 03219111 4d0e4501
ffff88000543c000 320576456 S Ii:6:004:1 -115:4 8 <
ffff88000543c000 320588340 C Ii:6:004:1 0:4 8 = 03219111 4c0e4c01
ffff88000e7b96c0 320588459 S Ii:6:004:1 -115:4 8 <
ffff88000e7b96c0 320596363 C Ii:6:004:1 0:4 8 = 03219211 4c0e5301
ffff88000543c6c0 320596433 S Ii:6:004:1 -115:4 8 <
ffff88000543c6c0 320608352 C Ii:6:004:1 0:4 8 = 03219211 4b0e5901
ffff88000543c6c0 320608434 S Ii:6:004:1 -115:4 8 <
ffff88000543c6c0 320620359 C Ii:6:004:1 0:4 8 = 03219211 4b0e5d01
ffff88000e7b9300 320620476 S Ii:6:004:1 -115:4 8 <
ffff88000e7b9300 320628384 C Ii:6:004:1 0:4 8 = 03219211 4a0e6001
ffff88000543cc00 320628503 S Ii:6:004:1 -115:4 8 <
ffff88000543cc00 320640386 C Ii:6:004:1 0:4 8 = 03219211 4a0e6301
ffff88000543cc00 320640522 S Ii:6:004:1 -115:4 8 <
ffff88000543cc00 320648354 C Ii:6:004:1 0:4 8 = 03219211 490e6501
ffff88000543cc00 320648655 S Ii:6:004:1 -115:4 8 <
ffff88000543cc00 320660538 C Ii:6:004:1 0:4 8 = 03219211 490e6901
ffff88000543cc00 320660666 S Ii:6:004:1 -115:4 8 <
ffff88000543cc00 320668357 C Ii:6:004:1 0:4 8 = 03219211 480e6d01
ffff88000e7b9cc0 320668431 S Ii:6:004:1 -115:4 8 <
ffff88000e7b9cc0 320684383 C Ii:6:004:1 0:4 8 = 03219211 480e7001
ffff88000e7b9cc0 320684498 S Ii:6:004:1 -115:4 8 <
ffff88000e7b9cc0 320692558 C Ii:6:004:1 0:4 8 = 03219211 470e7201
ffff88000e7b9cc0 320692740 S Ii:6:004:1 -115:4 8 <
ffff88000e7b9cc0 320700351 C Ii:6:004:1 0:4 8 = 03219211 470e7501
ffff88000e7b9cc0 320700892 S Ii:6:004:1 -115:4 8 <
ffff88000e7b9cc0 320712370 C Ii:6:004:1 0:4 8 = 03219311 460e7801
ffff88000543cc00 320712455 S Ii:6:004:1 -115:4 8 <
ffff88000543cc00 320716345 C Ii:6:004:1 0:4 8 = 03219311 460e7801
ffff88000543cc00 320717020 S Ii:6:004:1 -115:4 8 <
ffff88000543cc00 320720350 C Ii:6:004:1 0:4 8 = 03219311 460e7b01
ffff88000543c000 320721406 S Ii:6:004:1 -115:4 8 <
ffff88000543c000 320732372 C Ii:6:004:1 0:4 8 = 03219311 450e7d01
ffff88000543c000 320732451 S Ii:6:004:1 -115:4 8 <
ffff88000543c000 320744367 C Ii:6:004:1 0:4 8 = 03219311 450e7e01
ffff88000543c000 320744429 S Ii:6:004:1 -115:4 8 <
ffff88000543c000 320752363 C Ii:6:004:1 0:4 8 = 03219311 450e7f01
ffff88000543c000 320752425 S Ii:6:004:1 -115:4 8 <
ffff88000543c000 320764560 C Ii:6:004:1 0:4 8 = 03219311 440e8101
ffff88000543c000 320764761 S Ii:6:004:1 -115:4 8 <
ffff88000543c000 320776577 C Ii:6:004:1 0:4 8 = 03219311 440e8201
ffff88000e7b9780 320776826 S Ii:6:004:1 -115:4 8 <
ffff88000e7b9780 320784356 C Ii:6:004:1 0:4 8 = 03219311 440e8601
ffff88000543cc00 320784481 S Ii:6:004:1 -115:4 8 <
ffff88000543cc00 320796349 C Ii:6:004:1 0:4 8 = 03219311 430e8901
ffff88000543cc00 320796436 S Ii:6:004:1 -115:4 8 <
ffff88000543cc00 320804366 C Ii:6:004:1 0:4 8 = 03219311 430e8d01
ffff88000e7b9240 320804504 S Ii:6:004:1 -115:4 8 <
ffff88000e7b9240 320816373 C Ii:6:004:1 0:4 8 = 03219311 430e9001
ffff88000543c6c0 320816453 S Ii:6:004:1 -115:4 8 <
ffff88000543c6c0 320828363 C Ii:6:004:1 0:4 8 = 03219211 420e9301
ffff88000e7b9c00 320828484 S Ii:6:004:1 -115:4 8 <
ffff88000e7b9c00 320836378 C Ii:6:004:1 0:4 8 = 03219211 420e9501
ffff88000e7b9c00 320836446 S Ii:6:004:1 -115:4 8 <
ffff88000e7b9c00 320848365 C Ii:6:004:1 0:4 8 = 03219211 420e9801
ffff88000e7b9c00 320848441 S Ii:6:004:1 -115:4 8 <
ffff88000e7b9c00 320856375 C Ii:6:004:1 0:4 8 = 03219211 420e9b01
ffff88000543c6c0 320861752 S Ii:6:004:1 -115:4 8 <
ffff88000543c6c0 320868545 C Ii:6:004:1 0:4 8 = 03219211 420e9e01
ffff88000e7b99c0 320868678 S Ii:6:004:1 -115:4 8 <
ffff88000e7b99c0 320880356 C Ii:6:004:1 0:4 8 = 03219211 420ea201
ffff88000e7b99c0 320880525 S Ii:6:004:1 -115:4 8 <
ffff88000e7b99c0 320888376 C Ii:6:004:1 0:4 8 = 03219211 420ea701
ffff88000543cc00 320888460 S Ii:6:004:1 -115:4 8 <
ffff88000543cc00 320900348 C Ii:6:004:1 0:4 8 = 03219211 420ead01
ffff88000e7b9840 320900411 S Ii:6:004:1 -115:4 8 <
ffff88000e7b9840 320908387 C Ii:6:004:1 0:4 8 = 03219211 420eb401
ffff88000543c000 320908521 S Ii:6:004:1 -115:4 8 <
ffff88000543c000 320920378 C Ii:6:004:1 0:4 8 = 03219211 420ebd01
ffff88000e7b93c0 320920518 S Ii:6:004:1 -115:4 8 <
ffff88000e7b93c0 320932363 C Ii:6:004:1 0:4 8 = 03219211 410ec401
ffff88000e7b93c0 320932446 S Ii:6:004:1 -115:4 8 <
ffff88000e7b93c0 320940375 C Ii:6:004:1 0:4 8 = 03219211 410ecc01
ffff88000e7b93c0 320940431 S Ii:6:004:1 -115:4 8 <
ffff88000e7b93c0 320964379 C Ii:6:004:1 0:4 8 = 03219211 410ec001
ffff88000e7b93c0 320964463 S Ii:6:004:1 -115:4 8 <
ffff88000e7b93c0 320968545 C Ii:6:004:1 0:4 8 = 03219211 410ec001
ffff88000543c000 320973091 S Ii:6:004:1 -115:4 8 <
ffff88000543c000 320976364 C Ii:6:004:1 0:4 8 = 03239211 410eb201
ffff88000543c000 320977995 S Ii:6:004:1 -115:4 8 <
ffff88000543c000 320984376 C Ii:6:004:1 0:4 8 = 03239211 400ea501
ffff88000e7b9a80 320984477 S Ii:6:004:1 -115:4 8 <
ffff88000e7b9a80 320992358 C Ii:6:004:1 0:4 8 = 03239211 400e9601
ffff88000e7b9a80 320992418 S Ii:6:004:1 -115:4 8 <
ffff88000e7b9a80 321004352 C Ii:6:004:1 0:4 8 = 03239211 400e9e01
ffff88000e7b9a80 321005608 S Ii:6:004:1 -115:4 8 <
ffff88000e7b9a80 321012414 C Ii:6:004:1 0:4 8 = 03239211 3f0ea501
ffff88000e7b9a80 321012705 S Ii:6:004:1 -115:4 8 <
ffff88000e7b9a80 321024391 C Ii:6:004:1 0:4 8 = 03239211 3f0ead01
ffff88000e7b9a80 321024505 S Ii:6:004:1 -115:4 8 <
ffff88000e7b9a80 321036364 C Ii:6:004:1 0:4 8 = 03239211 3e0eb501
ffff88000543cc00 321036779 S Ii:6:004:1 -115:4 8 <
ffff88000543cc00 321044382 C Ii:6:004:1 0:4 8 = 03239211 3e0ebd01
ffff88000543cc00 321044461 S Ii:6:004:1 -115:4 8 <
ffff88000543cc00 321056358 C Ii:6:004:1 0:4 8 = 03239211 3d0ec401
ffff88000e7b9900 321056595 S Ii:6:004:1 -115:4 8 <
ffff88000e7b9900 321068382 C Ii:6:004:1 0:4 8 = 03239211 3c0eca01
ffff8801344f2cc0 321068474 S Ii:6:004:1 -115:4 8 <
ffff8801344f2cc0 321076385 C Ii:6:004:1 0:4 8 = 03239211 3b0ecf01
ffff8801344f2cc0 321076477 S Ii:6:004:1 -115:4 8 <
ffff8801344f2cc0 321088380 C Ii:6:004:1 0:4 8 = 03239211 260ed101
ffff88000e7b93c0 321088457 S Ii:6:004:1 -115:4 8 <
ffff88000e7b93c0 321096364 C Ii:6:004:1 0:4 8 = 03239211 150ed501
ffff88000e7b93c0 321096530 S Ii:6:004:1 -115:4 8 <
ffff88000e7b93c0 321108370 C Ii:6:004:1 0:4 8 = 03239211 150ed801
ffff8801344f2f00 321110392 S Ii:6:004:1 -115:4 8 <
ffff8801344f2f00 321116394 C Ii:6:004:1 0:4 8 = 03239211 060edb01
ffff88000e7b9840 321121067 S Ii:6:004:1 -115:4 8 <
ffff88000e7b9840 321128362 C Ii:6:004:1 0:4 8 = 03239211 060ede01
ffff88000e7b9840 321128481 S Ii:6:004:1 -115:4 8 <
ffff88000e7b9840 321140447 C Ii:6:004:1 0:4 8 = 03239211 060ee001
ffff88000e7b9840 321140536 S Ii:6:004:1 -115:4 8 <
ffff88000e7b9840 321152556 C Ii:6:004:1 0:4 8 = 03239211 060ee201
ffff88000e7b9840 321152679 S Ii:6:004:1 -115:4 8 <
ffff88000e7b9840 321160369 C Ii:6:004:1 0:4 8 = 03239211 060ee301
ffff8801344f2f00 321160611 S Ii:6:004:1 -115:4 8 <
ffff8801344f2f00 321168448 C Ii:6:004:1 0:4 8 = 03239311 050ee301
ffff88000e7b99c0 321168550 S Ii:6:004:1 -115:4 8 <
ffff88000e7b99c0 321180553 C Ii:6:004:1 0:4 8 = 03239311 040ee401
ffff8801344f2cc0 321180809 S Ii:6:004:1 -115:4 8 <
ffff8801344f2cc0 321192366 C Ii:6:004:1 0:4 8 = 03239311 030ee501
ffff8801344f2cc0 321192463 S Ii:6:004:1 -115:4 8 <
ffff8801344f2cc0 321200498 C Ii:6:004:1 0:4 8 = 03239311 020ee601
ffff8801344f2cc0 321200589 S Ii:6:004:1 -115:4 8 <
ffff8801344f2cc0 321204385 C Ii:6:004:1 0:4 8 = 03239311 020ee601
ffff8801344f2cc0 321205111 S Ii:6:004:1 -115:4 8 <
ffff8801344f2cc0 321212375 C Ii:6:004:1 0:4 8 = 03239311 010ee801
ffff8801344f2cc0 321212430 S Ii:6:004:1 -115:4 8 <
ffff8801344f2cc0 321220361 C Ii:6:004:1 0:4 8 = 03239311 000eea01
ffff88000e7b9c00 321220610 S Ii:6:004:1 -115:4 8 <
ffff88000e7b9c00 321232577 C Ii:6:004:1 0:4 8 = 03239311 ff0dec01
ffff8801344f2cc0 321232801 S Ii:6:004:1 -115:4 8 <
ffff8801344f2cc0 321244385 C Ii:6:004:1 0:4 8 = 03239311 fe0dec01
ffff88000e7b9240 321244501 S Ii:6:004:1 -115:4 8 <
ffff88000e7b9240 321252374 C Ii:6:004:1 0:4 8 = 03239311 fd0ded01
ffff8801344f2f00 321252662 S Ii:6:004:1 -115:4 8 <
ffff8801344f2f00 321264388 C Ii:6:004:1 0:4 8 = 03239311 fc0ded01
ffff88000e7b9780 321264458 S Ii:6:004:1 -115:4 8 <
ffff88000e7b9780 321272439 C Ii:6:004:1 0:4 8 = 03239311 fb0ded01
ffff8801344f2f00 321272558 S Ii:6:004:1 -115:4 8 <
ffff8801344f2f00 321284380 C Ii:6:004:1 0:4 8 = 03239311 fa0ded01
ffff8801344f2f00 321284464 S Ii:6:004:1 -115:4 8 <
ffff8801344f2f00 321296384 C Ii:6:004:1 0:4 8 = 03239311 f90ded01
ffff8801344f2f00 321296458 S Ii:6:004:1 -115:4 8 <
ffff8801344f2f00 321304557 C Ii:6:004:1 0:4 8 = 03239311 f80def01
ffff8801344f2f00 321304696 S Ii:6:004:1 -115:4 8 <
ffff8801344f2f00 321316400 C Ii:6:004:1 0:4 8 = 03239311 f70df001
ffff88000e7b9cc0 321316535 S Ii:6:004:1 -115:4 8 <
ffff88000e7b9cc0 321328560 C Ii:6:004:1 0:4 8 = 03239311 f60df401
ffff8801344f2cc0 321328777 S Ii:6:004:1 -115:4 8 <
ffff8801344f2cc0 321340375 C Ii:6:004:1 0:4 8 = 03239311 f60df501
ffff88000543cc00 321340616 S Ii:6:004:1 -115:4 8 <
ffff88000543cc00 321348376 C Ii:6:004:1 0:4 8 = 03239311 f50df701
ffff88000e7b9480 321348438 S Ii:6:004:1 -115:4 8 <
ffff88000e7b9480 321356368 C Ii:6:004:1 0:4 8 = 03239311 f50df801
ffff88000e7b9480 321356452 S Ii:6:004:1 -115:4 8 <
ffff88000e7b9480 321368370 C Ii:6:004:1 0:4 8 = 03239311 f40df801
ffff88000e7b9480 321368426 S Ii:6:004:1 -115:4 8 <
ffff88000e7b9480 321380390 C Ii:6:004:1 0:4 8 = 03239311 f40df801
ffff88000e7b9480 321380497 S Ii:6:004:1 -115:4 8 <
ffff88000e7b9480 321388393 C Ii:6:004:1 0:4 8 = 03239311 f30df901
ffff88000543c6c0 321388474 S Ii:6:004:1 -115:4 8 <
ffff88000543c6c0 321400583 C Ii:6:004:1 0:4 8 = 03239311 f30df901
ffff88000e7b9300 321400834 S Ii:6:004:1 -115:4 8 <
ffff88000e7b9300 321408501 C Ii:6:004:1 0:4 8 = 03239311 f20df901
ffff88000e7b9300 321408635 S Ii:6:004:1 -115:4 8 <
ffff88000e7b9300 321420392 C Ii:6:004:1 0:4 8 = 03239311 f20df901
ffff88000543c000 321420491 S Ii:6:004:1 -115:4 8 <
ffff88000543c000 321432380 C Ii:6:004:1 0:4 8 = 03239311 f20df901
ffff88000e7b96c0 321432463 S Ii:6:004:1 -115:4 8 <
ffff88000e7b96c0 321440588 C Ii:6:004:1 0:4 8 = 03239311 f10df801
ffff88000e7b96c0 321440796 S Ii:6:004:1 -115:4 8 <
ffff88000e7b96c0 321444388 C Ii:6:004:1 0:4 8 = 03239311 f10df801
ffff88000e7b96c0 321445072 S Ii:6:004:1 -115:4 8 <
ffff88000e7b96c0 321452559 C Ii:6:004:1 0:4 8 = 03239211 f10df801
ffff88000e7b96c0 321452682 S Ii:6:004:1 -115:4 8 <
ffff88000e7b96c0 321460412 C Ii:6:004:1 0:4 8 = 03239211 f10df701
ffff88000543c000 321460567 S Ii:6:004:1 -115:4 8 <
ffff88000543c000 321472376 C Ii:6:004:1 0:4 8 = 03239211 f10df601
ffff88000e7b90c0 321472463 S Ii:6:004:1 -115:4 8 <
ffff88000e7b90c0 321484565 C Ii:6:004:1 0:4 8 = 03239211 f10df501
ffff88000543c6c0 321484694 S Ii:6:004:1 -115:4 8 <
ffff88000543c6c0 321492370 C Ii:6:004:1 0:4 8 = 03239211 f00df501
ffff88000543c6c0 321492425 S Ii:6:004:1 -115:4 8 <
ffff88000543c6c0 321504383 C Ii:6:004:1 0:4 8 = 03239211 f00df401
ffff88000543c6c0 321504553 S Ii:6:004:1 -115:4 8 <
ffff88000543c6c0 321512384 C Ii:6:004:1 0:4 8 = 03239311 f00df401
ffff88000543c6c0 321512492 S Ii:6:004:1 -115:4 8 <
ffff88000543c6c0 321524413 C Ii:6:004:1 0:4 8 = 03239311 f00df401
ffff88000543c6c0 321524704 S Ii:6:004:1 -115:4 8 <
ffff88000543c6c0 321536400 C Ii:6:004:1 0:4 8 = 03239311 ef0df401
ffff88000e7b9000 321536503 S Ii:6:004:1 -115:4 8 <
ffff88000e7b9000 321544500 C Ii:6:004:1 0:4 8 = 03239311 ef0df201
ffff88000543cc00 321544636 S Ii:6:004:1 -115:4 8 <
ffff88000543cc00 321556376 C Ii:6:004:1 0:4 8 = 03239311 ef0def01
ffff88000e7b9d80 321557430 S Ii:6:004:1 -115:4 8 <
ffff88000e7b9d80 321564399 C Ii:6:004:1 0:4 8 = 03239311 ef0dea01
ffff88000543cc00 321564475 S Ii:6:004:1 -115:4 8 <
ffff88000543cc00 321576378 C Ii:6:004:1 0:4 8 = 03239311 ef0de501
ffff88000e7b9180 321576522 S Ii:6:004:1 -115:4 8 <
ffff88000e7b9180 321588374 C Ii:6:004:1 0:4 8 = 03239311 ef0ddd01
ffff88000e7b9180 321588503 S Ii:6:004:1 -115:4 8 <
ffff88000e7b9180 321596393 C Ii:6:004:1 0:4 8 = 03239311 ef0dd601
ffff88000e7b9180 321596466 S Ii:6:004:1 -115:4 8 <
ffff88000e7b9180 321608388 C Ii:6:004:1 0:4 8 = 03239311 ef0dcf01
ffff88000e7b9180 321608435 S Ii:6:004:1 -115:4 8 <
ffff88000e7b9180 321620396 C Ii:6:004:1 0:4 8 = 03239311 ef0dc801
ffff88000e7b9180 321620558 S Ii:6:004:1 -115:4 8 <
ffff88000e7b9180 321628418 C Ii:6:004:1 0:4 8 = 03239411 ef0dc501
ffff88000e7b9180 321628582 S Ii:6:004:1 -115:4 8 <
ffff88000e7b9180 321640422 C Ii:6:004:1 0:4 8 = 03239411 ef0dc201
ffff88000543c6c0 321640605 S Ii:6:004:1 -115:4 8 <
ffff88000543c6c0 321648385 C Ii:6:004:1 0:4 8 = 03239411 ee0dc201
ffff88000e7b9180 321651087 S Ii:6:004:1 -115:4 8 <
ffff88000e7b9180 321680405 C Ii:6:004:1 0:4 8 = 03239411 ee0dd801
ffff88000543c000 321680488 S Ii:6:004:1 -115:4 8 <
ffff88000543c000 321692382 C Ii:6:004:1 0:4 8 = 03219411 ee0deb01
ffff88000e7b9d80 321692455 S Ii:6:004:1 -115:4 8 <
ffff88000e7b9d80 321695402 C Ii:6:004:1 0:4 8 = 03219411 ee0deb01
ffff88000e7b9000 321700957 S Ii:6:004:1 -115:4 8 <
ffff88000e7b9000 321704572 C Ii:6:004:1 0:4 8 = 03219411 ed0dfb01
ffff88000e7b9000 321704695 S Ii:6:004:1 -115:4 8 <
ffff88000e7b9000 321712386 C Ii:6:004:1 0:4 8 = 03219411 ec0dff01
ffff88000e7b9000 321713823 S Ii:6:004:1 -115:4 8 <
ffff88000e7b9000 321720396 C Ii:6:004:1 0:4 8 = 03219511 dc0dfb01
ffff88000e7b9000 321720531 S Ii:6:004:1 -115:4 8 <
ffff88000e7b9000 321732405 C Ii:6:004:1 0:4 8 = 03219511 dc0def01
ffff88000543c000 321732486 S Ii:6:004:1 -115:4 8 <
ffff88000543c000 321744423 C Ii:6:004:1 0:4 8 = 03219511 dc0de601
ffff88000543c000 321744600 S Ii:6:004:1 -115:4 8 <
ffff88000543c000 321752595 C Ii:6:004:1 0:4 8 = 03219511 dc0ddf01
ffff88000543c000 321752820 S Ii:6:004:1 -115:4 8 <
ffff88000543c000 321764417 C Ii:6:004:1 0:4 8 = 03219511 dc0ddb01
ffff88000e7b90c0 321764798 S Ii:6:004:1 -115:4 8 <
ffff88000e7b90c0 321776406 C Ii:6:004:1 0:4 8 = 03219611 db0dd901
ffff88000e7b90c0 321776518 S Ii:6:004:1 -115:4 8 <
ffff88000e7b90c0 321784405 C Ii:6:004:1 0:4 8 = 03219611 da0dd801
ffff88000543c6c0 321784484 S Ii:6:004:1 -115:4 8 <
ffff88000543c6c0 321796573 C Ii:6:004:1 0:4 8 = 03219611 d90dd801
ffff88000e7b96c0 321796704 S Ii:6:004:1 -115:4 8 <
ffff88000e7b96c0 321808398 C Ii:6:004:1 0:4 8 = 03219611 d80dd701
ffff88000543cc00 321808535 S Ii:6:004:1 -115:4 8 <
ffff88000543cc00 321816417 C Ii:6:004:1 0:4 8 = 03219711 d70dd601
ffff88000e7b9300 321816551 S Ii:6:004:1 -115:4 8 <
ffff88000e7b9300 321824393 C Ii:6:004:1 0:4 8 = 03219711 d60dd301
ffff88000e7b9300 321824487 S Ii:6:004:1 -115:4 8 <
ffff88000e7b9300 321836407 C Ii:6:004:1 0:4 8 = 03219711 d50dd001
ffff88000543cc00 321836511 S Ii:6:004:1 -115:4 8 <
ffff88000543cc00 321848407 C Ii:6:004:1 0:4 8 = 03219711 d40dcc01
ffff88000e7b9480 321848498 S Ii:6:004:1 -115:4 8 <
ffff88000e7b9480 321856416 C Ii:6:004:1 0:4 8 = 03219711 d30dca01
ffff88000543c6c0 321856517 S Ii:6:004:1 -115:4 8 <
ffff88000543c6c0 321868395 C Ii:6:004:1 0:4 8 = 03219711 d30dc801
ffff88000543c6c0 321870215 S Ii:6:004:1 -115:4 8 <
ffff88000543c6c0 321876394 C Ii:6:004:1 0:4 8 = 03219711 d20dc701
ffff88000e7b9cc0 321881761 S Ii:6:004:1 -115:4 8 <
ffff88000e7b9cc0 321888400 C Ii:6:004:1 0:4 8 = 03219711 d20dc601
ffff88000543c000 321888510 S Ii:6:004:1 -115:4 8 <
ffff88000543c000 321900413 C Ii:6:004:1 0:4 8 = 03219811 d10dc601
ffff88000543c000 321900569 S Ii:6:004:1 -115:4 8 <
ffff88000543c000 321908423 C Ii:6:004:1 0:4 8 = 03219811 d10dc601
ffff88000e7b9780 321908584 S Ii:6:004:1 -115:4 8 <
ffff88000e7b9780 321920601 C Ii:6:004:1 0:4 8 = 03219811 d00dc701
ffff88000543c000 321920807 S Ii:6:004:1 -115:4 8 <
ffff88000543c000 321932599 C Ii:6:004:1 0:4 8 = 03219811 d00dc701
ffff88000e7b9240 321932802 S Ii:6:004:1 -115:4 8 <
ffff88000e7b9240 321936390 C Ii:6:004:1 0:4 8 = 03219811 d00dc701
ffff88000543c6c0 321937189 S Ii:6:004:1 -115:4 8 <
ffff88000543c6c0 321940489 C Ii:6:004:1 0:4 8 = 03219811 cf0dc801
ffff88000543c6c0 321944827 S Ii:6:004:1 -115:4 8 <
ffff88000543c6c0 321952579 C Ii:6:004:1 0:4 8 = 03219811 cf0dc901
ffff88000e7b9c00 321952713 S Ii:6:004:1 -115:4 8 <
ffff88000e7b9c00 321960408 C Ii:6:004:1 0:4 8 = 03219811 ce0dca01
ffff88000543cc00 321960479 S Ii:6:004:1 -115:4 8 <
ffff88000543cc00 321972402 C Ii:6:004:1 0:4 8 = 03219811 ce0dca01
ffff88000543cc00 321972509 S Ii:6:004:1 -115:4 8 <
ffff88000543cc00 321984402 C Ii:6:004:1 0:4 8 = 03219811 ce0dcb01
ffff88000e7b99c0 321984506 S Ii:6:004:1 -115:4 8 <
ffff88000e7b99c0 321996398 C Ii:6:004:1 0:4 8 = 03219811 cd0dcb01
ffff88000543cc00 321996537 S Ii:6:004:1 -115:4 8 <
ffff88000543cc00 322004413 C Ii:6:004:1 0:4 8 = 03219811 cd0dcb01
ffff88000e7b9840 322004510 S Ii:6:004:1 -115:4 8 <
ffff88000e7b9840 322012579 C Ii:6:004:1 0:4 8 = 03219811 cd0dcc01
ffff88000e7b9840 322012703 S Ii:6:004:1 -115:4 8 <
ffff88000e7b9840 322024427 C Ii:6:004:1 0:4 8 = 03219811 cc0dcf01
ffff88000e7b9840 322024562 S Ii:6:004:1 -115:4 8 <
ffff88000e7b9840 322036424 C Ii:6:004:1 0:4 8 = 03219911 cc0dd201
ffff88000543c6c0 322036550 S Ii:6:004:1 -115:4 8 <
ffff88000543c6c0 322044431 C Ii:6:004:1 0:4 8 = 03219911 cc0dd601
ffff88000543c6c0 322044578 S Ii:6:004:1 -115:4 8 <
ffff88000543c6c0 322056415 C Ii:6:004:1 0:4 8 = 03219911 cb0dd801
ffff88000543c6c0 322056490 S Ii:6:004:1 -115:4 8 <
ffff88000543c6c0 322064391 C Ii:6:004:1 0:4 8 = 03219911 cb0dda01
ffff88000543c6c0 322064441 S Ii:6:004:1 -115:4 8 <
ffff88000543c6c0 322076409 C Ii:6:004:1 0:4 8 = 03219911 cb0ddb01
ffff88000543c6c0 322076758 S Ii:6:004:1 -115:4 8 <
ffff88000543c6c0 322088582 C Ii:6:004:1 0:4 8 = 03219911 cb0de001
ffff88000e7b99c0 322088675 S Ii:6:004:1 -115:4 8 <
ffff88000e7b99c0 322096606 C Ii:6:004:1 0:4 8 = 03219911 cb0de601
ffff88000543c000 322096760 S Ii:6:004:1 -115:4 8 <
ffff88000543c000 322116433 C Ii:6:004:1 0:4 8 = 03219911 cb0dd901
ffff88000543c000 322116575 S Ii:6:004:1 -115:4 8 <
ffff88000543c000 322128413 C Ii:6:004:1 0:4 8 = 03239911 cb0dcd01
ffff88000e7b9c00 322128496 S Ii:6:004:1 -115:4 8 <
ffff88000e7b9c00 322140404 C Ii:6:004:1 0:4 8 = 03239811 cb0dc201
ffff88000e7b9c00 322140486 S Ii:6:004:1 -115:4 8 <
ffff88000e7b9c00 322148416 C Ii:6:004:1 0:4 8 = 03239811 ca0db501
ffff88000543c000 322148509 S Ii:6:004:1 -115:4 8 <
ffff88000543c000 322160420 C Ii:6:004:1 0:4 8 = 03239811 ca0dbd01
ffff88000543c000 322160548 S Ii:6:004:1 -115:4 8 <
ffff88000543c000 322168413 C Ii:6:004:1 0:4 8 = 03239811 ca0dc401
ffff88000e7b9240 322168487 S Ii:6:004:1 -115:4 8 <
ffff88000e7b9240 322180430 C Ii:6:004:1 0:4 8 = 03239811 ca0dca01
ffff88000e7b9240 322180566 S Ii:6:004:1 -115:4 8 <
ffff88000e7b9240 322184412 C Ii:6:004:1 0:4 8 = 03239811 ca0dca01
ffff88000e7b9240 322185318 S Ii:6:004:1 -115:4 8 <
ffff88000e7b9240 322192419 C Ii:6:004:1 0:4 8 = 03239711 ca0dcf01
ffff88000543c6c0 322192527 S Ii:6:004:1 -115:4 8 <
ffff88000543c6c0 322200397 C Ii:6:004:1 0:4 8 = 03239711 c90dd401
ffff88000543c6c0 322201545 S Ii:6:004:1 -115:4 8 <
ffff88000543c6c0 322212434 C Ii:6:004:1 0:4 8 = 03239711 c90dd801
ffff88000543c6c0 322212570 S Ii:6:004:1 -115:4 8 <
ffff88000543c6c0 322220585 C Ii:6:004:1 0:4 8 = 03239711 c90ddd01
ffff88000543c6c0 322220690 S Ii:6:004:1 -115:4 8 <
ffff88000543c6c0 322232405 C Ii:6:004:1 0:4 8 = 03239711 c80de001
ffff88000543c6c0 322232476 S Ii:6:004:1 -115:4 8 <
ffff88000543c6c0 322244439 C Ii:6:004:1 0:4 8 = 03239711 c80de401
ffff88000543c6c0 322244597 S Ii:6:004:1 -115:4 8 <
ffff88000543c6c0 322252416 C Ii:6:004:1 0:4 8 = 03239711 c80de501
ffff88000e7b9780 322252591 S Ii:6:004:1 -115:4 8 <
ffff88000e7b9780 322264434 C Ii:6:004:1 0:4 8 = 03239711 c80de701
ffff88000543cc00 322264803 S Ii:6:004:1 -115:4 8 <
ffff88000543cc00 322276420 C Ii:6:004:1 0:4 8 = 03239711 c70de801
ffff88000543cc00 322276495 S Ii:6:004:1 -115:4 8 <
ffff88000543cc00 322284409 C Ii:6:004:1 0:4 8 = 03239711 c70de801
ffff88000e7b9cc0 322285195 S Ii:6:004:1 -115:4 8 <
ffff88000e7b9cc0 322296418 C Ii:6:004:1 0:4 8 = 03239711 c70de801
ffff88000543cc00 322296554 S Ii:6:004:1 -115:4 8 <
ffff88000543cc00 322304423 C Ii:6:004:1 0:4 8 = 03239711 c70de901
ffff88000543cc00 322304549 S Ii:6:004:1 -115:4 8 <
ffff88000543cc00 322316400 C Ii:6:004:1 0:4 8 = 03239711 c70de901
ffff88000543cc00 322316544 S Ii:6:004:1 -115:4 8 <
ffff88000543cc00 322328400 C Ii:6:004:1 0:4 8 = 03239711 c70de901
ffff88000543cc00 322328562 S Ii:6:004:1 -115:4 8 <
ffff88000543cc00 322336424 C Ii:6:004:1 0:4 8 = 03239711 c60dea01
ffff88000543cc00 322336632 S Ii:6:004:1 -115:4 8 <
ffff88000543cc00 322348402 C Ii:6:004:1 0:4 8 = 03239711 c60dea01
ffff88000543cc00 322349168 S Ii:6:004:1 -115:4 8 <
ffff88000543cc00 322356412 C Ii:6:004:1 0:4 8 = 03239711 c60dea01
ffff88000e7b9480 322356483 S Ii:6:004:1 -115:4 8 <
ffff88000e7b9480 322368419 C Ii:6:004:1 0:4 8 = 03239711 c60dea01
ffff88000e7b9480 322368523 S Ii:6:004:1 -115:4 8 <
ffff88000e7b9480 322380403 C Ii:6:004:1 0:4 8 = 03239711 c60dea01
ffff88000e7b9480 322380502 S Ii:6:004:1 -115:4 8 <
ffff88000e7b9480 322388591 C Ii:6:004:1 0:4 8 = 03239711 c60dea01
ffff88000e7b9480 322388712 S Ii:6:004:1 -115:4 8 <
ffff88000e7b9480 322400424 C Ii:6:004:1 0:4 8 = 03239711 c60dea01
ffff88000e7b9480 322400551 S Ii:6:004:1 -115:4 8 <
ffff88000e7b9480 322412435 C Ii:6:004:1 0:4 8 = 03239711 c60deb01
ffff88000e7b9480 322412550 S Ii:6:004:1 -115:4 8 <
ffff88000e7b9480 322420619 C Ii:6:004:1 0:4 8 = 03239711 c60deb01
ffff88000e7b9480 322420825 S Ii:6:004:1 -115:4 8 <
ffff88000e7b9480 322424403 C Ii:6:004:1 0:4 8 = 03239711 c60deb01
ffff88000e7b9480 322425384 S Ii:6:004:1 -115:4 8 <
ffff88000e7b9480 322432428 C Ii:6:004:1 0:4 8 = 03239711 c60deb01
ffff88000e7b9480 322432523 S Ii:6:004:1 -115:4 8 <
ffff88000e7b9480 322440411 C Ii:6:004:1 0:4 8 = 03239611 c60deb01
ffff88000e7b9480 322440471 S Ii:6:004:1 -115:4 8 <
ffff88000e7b9480 322452404 C Ii:6:004:1 0:4 8 = 03239611 c50dea01
ffff88000e7b9480 322452550 S Ii:6:004:1 -115:4 8 <
ffff88000e7b9480 322464424 C Ii:6:004:1 0:4 8 = 03239611 c50dea01
ffff88000543c000 322464492 S Ii:6:004:1 -115:4 8 <
ffff88000543c000 322472410 C Ii:6:004:1 0:4 8 = 03239611 c50dea01
ffff88000543c000 322472490 S Ii:6:004:1 -115:4 8 <
ffff88000543c000 322484431 C Ii:6:004:1 0:4 8 = 03239611 c50de901
ffff88000543c000 322484509 S Ii:6:004:1 -115:4 8 <
ffff88000543c000 322492429 C Ii:6:004:1 0:4 8 = 03239611 c50de801
ffff88000543c000 322492504 S Ii:6:004:1 -115:4 8 <
ffff88000543c000 322504429 C Ii:6:004:1 0:4 8 = 03239611 c50de701
ffff88000543c000 322504514 S Ii:6:004:1 -115:4 8 <
ffff88000543c000 322512594 C Ii:6:004:1 0:4 8 = 03239611 c50de701
ffff88000543c000 322512771 S Ii:6:004:1 -115:4 8 <
ffff88000543c000 322524598 C Ii:6:004:1 0:4 8 = 03239611 c50de601
ffff88000543c000 322524711 S Ii:6:004:1 -115:4 8 <
ffff88000543c000 322532598 C Ii:6:004:1 0:4 8 = 03239611 c60de601
ffff88000543c000 322532728 S Ii:6:004:1 -115:4 8 <
ffff88000543c000 322544429 C Ii:6:004:1 0:4 8 = 03239611 c60de601
ffff88000543c000 322544505 S Ii:6:004:1 -115:4 8 <
ffff88000543c000 322556413 C Ii:6:004:1 0:4 8 = 03239611 c60de601
ffff88000543c000 322556489 S Ii:6:004:1 -115:4 8 <
ffff88000543c000 322564415 C Ii:6:004:1 0:4 8 = 03239611 c60de501
ffff88000543c000 322564490 S Ii:6:004:1 -115:4 8 <
ffff88000543c000 322576410 C Ii:6:004:1 0:4 8 = 03239611 c60de501
ffff88000543c000 322576483 S Ii:6:004:1 -115:4 8 <
ffff88000543c000 322588409 C Ii:6:004:1 0:4 8 = 03239611 c60de401
ffff88000543c000 322588461 S Ii:6:004:1 -115:4 8 <
ffff88000543c000 322596428 C Ii:6:004:1 0:4 8 = 03239611 c60de401
ffff88000543c000 322596492 S Ii:6:004:1 -115:4 8 <
ffff88000543c000 322608423 C Ii:6:004:1 0:4 8 = 03239611 c60de301
ffff88000543c000 322608470 S Ii:6:004:1 -115:4 8 <
ffff88000543c000 322616429 C Ii:6:004:1 0:4 8 = 03239611 c60de201
ffff88000e7b9300 322616503 S Ii:6:004:1 -115:4 8 <
ffff88000e7b9300 322628416 C Ii:6:004:1 0:4 8 = 03239611 c60de201
ffff88000e7b9300 322632312 S Ii:6:004:1 -115:4 8 <
ffff88000e7b9300 322640436 C Ii:6:004:1 0:4 8 = 03239611 c60de101
ffff88000e7b9300 322640508 S Ii:6:004:1 -115:4 8 <
ffff88000e7b9300 322652413 C Ii:6:004:1 0:4 8 = 03239611 c60de001
ffff88000e7b9300 322652526 S Ii:6:004:1 -115:4 8 <
ffff88000e7b9300 322660411 C Ii:6:004:1 0:4 8 = 03239611 c60de001
ffff88000e7b9300 322660503 S Ii:6:004:1 -115:4 8 <
ffff88000e7b9300 322664407 C Ii:6:004:1 0:4 8 = 03239611 c60de001
ffff88000e7b9d80 322669800 S Ii:6:004:1 -115:4 8 <
ffff88000e7b9d80 322672409 C Ii:6:004:1 0:4 8 = 03239611 c60ddd01
ffff88000e7b9d80 322672552 S Ii:6:004:1 -115:4 8 <
ffff88000e7b9d80 322680413 C Ii:6:004:1 0:4 8 = 03239611 c60dda01
ffff88000e7b9d80 322680463 S Ii:6:004:1 -115:4 8 <
ffff88000e7b9d80 322692430 C Ii:6:004:1 0:4 8 = 03239711 c60dd601
ffff8801344f2cc0 322692496 S Ii:6:004:1 -115:4 8 <
ffff8801344f2cc0 322700427 C Ii:6:004:1 0:4 8 = 03239711 c60dd001
ffff88000e7b9180 322700483 S Ii:6:004:1 -115:4 8 <
ffff88000e7b9180 322712427 C Ii:6:004:1 0:4 8 = 03239711 c60dc901
ffff88000e7b9180 322712475 S Ii:6:004:1 -115:4 8 <
ffff88000e7b9180 322720426 C Ii:6:004:1 0:4 8 = 03239711 c60dc101
ffff8801344f2f00 322720557 S Ii:6:004:1 -115:4 8 <
ffff8801344f2f00 322732608 C Ii:6:004:1 0:4 8 = 03239711 c60db801
ffff88000e7b90c0 322732829 S Ii:6:004:1 -115:4 8 <
ffff88000e7b90c0 322744435 C Ii:6:004:1 0:4 8 = 03239711 c70daf01
ffff88000e7b90c0 322744499 S Ii:6:004:1 -115:4 8 <
ffff88000e7b90c0 322752439 C Ii:6:004:1 0:4 8 = 03239711 c70da501
ffff88000e7b90c0 322752779 S Ii:6:004:1 -115:4 8 <
ffff88000e7b90c0 322764424 C Ii:6:004:1 0:4 8 = 03239711 c70d9b01
ffff88000e7b90c0 322764649 S Ii:6:004:1 -115:4 8 <
ffff88000e7b90c0 322776608 C Ii:6:004:1 0:4 8 = 03239711 c70d9201
ffff8801344f2cc0 322776740 S Ii:6:004:1 -115:4 8 <
ffff8801344f2cc0 322804452 C Ii:6:004:1 0:4 8 = 03239711 c70d9801
ffff88000e7b9000 322804587 S Ii:6:004:1 -115:4 8 <
ffff88000e7b9000 322816611 C Ii:6:004:1 0:4 8 = 03219711 c70d9b01
ffff88000e7b9000 322816735 S Ii:6:004:1 -115:4 8 <
ffff88000e7b9000 322824610 C Ii:6:004:1 0:4 8 = 03219711 c70d9d01
ffff88000e7b9000 322824759 S Ii:6:004:1 -115:4 8 <
ffff88000e7b9000 322840437 C Ii:6:004:1 0:4 8 = 03219811 c70d9f01
ffff88000e7b9000 322840507 S Ii:6:004:1 -115:4 8 <
ffff88000e7b9000 322848432 C Ii:6:004:1 0:4 8 = 03219911 c60d9201
ffff88000e7b9000 322848565 S Ii:6:004:1 -115:4 8 <
ffff88000e7b9000 322856412 C Ii:6:004:1 0:4 8 = 0321a011 ba0d8b01
ffff8801344f2cc0 322857833 S Ii:6:004:1 -115:4 8 <
ffff8801344f2cc0 322868455 C Ii:6:004:1 0:4 8 = 0321a611 b00d8701
ffff8801344f2cc0 322868584 S Ii:6:004:1 -115:4 8 <
ffff8801344f2cc0 322876457 C Ii:6:004:1 0:4 8 = 0321a611 b00d8601
ffff8801344f2cc0 322876602 S Ii:6:004:1 -115:4 8 <
ffff8801344f2cc0 322888428 C Ii:6:004:1 0:4 8 = 0321ab11 a60d8601
ffff8801344f2cc0 322889993 S Ii:6:004:1 -115:4 8 <
ffff8801344f2cc0 322900441 C Ii:6:004:1 0:4 8 = 0321ab11 a60d8601
ffff8801344f2cc0 322900525 S Ii:6:004:1 -115:4 8 <
ffff8801344f2cc0 322908435 C Ii:6:004:1 0:4 8 = 0321ab11 a60d8601
ffff88000e7b9300 322908577 S Ii:6:004:1 -115:4 8 <
ffff88000e7b9300 322920430 C Ii:6:004:1 0:4 8 = 0321ab11 a60d8601
ffff88000e7b9300 322920500 S Ii:6:004:1 -115:4 8 <
ffff88000e7b9300 322924443 C Ii:6:004:1 0:4 8 = 0321ab11 a60d8601
ffff8801344f2f00 322929029 S Ii:6:004:1 -115:4 8 <
ffff8801344f2f00 322932441 C Ii:6:004:1 0:4 8 = 0321b011 9b0d8601
ffff8801344f2f00 322932504 S Ii:6:004:1 -115:4 8 <
ffff8801344f2f00 322940615 C Ii:6:004:1 0:4 8 = 0321b011 9b0d8601
ffff8801344f2f00 322940736 S Ii:6:004:1 -115:4 8 <
ffff8801344f2f00 322952427 C Ii:6:004:1 0:4 8 = 0321b011 9b0d8701
ffff8801344f2f00 322952584 S Ii:6:004:1 -115:4 8 <
ffff8801344f2f00 322960450 C Ii:6:004:1 0:4 8 = 0321b011 9b0d8801
ffff8801344f2f00 322960536 S Ii:6:004:1 -115:4 8 <
ffff8801344f2f00 322972453 C Ii:6:004:1 0:4 8 = 0321b011 9b0d8801
ffff8801344f2f00 322972687 S Ii:6:004:1 -115:4 8 <
ffff8801344f2f00 322980429 C Ii:6:004:1 0:4 8 = 0321b111 9a0d8801
ffff8801344f2f00 322982835 S Ii:6:004:1 -115:4 8 <
ffff8801344f2f00 322992462 C Ii:6:004:1 0:4 8 = 0321b111 990d8801
ffff8801344f2f00 322992607 S Ii:6:004:1 -115:4 8 <
ffff8801344f2f00 323004458 C Ii:6:004:1 0:4 8 = 0321b211 980d8701
ffff8801344f2f00 323004585 S Ii:6:004:1 -115:4 8 <
ffff8801344f2f00 323012447 C Ii:6:004:1 0:4 8 = 0321b311 970d8801
ffff8801344f2f00 323012529 S Ii:6:004:1 -115:4 8 <
ffff8801344f2f00 323024442 C Ii:6:004:1 0:4 8 = 0321b811 8a0d8801
ffff8801344f2f00 323024522 S Ii:6:004:1 -115:4 8 <
ffff8801344f2f00 323032445 C Ii:6:004:1 0:4 8 = 0321b811 8a0d8901
ffff88000e7b96c0 323032526 S Ii:6:004:1 -115:4 8 <
ffff88000e7b96c0 323048461 C Ii:6:004:1 0:4 8 = 0321b811 8a0d8a01
ffff8801344f2f00 323048656 S Ii:6:004:1 -115:4 8 <
ffff8801344f2f00 323056434 C Ii:6:004:1 0:4 8 = 0321b811 8a0d8b01
ffff8801344f2f00 323056580 S Ii:6:004:1 -115:4 8 <
ffff8801344f2f00 323064439 C Ii:6:004:1 0:4 8 = 0321b811 8a0d8f01
ffff8801344f2f00 323064592 S Ii:6:004:1 -115:4 8 <
ffff8801344f2f00 323076529 C Ii:6:004:1 0:4 8 = 0321b911 890d9101
ffff88000e7b9480 323076661 S Ii:6:004:1 -115:4 8 <
ffff88000e7b9480 323088447 C Ii:6:004:1 0:4 8 = 0321b911 880d9401
ffff8801344f2cc0 323088526 S Ii:6:004:1 -115:4 8 <
ffff8801344f2cc0 323096458 C Ii:6:004:1 0:4 8 = 0321ba11 870d9501
ffff8801344f2cc0 323096579 S Ii:6:004:1 -115:4 8 <
ffff8801344f2cc0 323108454 C Ii:6:004:1 0:4 8 = 0321ba11 860d9701
ffff8801344f2cc0 323108628 S Ii:6:004:1 -115:4 8 <
ffff8801344f2cc0 323120435 C Ii:6:004:1 0:4 8 = 0321bb11 850d9801
ffff88000e7b9cc0 323120568 S Ii:6:004:1 -115:4 8 <
ffff88000e7b9cc0 323128457 C Ii:6:004:1 0:4 8 = 0321bb11 840d9a01
ffff88000e7b9cc0 323128573 S Ii:6:004:1 -115:4 8 <
ffff88000e7b9cc0 323140429 C Ii:6:004:1 0:4 8 = 0321bb11 840d9c01
ffff88000e7b9cc0 323143359 S Ii:6:004:1 -115:4 8 <
ffff88000e7b9cc0 323148451 C Ii:6:004:1 0:4 8 = 0321bc11 830d9f01
ffff88000e7b9cc0 323153104 S Ii:6:004:1 -115:4 8 <
ffff88000e7b9cc0 323160451 C Ii:6:004:1 0:4 8 = 0321bc11 830da401
ffff88000e7b9cc0 323160820 S Ii:6:004:1 -115:4 8 <
ffff88000e7b9cc0 323163453 C Ii:6:004:1 0:4 8 = 0321bc11 830da401
ffff88000e7b9cc0 323169660 S Ii:6:004:1 -115:4 8 <
ffff88000e7b9cc0 323172442 C Ii:6:004:1 0:4 8 = 0321bc11 820da901
ffff8801344f2cc0 323172553 S Ii:6:004:1 -115:4 8 <
ffff8801344f2cc0 323180422 C Ii:6:004:1 0:4 8 = 0321bd11 820dab01
ffff8801344f2cc0 323180491 S Ii:6:004:1 -115:4 8 <
ffff8801344f2cc0 323192430 C Ii:6:004:1 0:4 8 = 0321bd11 810dae01
ffff88000e7b9780 323192498 S Ii:6:004:1 -115:4 8 <
ffff88000e7b9780 323200460 C Ii:6:004:1 0:4 8 = 0321bd11 810db001
ffff88000e7b9780 323200584 S Ii:6:004:1 -115:4 8 <
ffff88000e7b9780 323212533 C Ii:6:004:1 0:4 8 = 0321be11 800db401
ffff8801344f2f00 323212648 S Ii:6:004:1 -115:4 8 <
ffff8801344f2f00 323220448 C Ii:6:004:1 0:4 8 = 0321be11 140dba01
ffff88000e7b9240 323220521 S Ii:6:004:1 -115:4 8 <
ffff88000e7b9240 323240440 C Ii:6:004:1 0:4 8 = 0321c011 df0cae01
ffff88000e7b9240 323240563 S Ii:6:004:1 -115:4 8 <
ffff88000e7b9240 323252463 C Ii:6:004:1 0:4 8 = 0323bf11 2a0da201
ffff88000e7b9240 323252573 S Ii:6:004:1 -115:4 8 <
ffff88000e7b9240 323264438 C Ii:6:004:1 0:4 8 = 0323be11 4f0d9401
ffff88000e7b9240 323264493 S Ii:6:004:1 -115:4 8 <
ffff88000e7b9240 323276450 C Ii:6:004:1 0:4 8 = 0323be11 620d8301
ffff8801344f2f00 323276521 S Ii:6:004:1 -115:4 8 <
ffff8801344f2f00 323284438 C Ii:6:004:1 0:4 8 = 0323be11 620d8601
ffff8801344f2f00 323284693 S Ii:6:004:1 -115:4 8 <
ffff8801344f2f00 323296440 C Ii:6:004:1 0:4 8 = 0323be11 620d8a01
ffff88000e7b9c00 323296538 S Ii:6:004:1 -115:4 8 <
ffff88000e7b9c00 323308621 C Ii:6:004:1 0:4 8 = 0323be11 620d8e01
ffff88000e7b9c00 323308747 S Ii:6:004:1 -115:4 8 <
ffff88000e7b9c00 323316435 C Ii:6:004:1 0:4 8 = 0323be11 620d9201
ffff8801344f2cc0 323316600 S Ii:6:004:1 -115:4 8 <
ffff8801344f2cc0 323324454 C Ii:6:004:1 0:4 8 = 0323be11 630d9501
ffff88000e7b99c0 323324526 S Ii:6:004:1 -115:4 8 <
ffff88000e7b99c0 323336452 C Ii:6:004:1 0:4 8 = 0323be11 640d9801
ffff88000e7b99c0 323336505 S Ii:6:004:1 -115:4 8 <
ffff88000e7b99c0 323348454 C Ii:6:004:1 0:4 8 = 0323be11 650d9a01
ffff88000e7b99c0 323348520 S Ii:6:004:1 -115:4 8 <
ffff88000e7b99c0 323356536 C Ii:6:004:1 0:4 8 = 0323be11 660d9b01
ffff88000e7b99c0 323356648 S Ii:6:004:1 -115:4 8 <
ffff88000e7b99c0 323368442 C Ii:6:004:1 0:4 8 = 0323be11 670d9d01
ffff88000e7b99c0 323368517 S Ii:6:004:1 -115:4 8 <
ffff88000e7b99c0 323376436 C Ii:6:004:1 0:4 8 = 0323be11 680d9f01
ffff88000e7b99c0 323376586 S Ii:6:004:1 -115:4 8 <
ffff88000e7b99c0 323388473 C Ii:6:004:1 0:4 8 = 0323be11 690da001
ffff8801344f2cc0 323388636 S Ii:6:004:1 -115:4 8 <
ffff8801344f2cc0 323400627 C Ii:6:004:1 0:4 8 = 0323be11 6a0da301
ffff8801344f2cc0 323400737 S Ii:6:004:1 -115:4 8 <
ffff8801344f2cc0 323408456 C Ii:6:004:1 0:4 8 = 0323be11 6b0da401
ffff8801344f2cc0 323408521 S Ii:6:004:1 -115:4 8 <
ffff8801344f2cc0 323412453 C Ii:6:004:1 0:4 8 = 0323be11 6b0da401
ffff8801344f2cc0 323413005 S Ii:6:004:1 -115:4 8 <
ffff8801344f2cc0 323420625 C Ii:6:004:1 0:4 8 = 0323be11 6b0da701
ffff8801344f2cc0 323420748 S Ii:6:004:1 -115:4 8 <
ffff8801344f2cc0 323428440 C Ii:6:004:1 0:4 8 = 0323be11 6c0da801
ffff8801344f2cc0 323428501 S Ii:6:004:1 -115:4 8 <
ffff8801344f2cc0 323440446 C Ii:6:004:1 0:4 8 = 0323be11 6c0da901
ffff8801344f2cc0 323441406 S Ii:6:004:1 -115:4 8 <
ffff8801344f2cc0 323452455 C Ii:6:004:1 0:4 8 = 0323be11 6d0daa01
ffff8801344f2cc0 323452519 S Ii:6:004:1 -115:4 8 <
ffff8801344f2cc0 323460454 C Ii:6:004:1 0:4 8 = 0323bd11 6d0daa01
ffff8801344f2cc0 323460514 S Ii:6:004:1 -115:4 8 <
ffff8801344f2cc0 323472456 C Ii:6:004:1 0:4 8 = 0323bd11 6e0dab01
ffff8801344f2cc0 323472517 S Ii:6:004:1 -115:4 8 <
ffff8801344f2cc0 323484453 C Ii:6:004:1 0:4 8 = 0323bd11 6e0dab01
ffff8801344f2cc0 323484498 S Ii:6:004:1 -115:4 8 <
ffff8801344f2cc0 323496488 C Ii:6:004:1 0:4 8 = 0323bd11 6f0dac01
ffff8801344f2cc0 323496662 S Ii:6:004:1 -115:4 8 <
ffff8801344f2cc0 323504441 C Ii:6:004:1 0:4 8 = 0323bd11 6f0dad01
ffff88000e7b9b40 323504554 S Ii:6:004:1 -115:4 8 <
ffff88000e7b9b40 323512652 C Ii:6:004:1 0:4 8 = 0323bd11 6f0daf01
ffff88000e7b9b40 323512830 S Ii:6:004:1 -115:4 8 <
ffff88000e7b9b40 323524632 C Ii:6:004:1 0:4 8 = 0323bd11 700db101
ffff88000e7b9b40 323524722 S Ii:6:004:1 -115:4 8 <
ffff88000e7b9b40 323536452 C Ii:6:004:1 0:4 8 = 0323bd11 700db301
ffff8801344f2f00 323536525 S Ii:6:004:1 -115:4 8 <
ffff8801344f2f00 323544459 C Ii:6:004:1 0:4 8 = 0323bd11 700db501
ffff8801344f2f00 323544574 S Ii:6:004:1 -115:4 8 <
ffff8801344f2f00 323556474 C Ii:6:004:1 0:4 8 = 0323bd11 710db601
ffff8801344f2f00 323556599 S Ii:6:004:1 -115:4 8 <
ffff8801344f2f00 323568444 C Ii:6:004:1 0:4 8 = 0323bd11 710db601
ffff88000e7b9900 323568588 S Ii:6:004:1 -115:4 8 <
ffff88000e7b9900 323576439 C Ii:6:004:1 0:4 8 = 0323bd11 710db601
ffff88000e7b9900 323576557 S Ii:6:004:1 -115:4 8 <
ffff88000e7b9900 323588459 C Ii:6:004:1 0:4 8 = 0323bd11 720db701
ffff88000e7b9900 323588537 S Ii:6:004:1 -115:4 8 <
ffff88000e7b9900 323596461 C Ii:6:004:1 0:4 8 = 0323bd11 720db801
ffff88000e7b9900 323596536 S Ii:6:004:1 -115:4 8 <
ffff88000e7b9900 323608464 C Ii:6:004:1 0:4 8 = 0323bd11 720db901
ffff8801344f2f00 323608548 S Ii:6:004:1 -115:4 8 <
ffff8801344f2f00 323616633 C Ii:6:004:1 0:4 8 = 0323bd11 720dbb01
ffff88000e7b9840 323616746 S Ii:6:004:1 -115:4 8 <
ffff88000e7b9840 323628464 C Ii:6:004:1 0:4 8 = 0323bd11 730dbc01
ffff8801344f2cc0 323628551 S Ii:6:004:1 -115:4 8 <
ffff8801344f2cc0 323640499 C Ii:6:004:1 0:4 8 = 0323bd11 730dbc01
ffff88000e7b93c0 323640591 S Ii:6:004:1 -115:4 8 <
ffff88000e7b93c0 323648440 C Ii:6:004:1 0:4 8 = 0323bd11 730dbd01
ffff88000e7b93c0 323649019 S Ii:6:004:1 -115:4 8 <
ffff88000e7b93c0 323652447 C Ii:6:004:1 0:4 8 = 0323bd11 730dbd01
ffff88000e7b93c0 323657479 S Ii:6:004:1 -115:4 8 <
ffff88000e7b93c0 323660446 C Ii:6:004:1 0:4 8 = 0323bd11 730dbd01
ffff88000e7b93c0 323660496 S Ii:6:004:1 -115:4 8 <
ffff88000e7b93c0 323668459 C Ii:6:004:1 0:4 8 = 0323bd11 730dbd01
ffff88000e7b93c0 323668520 S Ii:6:004:1 -115:4 8 <
ffff88000e7b93c0 323680472 C Ii:6:004:1 0:4 8 = 0323bd11 730dbd01
ffff88000e7b93c0 323680591 S Ii:6:004:1 -115:4 8 <
ffff88000e7b93c0 323688451 C Ii:6:004:1 0:4 8 = 0323bd11 730dbd01
ffff88000e7b93c0 323688524 S Ii:6:004:1 -115:4 8 <
ffff88000e7b93c0 323700638 C Ii:6:004:1 0:4 8 = 0323bd11 740dbd01
ffff8801344f2cc0 323700771 S Ii:6:004:1 -115:4 8 <
ffff8801344f2cc0 323712454 C Ii:6:004:1 0:4 8 = 0323bd11 740dbe01
ffff8801344f2cc0 323712609 S Ii:6:004:1 -115:4 8 <
ffff8801344f2cc0 323720463 C Ii:6:004:1 0:4 8 = 0323bd11 740dbd01
ffff8801344f2cc0 323720526 S Ii:6:004:1 -115:4 8 <
ffff8801344f2cc0 323732463 C Ii:6:004:1 0:4 8 = 0323bd11 740dbd01
ffff8801344f2cc0 323732528 S Ii:6:004:1 -115:4 8 <
ffff8801344f2cc0 323744456 C Ii:6:004:1 0:4 8 = 0323bd11 740dbd01
ffff8801344f2cc0 323744582 S Ii:6:004:1 -115:4 8 <
ffff8801344f2cc0 323752466 C Ii:6:004:1 0:4 8 = 0323bd11 740dbc01
ffff8801344f2cc0 323752596 S Ii:6:004:1 -115:4 8 <
ffff8801344f2cc0 323764470 C Ii:6:004:1 0:4 8 = 0323bd11 740dba01
ffff8801344f2cc0 323764555 S Ii:6:004:1 -115:4 8 <
ffff8801344f2cc0 323776469 C Ii:6:004:1 0:4 8 = 0323bd11 740db801
ffff88000e7b9a80 323778396 S Ii:6:004:1 -115:4 8 <
ffff88000e7b9a80 323784461 C Ii:6:004:1 0:4 8 = 0323bd11 750db301
ffff88000e7b9a80 323784583 S Ii:6:004:1 -115:4 8 <
ffff88000e7b9a80 323792443 C Ii:6:004:1 0:4 8 = 0323bd11 750dad01
ffff8801344f2f00 323792513 S Ii:6:004:1 -115:4 8 <
ffff8801344f2f00 323804639 C Ii:6:004:1 0:4 8 = 0323bd11 750da501
ffff8801344f2f00 323804761 S Ii:6:004:1 -115:4 8 <
ffff8801344f2f00 323816471 C Ii:6:004:1 0:4 8 = 0323bd11 750d9e01
ffff88000e7b9a80 323816562 S Ii:6:004:1 -115:4 8 <
ffff88000e7b9a80 323824504 C Ii:6:004:1 0:4 8 = 0323bd11 750d9701
ffff8801344f2f00 323824603 S Ii:6:004:1 -115:4 8 <
ffff8801344f2f00 323836469 C Ii:6:004:1 0:4 8 = 0323be11 750d9001
ffff88000e7b93c0 323836566 S Ii:6:004:1 -115:4 8 <
ffff88000e7b93c0 323848725 C Ii:6:004:1 0:4 8 = 0323be11 750d8701
ffff8801344f2cc0 323849032 S Ii:6:004:1 -115:4 8 <
ffff8801344f2cc0 323880586 C Ii:6:004:1 0:4 8 = 0323be11 750d8e01
ffff8801344f2cc0 323880736 S Ii:6:004:1 -115:4 8 <
ffff8801344f2cc0 323888475 C Ii:6:004:1 0:4 8 = 0321be11 750d9301
ffff8801344f2cc0 323888594 S Ii:6:004:1 -115:4 8 <
ffff8801344f2cc0 323900463 C Ii:6:004:1 0:4 8 = 0321be11 750d9701
ffff8801344f2cc0 323905683 S Ii:6:004:1 -115:4 8 <
ffff8801344f2cc0 323908470 C Ii:6:004:1 0:4 8 = 0321be11 750d9b01
ffff8801344f2cc0 323917907 S Ii:6:004:1 -115:4 8 <
ffff8801344f2cc0 323920645 C Ii:6:004:1 0:4 8 = 0321be11 750d8f01
ffff8801344f2cc0 323920767 S Ii:6:004:1 -115:4 8 <
ffff8801344f2cc0 323928458 C Ii:6:004:1 0:4 8 = 0321be11 750d8001
ffff88000e7b9840 323928527 S Ii:6:004:1 -115:4 8 <
ffff88000e7b9840 323940496 C Ii:6:004:1 0:4 8 = 0321be11 750d6e01
ffff88000e7b9840 323940586 S Ii:6:004:1 -115:4 8 <
ffff88000e7b9840 323952643 C Ii:6:004:1 0:4 8 = 0321be11 750d5701
ffff88000e7b9840 323952770 S Ii:6:004:1 -115:4 8 <
ffff88000e7b9840 323960454 C Ii:6:004:1 0:4 8 = 0321be11 750d3d01
ffff8801344f2cc0 323961950 S Ii:6:004:1 -115:4 8 <
ffff8801344f2cc0 323972486 C Ii:6:004:1 0:4 8 = 0321be11 750d2301
ffff88000e7b9900 323972617 S Ii:6:004:1 -115:4 8 <
ffff88000e7b9900 323984471 C Ii:6:004:1 0:4 8 = 0321be11 750d0e01
ffff88000e7b9900 323984785 S Ii:6:004:1 -115:4 8 <
ffff88000e7b9900 323992466 C Ii:6:004:1 0:4 8 = 0321be11 750dfd00
ffff8801344f2f00 323992574 S Ii:6:004:1 -115:4 8 <
ffff8801344f2f00 324004474 C Ii:6:004:1 0:4 8 = 0321bf11 750df000
ffff8801344f2f00 324004549 S Ii:6:004:1 -115:4 8 <
ffff8801344f2f00 324012471 C Ii:6:004:1 0:4 8 = 0321bf11 750de800
ffff88000e7b9b40 324012543 S Ii:6:004:1 -115:4 8 <
ffff88000e7b9b40 324024475 C Ii:6:004:1 0:4 8 = 0321bf11 750dde00
ffff8801344f2f00 324024546 S Ii:6:004:1 -115:4 8 <
ffff8801344f2f00 324032476 C Ii:6:004:1 0:4 8 = 0321bf11 750dd000
ffff8801344f2f00 324032637 S Ii:6:004:1 -115:4 8 <
ffff8801344f2f00 324044492 C Ii:6:004:1 0:4 8 = 0321bf11 750db700
ffff8801344f2f00 324044588 S Ii:6:004:1 -115:4 8 <
ffff8801344f2f00 324056455 C Ii:6:004:1 0:4 8 = 0321bf11 760d9000
ffff88000e7b99c0 324056573 S Ii:6:004:1 -115:4 8 <
ffff88000e7b99c0 324068479 C Ii:6:004:1 0:4 8 = 0321bf11 760d5b00
ffff88000e7b99c0 324068588 S Ii:6:004:1 -115:4 8 <
ffff88000e7b99c0 324076460 C Ii:6:004:1 0:4 8 = 0320bf11 760d0000
ffff88000e7b99c0 324076578 S Ii:6:004:1 -115:4 8 <
ffff88000e7b99c0 324088458 C Ii:6:004:1 0:4 8 = 0320c011 760d0000
ffff88000e7b99c0 324088836 S Ii:6:004:1 -115:4 8 <
ffff88000e7b99c0 324096455 C Ii:6:004:1 0:4 8 = 0320c011 760d0000
ffff88000e7b99c0 324096656 S Ii:6:004:1 -115:4 8 <
ffff88000e7b99c0 324108481 C Ii:6:004:1 0:4 8 = 0320c011 770d0000
ffff88000e7b99c0 324108672 S Ii:6:004:1 -115:4 8 <
ffff88000e7b99c0 324116467 C Ii:6:004:1 0:4 8 = 0320b911 820d0000
ffff88000e7b99c0 324116537 S Ii:6:004:1 -115:4 8 <
ffff88000e7b99c0 324128469 C Ii:6:004:1 0:4 8 = 0320b011 8d0d0000
ffff88000e7b99c0 324128844 S Ii:6:004:1 -115:4 8 <
ffff88000e7b99c0 324136463 C Ii:6:004:1 0:4 8 = 0320a311 970d0000
ffff8801344f2cc0 324136761 S Ii:6:004:1 -115:4 8 <
ffff8801344f2cc0 324140456 C Ii:6:004:1 0:4 8 = 0320a311 970d0000
ffff8801344f2cc0 324146407 S Ii:6:004:1 -115:4 8 <
ffff8801344f2cc0 324148483 C Ii:6:004:1 0:4 8 = 03209411 a00d0000
ffff8801344f2cc0 324148563 S Ii:6:004:1 -115:4 8 <
ffff8801344f2cc0 324160460 C Ii:6:004:1 0:4 8 = 03208011 a50d0000
ffff8801344f2cc0 324160618 S Ii:6:004:1 -115:4 8 <
ffff8801344f2cc0 324172463 C Ii:6:004:1 0:4 8 = 03206811 a60d0000
ffff8801344f2cc0 324174323 S Ii:6:004:1 -115:4 8 <
ffff8801344f2cc0 324180468 C Ii:6:004:1 0:4 8 = 03204e11 a20d0000
ffff88000e7b9c00 324180832 S Ii:6:004:1 -115:4 8 <
ffff88000e7b9c00 324192479 C Ii:6:004:1 0:4 8 = 03203311 980d0000
ffff88000e7b9c00 324192549 S Ii:6:004:1 -115:4 8 <
ffff88000e7b9c00 324200477 C Ii:6:004:1 0:4 8 = 03201711 850d0000
ffff88000e7b9c00 324200539 S Ii:6:004:1 -115:4 8 <
ffff88000e7b9c00 324212485 C Ii:6:004:1 0:4 8 = 0320fb10 690d0000
ffff8801344f2cc0 324212564 S Ii:6:004:1 -115:4 8 <
ffff8801344f2cc0 324220464 C Ii:6:004:1 0:4 8 = 0320df10 440d0000
ffff88000e7b9240 324220700 S Ii:6:004:1 -115:4 8 <
ffff88000e7b9240 324232463 C Ii:6:004:1 0:4 8 = 0320c410 160d0000
ffff88000e7b9240 324232609 S Ii:6:004:1 -115:4 8 <
ffff88000e7b9240 324244470 C Ii:6:004:1 0:4 8 = 0320aa10 df0c0000
ffff88000e7b9240 324244559 S Ii:6:004:1 -115:4 8 <
ffff88000e7b9240 324256483 C Ii:6:004:1 0:4 8 = 03209410 a10c0000
ffff8801344f2f00 324256559 S Ii:6:004:1 -115:4 8 <
ffff8801344f2f00 324264466 C Ii:6:004:1 0:4 8 = 03208210 560c0000
ffff88000e7b9780 324265334 S Ii:6:004:1 -115:4 8 <
ffff88000e7b9780 324272658 C Ii:6:004:1 0:4 8 = 03207410 000c0000
ffff8801344f2f00 324272798 S Ii:6:004:1 -115:4 8 <
ffff8801344f2f00 324284495 C Ii:6:004:1 0:4 8 = 03206a10 a10b0000
ffff8801344f2f00 324284663 S Ii:6:004:1 -115:4 8 <
ffff8801344f2f00 324296474 C Ii:6:004:1 0:4 8 = 03206410 330b0000
ffff88000e7b9cc0 324296677 S Ii:6:004:1 -115:4 8 <
ffff88000e7b9cc0 324304623 C Ii:6:004:1 0:4 8 = 03206510 b10a0000
ffff8801344f2cc0 324304759 S Ii:6:004:1 -115:4 8 <
ffff8801344f2cc0 324316473 C Ii:6:004:1 0:4 8 = 03206e10 210a0000
ffff8801344f2cc0 324316594 S Ii:6:004:1 -115:4 8 <
ffff8801344f2cc0 324324468 C Ii:6:004:1 0:4 8 = 03207a10 83090000
ffff8801344f2cc0 324324637 S Ii:6:004:1 -115:4 8 <
ffff8801344f2cc0 324336491 C Ii:6:004:1 0:4 8 = 03208710 e9080000
ffff88000e7b9480 324336595 S Ii:6:004:1 -115:4 8 <
ffff88000e7b9480 324348485 C Ii:6:004:1 0:4 8 = 0320a110 4e080000
ffff8801344f2cc0 324348553 S Ii:6:004:1 -115:4 8 <
ffff8801344f2cc0 324356469 C Ii:6:004:1 0:4 8 = 0320be10 af070000
ffff8801344f2cc0 324356567 S Ii:6:004:1 -115:4 8 <
ffff8801344f2cc0 324368487 C Ii:6:004:1 0:4 8 = 0320e010 0b070000
ffff8801344f2cc0 324368586 S Ii:6:004:1 -115:4 8 <
ffff8801344f2cc0 324376658 C Ii:6:004:1 0:4 8 = 03201011 41060000
ffff88000e7b96c0 324376925 S Ii:6:004:1 -115:4 8 <
ffff88000e7b96c0 324379656 C Ii:6:004:1 0:4 8 = 03201011 41060000
ffff8801344f2f00 324385600 S Ii:6:004:1 -115:4 8 <
ffff8801344f2f00 324388471 C Ii:6:004:1 0:4 8 = 03204811 2c050000
ffff88000e7b9300 324389945 S Ii:6:004:1 -115:4 8 <
ffff88000e7b9300 324396487 C Ii:6:004:1 0:4 8 = 03208311 df030000
ffff8801344f2f00 324396546 S Ii:6:004:1 -115:4 8 <
ffff8801344f2f00 324524688 C Ii:6:004:1 0:4 8 = 03008311 df030000
ffff88000e7b9000 324524898 S Ii:6:004:1 -115:4 8 <
