ffff880028094b40 286336267 C Ii:6:004:2 0:2 6 = 050031c5 0000
ffff88000a208cc0 286336421 S Ii:6:004:2 -115:2 6 <
ffff88000a208cc0 286378250 C Ii:6:004:2 0:2 6 = 05000000 0000
ffff88010294ed80 286378376 S Ii:6:004:2 -115:2 6 <
ffff880028094840 286393266 C Ii:6:004:3 0:8 6 = 06000000 0000
ffff88010294ec00 286393406 S Ii:6:004:3 -115:8 6 <
ffff88010294ed80 288262335 C Ii:6:004:2 0:2 6 = 05000000 0000
ffff88000a208c00 288262493 S Ii:6:004:2 -115:2 6 <
ffff88010294ec00 288281338 C Ii:6:004:3 0:8 6 = 06000000 0000
ffff88010294ec00 288281515 S Ii:6:004:3 -115:8 6 <
ffff88000a208c00 289670349 C Ii:6:004:2 0:2 6 = 05000000 0000
ffff8800281d09c0 289670436 S Ii:6:004:2 -115:2 6 <
ffff88010294ec00 289681346 C Ii:6:004:3 0:8 6 = 06000000 0000
ffff8800281d0e40 289681513 S Ii:6:004:3 -115:8 6 <
